{
  "policy_results": {
    "raw": "                                              fund  ... tariff_num\n0                         PRIMARY HEALTH CARE FUND  ...      900.0\n1                         PRIMARY HEALTH CARE FUND  ...        NaN\n2                         PRIMARY HEALTH CARE FUND  ...       11.0\n3                         PRIMARY HEALTH CARE FUND  ...        NaN\n4                         PRIMARY HEALTH CARE FUND  ...        3.0\n5                         PRIMARY HEALTH CARE FUND  ...        3.0\n6                         PRIMARY HEALTH CARE FUND  ...      935.0\n7                         PRIMARY HEALTH CARE FUND  ...      500.0\n8                         PRIMARY HEALTH CARE FUND  ...        2.0\n9                    SOCIAL HEALTH INSUR ANCE FUND  ...        2.0\n10                   SOCIAL HEALTH INSUR ANCE FUND  ...        NaN\n11                   SOCIAL HEALTH INSUR ANCE FUND  ...        3.0\n12                   SOCIAL HEALTH INSUR ANCE FUND  ...       11.0\n13                   SOCIAL HEALTH INSUR ANCE FUND  ...       10.0\n14                   SOCIAL HEALTH INSUR ANCE FUND  ...        1.0\n15                   SOCIAL HEALTH INSUR ANCE FUND  ...        NaN\n16                   SOCIAL HEALTH INSUR ANCE FUND  ...        NaN\n17                   SOCIAL HEALTH INSUR ANCE FUND  ...        5.0\n18                   SOCIAL HEALTH INSUR ANCE FUND  ...       11.0\n19                   SOCIAL HEALTH INSUR ANCE FUND  ...        NaN\n20                   SOCIAL HEALTH INSUR ANCE FUND  ...        NaN\n21                   SOCIAL HEALTH INSUR ANCE FUND  ...        NaN\n22                   SOCIAL HEALTH INSUR ANCE FUND  ...      500.0\n23  EMERG ENCY, CHRONIC AND CRIT ICAL ILLNESS FUND  ...        4.0\n24  EMERG ENCY, CHRONIC AND CRIT ICAL ILLNESS FUND  ...     5015.0\n25  EMERG ENCY, CHRONIC AND CRIT ICAL ILLNESS FUND  ...        NaN\n26  EMERG ENCY, CHRONIC AND CRIT ICAL ILLNESS FUND  ...        3.0\n27  EMERG ENCY, CHRONIC AND CRIT ICAL ILLNESS FUND  ...       35.0\n28  EMERG ENCY, CHRONIC AND CRIT ICAL ILLNESS FUND  ...        5.0\n29  EMERG ENCY, CHRONIC AND CRIT ICAL ILLNESS FUND  ...        NaN\n30  EMERG ENCY, CHRONIC AND CRIT ICAL ILLNESS FUND  ...       55.0\n\n[31 rows x 7 columns]",
    "structured": "                                              fund  ...                                   access_rules_raw\n0                         PRIMARY HEALTH CARE FUND  ...  \u27a2 Each faci lity will bemappe dtoa Primary Car...\n1                         PRIMARY HEALTH CARE FUND  ...  based & private facili ties that report to the...\n2                         PRIMARY HEALTH CARE FUND  ...  \u27a2 Normal deli very - maximum stay of 48 hours ...\n3                         PRIMARY HEALTH CARE FUND  ...  \u27a2 Normal deli very - maximum stay of 48 hours ...\n4                         PRIMARY HEALTH CARE FUND  ...  \u27a2 Normal deli very - maximum stay of 48 hours ...\n..                                             ...  ...                                                ...\n92  EMERG ENCY, CHRONIC AND CRIT ICAL ILLNESS FUND  ...                                                   \n93  EMERG ENCY, CHRONIC AND CRIT ICAL ILLNESS FUND  ...  \u27a2 ICU up to 14 days \u27a2 HDU up to 10 days \u27a2 Co-p...\n94  EMERG ENCY, CHRONIC AND CRIT ICAL ILLNESS FUND  ...  \u27a2 Up to 60 days \u27a2 Co-pay ment for amounts abov...\n95  EMERG ENCY, CHRONIC AND CRIT ICAL ILLNESS FUND  ...                     \u27a2 Must be paid up SHIF member.\n96  EMERG ENCY, CHRONIC AND CRIT ICAL ILLNESS FUND  ...  \u27a2 Medical devices will only be issued to perso...\n\n[97 rows x 12 columns]",
    "wide": "                                              fund  ...                                   access_rules_raw\n0                         PRIMARY HEALTH CARE FUND  ...  \u27a2 Each faci lity will bemappe dtoa Primary Car...\n1                         PRIMARY HEALTH CARE FUND  ...  based & private facili ties that report to the...\n2                         PRIMARY HEALTH CARE FUND  ...  \u27a2 Normal deli very - maximum stay of 48 hours ...\n3                         PRIMARY HEALTH CARE FUND  ...  effect. All claims in this cate gory will have...\n4                         PRIMARY HEALTH CARE FUND  ...  \u27a2 Pros tate cancer scree ning will only be cov...\n5                         PRIMARY HEALTH CARE FUND  ...  \u27a2 Scree ning for cerv ical cancer will only be...\n6                         PRIMARY HEALTH CARE FUND  ...  \u27a2 Limit: KES. 1, 000 per House hold \u27a2 Pre- aut...\n7                         PRIMARY HEALTH CARE FUND  ...                               \u27a2 Limit up to 5 days\n8                         PRIMARY HEALTH CARE FUND  ...                         \u27a2 Admis sion up to 50 days\n9                    SOCIAL HEALTH INSUR ANCE FUND  ...  \u27a2 Limit: 4 Visits per year per person \u27a2 ARVs, ...\n10                   SOCIAL HEALTH INSUR ANCE FUND  ...                                                   \n11                   SOCIAL HEALTH INSUR ANCE FUND  ...  \u27a2 Limit: Up to 50 days per House hold \u27a2 Days a...\n12                   SOCIAL HEALTH INSUR ANCE FUND  ...  \u27a2 Normal deli very - maximum stay of 48 hours ...\n13                   SOCIAL HEALTH INSUR ANCE FUND  ...  \u27a2 Maximum of 3 sess ions per week for haemo di...\n14                   SOCIAL HEALTH INSUR ANCE FUND  ...  \u27a2 Max. 7 outpat ient visits \u27a2 Toac cess the be...\n15                   SOCIAL HEALTH INSUR ANCE FUND  ...  \u27a2 Minor surg ical proced ures per formed at Le...\n16                   SOCIAL HEALTH INSUR ANCE FUND  ...                                                   \n17                   SOCIAL HEALTH INSUR ANCE FUND  ...  \u27a2 Diagn osis & staging - Limit of KES. 100, 00...\n18                   SOCIAL HEALTH INSUR ANCE FUND  ...  \u27a2 MRI at 2 images per HH - limited to Infec ti...\n19                   SOCIAL HEALTH INSUR ANCE FUND  ...  (.. cysti cors olid ), detecti onof for eignbo...\n20                   SOCIAL HEALTH INSUR ANCE FUND  ...  \u27a2 Quart erly limit of 5, 000 per person as cap...\n21                   SOCIAL HEALTH INSUR ANCE FUND  ...  \u27a2 Quart erly limit of 5, 000 per person as cap...\n22                   SOCIAL HEALTH INSUR ANCE FUND  ...                               \u27a2 Limit up to 5 days\n23  EMERG ENCY, CHRONIC AND CRIT ICAL ILLNESS FUND  ...  \u27a2 Access ible by all Kenyans \u27a2 Procure ment of...\n24  EMERG ENCY, CHRONIC AND CRIT ICAL ILLNESS FUND  ...  \u27a2 Resus cita tion and stabi liza tion to be ac...\n25  EMERG ENCY, CHRONIC AND CRIT ICAL ILLNESS FUND  ...                                                   \n26  EMERG ENCY, CHRONIC AND CRIT ICAL ILLNESS FUND  ...                                                   \n27  EMERG ENCY, CHRONIC AND CRIT ICAL ILLNESS FUND  ...  \u27a2 ICU up to 14 days \u27a2 HDU up to 10 days \u27a2 Co-p...\n28  EMERG ENCY, CHRONIC AND CRIT ICAL ILLNESS FUND  ...  \u27a2 Up to 60 days \u27a2 Co-pay ment for amounts abov...\n29  EMERG ENCY, CHRONIC AND CRIT ICAL ILLNESS FUND  ...                     \u27a2 Must be paid up SHIF member.\n30  EMERG ENCY, CHRONIC AND CRIT ICAL ILLNESS FUND  ...  \u27a2 Medical devices will only be issued to perso...\n\n[31 rows x 11 columns]",
    "exploded": "                                               fund  ... mapping_type\n0                          PRIMARY HEALTH CARE FUND  ...        block\n1                          PRIMARY HEALTH CARE FUND  ...        block\n2                          PRIMARY HEALTH CARE FUND  ...        block\n3                          PRIMARY HEALTH CARE FUND  ...        block\n4                          PRIMARY HEALTH CARE FUND  ...        block\n..                                              ...  ...          ...\n163  EMERG ENCY, CHRONIC AND CRIT ICAL ILLNESS FUND  ...        block\n164  EMERG ENCY, CHRONIC AND CRIT ICAL ILLNESS FUND  ...        block\n165  EMERG ENCY, CHRONIC AND CRIT ICAL ILLNESS FUND  ...        block\n166  EMERG ENCY, CHRONIC AND CRIT ICAL ILLNESS FUND  ...        block\n167  EMERG ENCY, CHRONIC AND CRIT ICAL ILLNESS FUND  ...     itemized\n\n[168 rows x 10 columns]"
  },
  "annex_results": {
    "procedures": "      id  ...    tariff\n0      1  ...  620000.0\n1      2  ...  414400.0\n2      3  ...  201600.0\n3      4  ...  504000.0\n4      5  ...  537600.0\n..   ...  ...       ...\n723  724  ...  280000.0\n724  725  ...  134400.0\n725  726  ...   33600.0\n726  727  ...  180000.0\n727  728  ...  280000.0\n\n[728 rows x 4 columns]"
  },
  "ai_analysis": {
    "contradictions": [
      {
        "contradiction_id": "DIAL_001_CRITICAL",
        "medical_specialty": "nephrology",
        "contradiction_type": "session_frequency_medical_inconsistency",
        "clinical_severity": "CRITICAL",
        "description": "Policy allows 3 haemodialysis (HD) sessions/week but restricts haemodiafiltration (HDF) to 2 sessions/week for equivalent end-stage renal disease (ESRD) care.",
        "medical_analysis": {
          "clinical_rationale": "HD and HDF are renal replacement therapies whose adequacy is defined by weekly delivered clearance (e.g., Kt/V). Clinical outcomes depend on total weekly clearance and fluid removal rather than modality name; therefore weekly session frequency standards should be equivalent for clinically similar indications.",
          "medical_standards": "KDOQI guidance (and international dialysis standards) require a minimum of thrice-weekly HD or equivalent delivered clearance for most chronic ESRD patients; HDF has no evidence-based rationale for lower frequency limits.",
          "clinical_equivalence": "HDF provides convective clearance but is not a lesser therapy; for chronic dialysis patients, both modalities generally require comparable frequency to achieve adequate solute and volume control.",
          "contraindication_assessment": "No routine clinical indications justify systematically permitting fewer HDF sessions than HD for maintenance dialysis; doing so would constitute an unsafe restriction."
        },
        "patient_safety_impact": {
          "immediate_risk": "Patients assigned HDF by policy risk receiving inadequate dialysis frequency and clearance.",
          "clinical_consequences": "Inadequate dialysis \u2192 accumulation of uremic toxins, hyperkalemia, fluid overload, pulmonary edema, hypertension, and increased cardiovascular events.",
          "survival_impact": "Reduced dialysis adequacy/frequency is associated with higher hospitalization rates and increased mortality in ESRD cohorts.",
          "quality_of_life": "Symptoms (fatigue, pruritus, nausea, cognitive impairment) and loss of functional status will increase."
        },
        "kenya_health_system_impact": {
          "facility_level_effects": "Level 4-6 hospitals that provide advanced dialysis modalities could face conflicting billing/authorization rules, causing delays in scheduling or modality selection.",
          "geographic_access": "Rural patients (70% of population) already limited to fewer centers; arbitrary modality-based frequency limits will force travel or under-treatment.",
          "resource_allocation": "Advanced HDF-capable machines may be underutilized or used suboptimally, wasting scarce capital.",
          "provider_training": "Nephrology teams will need urgent policy clarification to avoid under-dialysis and legal/ethical conflicts across 47 counties."
        },
        "epidemiological_context": {
          "disease_burden": "Chronic kidney disease is rising in Kenya with hypertension prevalent in ~24% of adults \u2014 a sizable at-risk population.",
          "population_impact": "Applying modality-based frequency restrictions could disproportionately harm the rural majority dependent on fewer dialysis centres.",
          "health_system_capacity": "Limited dialysis capacity at Level 4-6 magnifies any policy-driven reduction in delivered dialysis."
        },
        "evidence_documentation": {
          "policy_text_hd": "Maximum of 3 sessions per week for haemodialysis",
          "policy_text_hdf": "Maximum of 2 sessions per week for haemodiafiltration",
          "page_references": [
            "p8_renal_care",
            "p8_advanced_dialysis",
            "annex_renal_procedures"
          ],
          "clinical_guidelines": "KDOQI Clinical Practice Guidelines; ISPD/ERA-EDTA consensus on dialysis adequacy"
        },
        "recommended_resolution": {
          "immediate_action": "Issue interim clinical directive permitting equivalent session frequency (minimum 3x/week) for HDF and HD where clinically indicated; suspend any modality-specific frequency limits.",
          "policy_revision": "Amend renal care benefit language to define adequacy by weekly clearance targets (Kt/V or equivalent) rather than modality-specific session caps.",
          "implementation_steps": [
            "Distribute urgent circular to all accredited dialysis centres and county health directors clarifying interim practice.",
            "Update benefit package and claims rules to remove modality-based frequency differentials.",
            "Train nephrology teams and administrative staff across 47 counties on revised criteria and claims handling."
          ],
          "timeline": "Immediate (interim directive within 72 hours); formal policy revision within 30 days."
        },
        "quality_metrics": {
          "detection_confidence": 0.99,
          "clinical_impact_score": 9.7,
          "urgency_level": "CRITICAL_IMMEDIATE_ACTION",
          "validation_method": "Cross-reference with KDOQI and policy text contradictions"
        },
        "pdf_page_sources": [
          "Pages 1-18 (Policy Structure)",
          "Pages 19-54 (Annex Procedures)"
        ],
        "validation_ready": true
      },
      {
        "contradiction_id": "EMER_002_CRITICAL",
        "medical_specialty": "emergency_medicine / critical_care",
        "contradiction_type": "emergency_access_vs_level_mismatch",
        "clinical_severity": "CRITICAL",
        "description": "Critical illness and emergency care packages are funded and described, but access point designations predominantly restrict services to Level 4-6 centers while other policy language and county-level realities require timely emergency interventions at lower-level facilities (Level 2-3). This creates direct conflicts for time-sensitive care.",
        "medical_analysis": {
          "clinical_rationale": "Emergency conditions (sepsis, acute MI, stroke, obstetric hemorrhage, traumatic injuries) require rapid initial stabilization \u2014 airway, breathing, circulation, and time-sensitive interventions \u2014 that cannot be safely deferred pending transfer if lower levels are not permitted to provide covered emergency care.",
          "medical_standards": "WHO Essential Emergency Care systems and Emergency Triage guidelines require stabilization capacity at first-contact facilities; referral pathways are intended for definitive care, not initial life-saving interventions.",
          "clinical_equivalence": "Stabilization (oxygen, IV fluids, initial antibiotics, airway management) is standard across facility levels; coverage limitations that force delays violate emergency care principles.",
          "contraindication_assessment": "No clinical or safety rationale supports denying coverage for initial emergency stabilization at Level 2-3 when those facilities are the first point of contact."
        },
        "patient_safety_impact": {
          "immediate_risk": "Patients in rural/remote areas may be denied covered stabilization or face claims denial for life-saving interventions performed at Level 2-3.",
          "clinical_consequences": "Delays in stabilization/transfer increase mortality in sepsis, major hemorrhage, acute coronary syndromes, stroke, and trauma.",
          "survival_impact": "Time-to-treatment is a key predictor of survival; policy-induced delays will increase preventable deaths.",
          "quality_of_life": "Survivors of delayed emergency care have higher rates of disability (e.g., post-stroke deficits, amputations after limb ischemia)."
        },
        "kenya_health_system_impact": {
          "facility_level_effects": "Uneven coverage discourages lower-level facilities from investing in emergency capacity and may create perverse incentives to bypass local care.",
          "geographic_access": "Rural majority (70%) disproportionately affected \u2014 long travel times to Level 4-6 centres compound risks.",
          "resource_allocation": "Funds concentrated on Level 4-6 for definitive care while neglecting emergency stabilization capacity at lower levels.",
          "provider_training": "Confusion on what emergency care is reimbursable at each level will hamper triage, delay treatment, and fracture referral systems across 47 counties."
        },
        "epidemiological_context": {
          "disease_burden": "Top causes of death (pneumonia, cancer, CVD) and high admission rates for CVD (25%) require robust emergency response capabilities across levels.",
          "population_impact": "Emergency access limitations will worsen mortality for leading causes and emergencies among rural populations.",
          "health_system_capacity": "Limited availability of ambulances and Level 4-6 facilities increases dependence on lower-level stabilization capacity."
        },
        "evidence_documentation": {
          "policy_text_summary": "Emergency, Chronic and Critical Illness Fund exists but access designations concentrated at Level 4-6; some emergency packages listed under Level 2-3 but without clear scope.",
          "page_references": [
            "p4_emergency_package",
            "p6_access_points",
            "annex_emergency_procedures"
          ],
          "clinical_guidelines": "WHO Emergency Care Systems Framework; Kenya emergency medicine operational guidance"
        },
        "recommended_resolution": {
          "immediate_action": "Issue directive that covers and reimburses initial emergency stabilization (ABC resuscitation, airway management, bleeding control, initial antibiotics, fluids, analgesia) at first-contact facilities (Level 2-3) with defined documentation and transfer criteria.",
          "policy_revision": "Redefine emergency care benefits to differentiate between (a) stabilization at first contact (covered at Level 2-3), (b) definitive care (Level 4-6), and (c) clear referral/transfer escalation protocols.",
          "implementation_steps": [
            "Publish clinical stabilization package and billing codes for Level 2-3 facilities.",
            "Train clinicians and administrative staff on documentation requirements for emergency stabilization and referral.",
            "Equip and resource key Level 2-3 facilities with essential emergency supplies (oxygen, basic airway tools, IV fluids, basic monitoring).",
            "Establish audit and quality metrics for time-to-stabilization and transfer."
          ],
          "timeline": "Interim guidance within 7 days; policy revision and training rollout within 90 days."
        },
        "quality_metrics": {
          "detection_confidence": 0.96,
          "clinical_impact_score": 9.4,
          "urgency_level": "CRITICAL_IMMEDIATE_ACTION",
          "validation_method": "Cross-check of access point distribution vs accepted emergency care frameworks"
        },
        "pdf_page_sources": [
          "Pages 1-18 (Policy Structure)"
        ],
        "validation_ready": true
      },
      {
        "contradiction_id": "OBS_003_CRITICAL",
        "medical_specialty": "obstetrics",
        "contradiction_type": "maternal_surgical_access_mismatch",
        "clinical_severity": "CRITICAL",
        "description": "Policy lists obstetric services/delivery care within packages but several obstetric surgical procedures (cesarean section, management of obstetric hemorrhage, operative anesthesia) are either not explicitly assigned to appropriate Level 4-6 facilities or are ambiguously authorized at lower-level facilities lacking surgical capacity.",
        "medical_analysis": {
          "clinical_rationale": "Cesarean delivery and operative management of obstetric emergencies require sterile operating theatres, skilled surgical and anesthesia teams, blood transfusion capability, newborn resuscitation, and post-op critical care \u2014 infrastructure typically available at Level 4-6.",
          "medical_standards": "WHO and ACOG standards require that emergency obstetric surgery be performed in facilities with surgical, anesthesia, transfusion and neonatal support. Lower-level facilities should provide stabilization and rapid referral.",
          "clinical_equivalence": "Performing major obstetric surgery in inadequately resourced settings increases risk of perioperative hemorrhage, anesthesia complications, maternal death, and neonatal morbidity.",
          "contraindication_assessment": "Authorizing cesarean sections at Level 2-3 without explicit facility readiness criteria is clinically unsafe."
        },
        "patient_safety_impact": {
          "immediate_risk": "Maternal hemorrhage, anesthesia complications, and neonatal hypoxia risk increase if surgical procedures performed in under-equipped settings.",
          "clinical_consequences": "Higher maternal mortality, higher rates of severe maternal morbidity (hysterectomy, multi-organ failure), neonatal death and long-term disability.",
          "survival_impact": "Delays in appropriate surgical care or inappropriate attempts at surgery in under-resourced facilities will increase maternal and perinatal mortality.",
          "quality_of_life": "Survivors may have chronic health impairments and reduced future reproductive options."
        },
        "kenya_health_system_impact": {
          "facility_level_effects": "Confusion about where cesareans are authorized will lead to inappropriate case selection at lower-level facilities or delays in transfer to Level 4-6 centres.",
          "geographic_access": "Rural women may be falsely reassured that surgical care is locally available or conversely be denied timely surgery when needed.",
          "resource_allocation": "Counties may misallocate investments, failing to strengthen clear regional surgical centres and referral transport.",
          "provider_training": "Midwives and clinicians need unambiguous protocols for stabilization, indications for transfer, and documentation to ensure coverage and safety."
        },
        "epidemiological_context": {
          "disease_burden": "Maternal causes remain critical contributors to morbidity and death; pneumonia and CVD also interact with pregnancy risks.",
          "population_impact": "Rural maternal populations are most vulnerable; Kenya's facility tiering must align with safe surgical thresholds.",
          "health_system_capacity": "Only Level 4-6 facilities likely have consistent blood transfusion, anesthesia and neonatal support \u2014 policies must reflect that reality."
        },
        "evidence_documentation": {
          "policy_text_summary": "Obstetric procedures included in packages (Obs & Gyn 46 annex entries) but access point mapping shows entries across Level 2-6 and several ambiguous Level 2-3 authorizations without facility readiness criteria.",
          "page_references": [
            "p6_maternal_package",
            "p6_access_points",
            "annex_obs_gyn_procedures"
          ],
          "clinical_guidelines": "WHO Safe Surgery and Emergency Obstetric Care guidance; ACOG practice bulletins"
        },
        "recommended_resolution": {
          "immediate_action": "Issue directive clarifying that cesarean sections and operative obstetric procedures are to be covered and performed only at facilities meeting defined surgical, anesthesia, blood transfusion, and neonatal care readiness (minimum Level 4), except in documented, life-saving stabilization scenarios.",
          "policy_revision": "Codify facility readiness criteria within benefit package; define covered stabilization interventions at Level 2-3 and transfer protocols with reimbursement guarantees.",
          "implementation_steps": [
            "Map current facilities to readiness matrix; publicize designated obstetric surgical centres per county.",
            "Set clear billing rules covering stabilization care at lower levels and definitive surgery at designated Level 4-6 hospitals.",
            "Invest rapidly in referral transport/ambulance coverage to reduce transfer delays.",
            "Provide training and simulations in emergency obstetric stabilization to Level 2-3 staff."
          ],
          "timeline": "Interim clarification within 14 days; full mapping and policy update within 60\u201390 days."
        },
        "quality_metrics": {
          "detection_confidence": 0.95,
          "clinical_impact_score": 9.6,
          "urgency_level": "CRITICAL_WITHIN_30_DAYS",
          "validation_method": "Comparison of annex procedure locations vs required surgical readiness standards"
        },
        "pdf_page_sources": [
          "Pages 1-18 (Policy Structure)",
          "Pages 19-54 (Annex Procedures)"
        ],
        "validation_ready": true
      },
      {
        "contradiction_id": "PED_004_HIGH",
        "medical_specialty": "pediatrics",
        "contradiction_type": "insufficient_pediatric_specificity_age_inappropriate_protocols",
        "clinical_severity": "HIGH",
        "description": "Pediatric services are under-represented (12 annex entries) and many benefit descriptions appear adult-centric, with no explicit age-specific dosing, equipment, or follow-up requirements \u2014 risking application of adult protocols to children.",
        "medical_analysis": {
          "clinical_rationale": "Children have distinct physiological responses, weight-based drug dosing, equipment size requirements (airways, vascular access), and different thresholds for interventions; adult protocols cannot be safely applied without pediatric adaptation.",
          "medical_standards": "Paediatric care standards (WHO, UNICEF, Paediatric Societies) mandate age/weight-based guidelines, pediatric emergency triage, and appropriate equipment availability.",
          "clinical_equivalence": "Certain procedures may be clinically similar across ages, but safety depends on pediatric expertise and resources.",
          "contraindication_assessment": "Absence of pediatric-specific protocols constitutes an implicit contraindication to safe pediatric care under the same terms as adult care."
        },
        "patient_safety_impact": {
          "immediate_risk": "Medication dosing errors, incorrect device sizes, inadequate monitoring, and inappropriate use of adult-sized interventions.",
          "clinical_consequences": "Increased risk of respiratory compromise, fluid/electrolyte errors, medication toxicity or underdosing, and poor outcomes in sepsis or neonatal emergencies.",
          "survival_impact": "Potential for higher pediatric morbidity and mortality, particularly among neonates and infants.",
          "quality_of_life": "Risk of long-term developmental injury from substandard acute management."
        },
        "kenya_health_system_impact": {
          "facility_level_effects": "Lower-level facilities serving children may be falsely considered 'covered' for services without pediatric specifications, leading to unsafe care practices.",
          "geographic_access": "Rural children disproportionately affected by lack of pediatric-specific services and equipment distribution.",
          "resource_allocation": "Without explicit pediatric requirements, supply chains may not prioritize pediatric-sized consumables and meds.",
          "provider_training": "Clinicians and pharmacists need pediatric dosing references and triage training to avoid errors across 47 counties."
        },
        "epidemiological_context": {
          "disease_burden": "Pneumonia is the leading registered cause of death \u2014 a disease particularly lethal in children if not managed with age-appropriate care.",
          "population_impact": "Children in rural areas (70% of population) at highest risk from adult-centric policies.",
          "health_system_capacity": "Limited pediatric specialists (only 12 annex entries) signal gaps in capacity to manage pediatric emergencies and chronic conditions."
        },
        "evidence_documentation": {
          "policy_text_summary": "Only 12 paediatric procedures in annex; many service packages lack explicit pediatric adaptation/instructions.",
          "page_references": [
            "annex_paediatric_procedures",
            "p5_pharmacy_package",
            "p6_emergency_package"
          ],
          "clinical_guidelines": "WHO Pocket Book of Hospital Care for Children; Kenyan paediatric emergency care recommendations"
        },
        "recommended_resolution": {
          "immediate_action": "Issue guidance requiring that all clinical pathways and drug lists include pediatric age/weight-based dosing and a minimum list of pediatric-sized equipment for each facility level.",
          "policy_revision": "Expand pediatric annex with clear delineation of covered pediatric procedures, minimum competency and equipment per level, and referral expectations.",
          "implementation_steps": [
            "Create and distribute pediatric dosing charts and emergency algorithms to all facilities.",
            "Audit stocklists to ensure pediatric consumables (masks, ET tubes, intraosseous kits, weight-based drug formulations) are available.",
            "Train clinicians in pediatric emergency triage (ETAT or equivalent) and weight-based dosing."
          ],
          "timeline": "Guidance within 14 days; rollout and audits within 90 days."
        },
        "quality_metrics": {
          "detection_confidence": 0.92,
          "clinical_impact_score": 8.6,
          "urgency_level": "HIGH_WITHIN_30_DAYS",
          "validation_method": "Gap analysis of annex pediatric entries vs expected pediatric service needs"
        },
        "pdf_page_sources": [
          "Pages 1-18 (Policy Structure)",
          "Pages 19-54 (Annex Procedures)"
        ],
        "validation_ready": true
      },
      {
        "contradiction_id": "NEURO_005_HIGH",
        "medical_specialty": "neurosurgery / interventional_radiology",
        "contradiction_type": "complex_procedures_at_low_level_facilities",
        "clinical_severity": "HIGH",
        "description": "Annex lists neurosurgery (29) and interventional radiology (32) procedures but access point mapping includes ambiguous authorizations at lower levels (Level 2-3), risking performance of high-complexity procedures in under-resourced settings.",
        "medical_analysis": {
          "clinical_rationale": "Complex neurosurgical and interventional radiology procedures require specialized theatres, imaging (CT/MRI/fluoroscopy), intensive care, neuro-anesthesia, blood products, and trained multidisciplinary teams \u2014 typically available at tertiary centres (Level 5-6).",
          "medical_standards": "Neurosurgical societies and surgical safety guidelines require defined facility capabilities and postoperative neurocritical care for complex intracranial/vascular interventions.",
          "clinical_equivalence": "Attempting such procedures at lower-level facilities lacking imaging or ICU capacity increases perioperative morbidity and mortality.",
          "contraindication_assessment": "Performing complex neurosurgical or IR procedures outside designated centres is contraindicated unless stringent readiness criteria are met."
        },
        "patient_safety_impact": {
          "immediate_risk": "Intraoperative complications without access to imaging or intensive monitoring; inability to manage hemorrhagic complications or need for urgent re-intervention.",
          "clinical_consequences": "Increased neurologic deficits, reoperation rates, infections, and preventable deaths.",
          "survival_impact": "Higher perioperative mortality and long-term disability due to inadequate postoperative care.",
          "quality_of_life": "Long-term disability burden increases, straining families and social support systems."
        },
        "kenya_health_system_impact": {
          "facility_level_effects": "Lower-level hospitals might attempt to perform procedures outside their capacity, exposing staff and hospitals to adverse outcomes and potential litigation.",
          "geographic_access": "Rural patients could either be denied care locally or receive unsafe local interventions instead of transfer to Level 5-6 centres.",
          "resource_allocation": "Misplaced investments could be made in lower-level centres without establishing full perioperative support.",
          "provider_training": "Surgeons and physicians need clear scope-of-practice definitions and referral pathways to avoid unsafe practice."
        },
        "epidemiological_context": {
          "disease_burden": "Trauma, stroke and vascular disease contribute significantly to hospital admissions and need timely specialized interventions.",
          "population_impact": "Limited tertiary centres (Level 4-6 designated for specialized imaging) mean rural patients are most at risk from misdirected policies.",
          "health_system_capacity": "Imaging and ICU capacity concentrated in Level 4-6; policy must reflect this reality."
        },
        "evidence_documentation": {
          "policy_text_summary": "Interventional Radiology and Neurosurgery procedures listed in annex but access point data contains entries indicating Level 2-3 or ambiguous Level 2-6 designations.",
          "page_references": [
            "annex_neurosurgery",
            "annex_interventional_radiology",
            "p6_access_points"
          ],
          "clinical_guidelines": "WFNS/Neurosurgical Society recommendations; interventional radiology facility standards"
        },
        "recommended_resolution": {
          "immediate_action": "Publish a list of designated centres allowed to perform complex neurosurgical and IR procedures, and prohibit these procedures at lower-level facilities unless documented readiness criteria are met.",
          "policy_revision": "Define procedure-specific facility readiness (imaging, ICU, blood bank, specialist teams) and align annex access points to these criteria.",
          "implementation_steps": [
            "Map and accredit tertiary surgical centres per county/region.",
            "Create referral/transfer protocols and emergency transport agreements.",
            "Establish telemedicine consult pathways for triage decisions from lower-level facilities."
          ],
          "timeline": "Directive within 14 days; accreditation and mapping within 60 days."
        },
        "quality_metrics": {
          "detection_confidence": 0.93,
          "clinical_impact_score": 8.9,
          "urgency_level": "HIGH_WITHIN_30_DAYS",
          "validation_method": "Cross-reference of annex procedures vs access point allocations and facility capability expectations"
        },
        "pdf_page_sources": [
          "Pages 1-18 (Policy Structure)",
          "Pages 19-54 (Annex Procedures)"
        ],
        "validation_ready": true
      },
      {
        "contradiction_id": "ADMIN_006_MODERATE",
        "medical_specialty": "health_systems / policy",
        "contradiction_type": "missing_tariffs_and_fund_designations_creating_provider_confusion",
        "clinical_severity": "MODERATE",
        "description": "Most policy entries lack explicit fund designations (only 3/97 non-empty) and there are zero tariff entries. This administrative gap creates high risk for claims denial, delayed care authorizations, and inconsistent provider behaviour.",
        "medical_analysis": {
          "clinical_rationale": "Clear funding source and tariffs allow providers to know which services are reimbursable, how to code claims, and what preauthorization is required \u2014 absence leads to uncertainty and potential denial of essential care.",
          "medical_standards": "Health financing best practice requires transparent benefit packages with pricing and funding streams to enable predictable service delivery.",
          "clinical_equivalence": "Lack of tariffs is not a clinical contradiction per se but directly affects patient access and timely care.",
          "contraindication_assessment": "No medical contraindications result, but administrative ambiguity translates into care access barriers."
        },
        "patient_safety_impact": {
          "immediate_risk": "Delays in care while funding/authorization is clarified; potential refusal of emergency interventions pending preauthorization.",
          "clinical_consequences": "Worsening of conditions that could have been promptly treated; increased avoidable admissions.",
          "survival_impact": "Indirect increase in morbidity/mortality due to delayed or denied care.",
          "quality_of_life": "Financial unpredictability and interrupted treatments reduce adherence and continuity of care."
        },
        "kenya_health_system_impact": {
          "facility_level_effects": "Providers may refuse or delay services due to uncertain reimbursement, particularly in resource-constrained lower-level facilities.",
          "geographic_access": "Counties with weaker administrative support will face more frequent coverage denial or delays.",
          "resource_allocation": "Unable to plan budgets, procure consumables or staff because pricing and fund streams are undefined.",
          "provider_training": "Administrative staff and clinicians will be confused about preauthorization processes and eligible services across 47 counties."
        },
        "epidemiological_context": {
          "disease_burden": "High-burden conditions (CVD, cancer, pneumonia, CKD) need predictable financing to ensure continuity of expensive chronic and emergency care.",
          "population_impact": "Vulnerable populations (rural, low-income) most at risk of losing access if facilities stop providing services without clear reimbursement.",
          "health_system_capacity": "Lack of tariffs undermines attempts to scale services at necessary facility levels."
        },
        "evidence_documentation": {
          "policy_text_summary": "Entries with Fund info: 3/97 non-empty; Entries with Tariffs: 0; Entries with Service info: 6/97 \u2014 widespread omissions noted.",
          "page_references": [
            "p2_funding_summary",
            "p3_benefit_definitions",
            "annex_financials"
          ],
          "clinical_guidelines": "WHO UHC and health financing best practice documentation"
        },
        "recommended_resolution": {
          "immediate_action": "Issue administrative guidance to temporarily accept a standardized claims code set and provisional pricing schedule for urgent services to avoid denials.",
          "policy_revision": "Complete benefit package with explicit fund assignment and tariffs for all listed services; publish clear preauthorization and emergency exemption rules.",
          "implementation_steps": [
            "Rapidly draft provisional tariffs for high-priority services (emergency stabilization, dialysis, obstetric surgery) and circulate to counties.",
            "Schedule stakeholder consultations with providers, county health directors and insurers to finalize tariffs.",
            "Deploy training to administrative staff on claims submission and emergency preauthorization exemptions."
          ],
          "timeline": "Provisional tariff schedule within 14 days; full tariff and fund assignment within 90 days."
        },
        "quality_metrics": {
          "detection_confidence": 0.94,
          "clinical_impact_score": 7.2,
          "urgency_level": "MODERATE_URGENT",
          "validation_method": "Quantitative review of dataset fields and administrative requirements"
        },
        "pdf_page_sources": [
          "Pages 19-54 (Annex Procedures)"
        ],
        "validation_ready": true
      }
    ],
    "gaps": [
      {
        "gap_id": "CVD_REHAB_CRITICAL_001",
        "gap_category": "cardiovascular_rehabilitation_services",
        "gap_type": "missing_essential_service",
        "clinical_priority": "HIGH",
        "description": "Comprehensive cardiac rehabilitation and structured secondary prevention services are largely absent outside a few tertiary centres despite cardiovascular disease causing 25% of admissions and 13% of deaths.",
        "kenya_epidemiological_context": {
          "disease_burden": "CVD accounts for ~25% of hospital admissions and ~13% of deaths; hypertension prevalence ~24% of adults.",
          "prevalence_data": "Estimated 13.4 million adults with hypertension; rising ischemic heart disease and heart failure admissions.",
          "current_outcomes": "High readmission rates, prolonged disability, suboptimal risk-factor control.",
          "geographic_burden": "Concentrated in urban and peri\u2011urban areas but expanding into rural counties as risk factors rise."
        },
        "affected_populations": {
          "primary_population": "Patients post-acute coronary syndrome, heart failure, valve surgery and stroke needing secondary prevention and rehab.",
          "estimated_annual_cases": "Approx. 250,000\u2013320,000 admissions annually relevant for rehab (based on 25% of total admissions estimate).",
          "demographic_profile": "Adults aged 40+ (rising burden in middle-aged adults); heavier burden in urban counties.",
          "vulnerable_groups": "Rural patients with poor access to tertiary centres, low-income households, elderly."
        },
        "current_coverage_assessment": {
          "existing_services": "Limited cardiac rehab programmes at KNH, MTRH and select private hospitals; few outpatient/community links.",
          "geographic_availability": "Mostly Nairobi, Mombasa and a handful of county referral hospitals; >40 counties lack services.",
          "capacity_utilization": "Tertiary sites operating over capacity with long waits for enrolment.",
          "wait_times": "Assessment-to-enrolment waits reported 3\u20138 months in tertiary centres."
        },
        "health_system_impact_analysis": {
          "level_1_2_impact": "No community-based secondary prevention integration with CHVs and primary care.",
          "level_3_impact": "Health centres cannot provide structured rehabilitation or risk-factor clinics.",
          "level_4_impact": "County hospitals need dedicated rehab outpatient clinics and equipment.",
          "level_5_6_impact": "Tertiary hospitals carry the bulk of complex rehab without community continuation.",
          "referral_pathway_gaps": "No standardised discharge-to-community rehabilitation pathway; poor follow-up and adherence monitoring."
        },
        "clinical_evidence_base": {
          "international_guidelines": "WHO PEN and ESC guidelines recommend structured cardiac rehab and risk-factor management.",
          "clinical_effectiveness": "Cardiac rehab reduces mortality 13\u201320% and readmissions ~25% in meta-analyses.",
          "timing_criticality": "Optimal within first 12 weeks post-event for maximal functional recovery.",
          "cost_effectiveness": "Demonstrated reductions in long-term costs through fewer readmissions and improved productivity."
        },
        "recommended_interventions": {
          "immediate_additions": [
            "Establish cardiac rehab units at all Level 5\u20136 hospitals and pilot community rehab in 10 high-burden counties.",
            "Integrate outpatient secondary prevention clinics at Level 4\u20135 with tele-rehab components.",
            "Standardised discharge plans linking patients to CHVs and county NCD clinics."
          ],
          "service_specifications": [
            "12-week structured programme: supervised exercise, risk-factor counselling, psychosocial support, medication optimisation.",
            "Multidisciplinary teams: cardiologist/physician, physiotherapist, nurse, nutritionist, psychologist.",
            "Monitoring and referral protocols with clear KPIs."
          ],
          "implementation_phases": [
            "Phase 1 (0\u20136 months): Pilot 10 county hospitals + training of multidisciplinary teams.",
            "Phase 2 (6\u201318 months): Scale to all Level 5 facilities and select Level 4 centres with high caseloads.",
            "Phase 3 (18\u201336 months): Community-based continuation in all counties; telehealth integration for remote follow\u2011up."
          ]
        },
        "resource_requirements": {
          "human_resources": "Training for ~800 physiotherapists, 400 cardiac rehab nurses and 200 specialists countrywide.",
          "infrastructure": "Exercise areas, ECG monitoring, basic rehab equipment, telehealth kits for remote follow-up.",
          "training_needs": "Short-course cardiac rehab certification, CME for primary care on secondary prevention.",
          "estimated_cost": "KES 4.2 billion over 3 years for phased national rollout (capital + recurrent + training)."
        },
        "implementation_feasibility": {
          "technical_feasibility": "HIGH \u2014 builds on existing cardiology and physiotherapy cadres with scalable telehealth options.",
          "financial_feasibility": "MEDIUM \u2014 upfront capital, but high ROI via reduced admissions and improved productivity.",
          "political_feasibility": "HIGH \u2014 aligns with county NCD priorities and UHC agenda.",
          "timeline_realistic": "3 years for meaningful nationwide coverage with pilots in Year 1."
        },
        "success_metrics": {
          "process_indicators": "Number of facilities offering cardiac rehab; patients enrolled and completing 12-week programmes.",
          "outcome_indicators": "30\u2011day and 1\u2011year readmission rates, BP and lipid control rates at 6 months.",
          "impact_indicators": "Reduction in CVD mortality and hospital bed-days attributable to CVD.",
          "equity_indicators": "Proportion of counties with functioning rehab services; rural vs urban enrolment rates."
        },
        "kenya_context_integration": {
          "county_variations": "Urban counties require advanced programmes; poorer/rural counties require basic home/community rehab models.",
          "cultural_considerations": "Family\u2011centred rehab messaging and use of CHVs to support adherence.",
          "integration_opportunities": "Link with existing NCD clinics, community health strategy and NHIF benefit packages.",
          "sustainability_factors": "County ownership, incorporation into NHIF and PHC fund lines, task\u2011shifting to nurses and CHVs."
        },
        "pdf_page_sources": [
          "Pages 1-18 (Policy Structure)",
          "Pages 19-54 (Annex Procedures)"
        ],
        "validation_ready": true
      },
      {
        "gap_id": "CANCER_EARLY_DETECTION_002",
        "gap_category": "cancer_early_detection_and_access_to_curative_treatment",
        "gap_type": "insufficient_service_coverage",
        "clinical_priority": "HIGH",
        "description": "Late diagnosis and limited access to diagnostic imaging, pathology and radiotherapy contribute to high cancer mortality; early detection and treatment capacity is inadequate across most counties.",
        "kenya_epidemiological_context": {
          "disease_burden": "Cancer is the second leading cause of registered deaths in Kenya; high-case fatality from late-stage presentations.",
          "prevalence_data": "Estimated new cancer cases annually ~40,000\u201350,000 (growing trend); common cancers include breast, cervical, prostate, esophageal).",
          "current_outcomes": "Low 5\u2011year survival for common cancers due to late presentation and limited curative services.",
          "geographic_burden": "Diagnostic and treatment services concentrated in major urban centres (Nairobi, Mombasa, Eldoret)."
        },
        "affected_populations": {
          "primary_population": "Adults with screening-detectable cancers (breast, cervical) and symptomatic patients needing diagnostics and radiotherapy.",
          "estimated_annual_cases": "Approx. 40,000\u201350,000 new cases annually; ~60\u201370% present at late stage requiring complex care.",
          "demographic_profile": "Adults aged 30\u201370; disparity with poorer outcomes in rural and low-income groups.",
          "vulnerable_groups": "Women (screening access), rural populations, patients requiring high-cost therapies."
        },
        "current_coverage_assessment": {
          "existing_services": "Limited organised screening (county pilot sites), few pathology labs with capacity, 4\u20136 radiotherapy centres mostly urban.",
          "geographic_availability": "Majority of counties lack radiotherapy and comprehensive oncology services.",
          "capacity_utilization": "Radiotherapy centres operate at high utilisation with long queues.",
          "wait_times": "Delays from referral to diagnostic biopsy and to initiation of therapy commonly 1\u20136 months."
        },
        "health_system_impact_analysis": {
          "level_1_2_impact": "Limited community awareness and screening outreach; CHVs underutilised for cancer education.",
          "level_3_impact": "Health centres lack capacity for visual inspection for cervical cancer, clinical breast exam training.",
          "level_4_impact": "County hospitals lack pathology turnaround, chemotherapy safety infrastructure and radiotherapy.",
          "level_5_6_impact": "Tertiary centres overwhelmed with advanced cases; limited palliative care integration.",
          "referral_pathway_gaps": "Weak referral coordination, limited patient navigators, high out-of-pocket costs causing treatment interruption."
        },
        "clinical_evidence_base": {
          "international_guidelines": "WHO recommends organised cervical screening (HPV testing/VIA) and breast awareness with timely referral; radiotherapy is essential for curative care.",
          "clinical_effectiveness": "Screening and early treatment markedly reduce mortality (cervical screening can reduce incidence by >50%).",
          "timing_criticality": "Early-stage treatment window narrow \u2014 delays shift patients to palliative care.",
          "cost_effectiveness": "Screening (HPV/VIA) and timely radiotherapy/chemotherapy are cost-effective relative to late-stage care and palliative-only approaches."
        },
        "recommended_interventions": {
          "immediate_additions": [
            "Scale national cervical and breast screening to all counties using HPV testing/VIA and clinical breast exam with referral pathways.",
            "Expand diagnostic pathology capacity via hub-and-spoke models and telepathology.",
            "Increase radiotherapy capacity (additional LINACs) and decentralise chemotherapy to Level 5 hospitals with safe infusion units."
          ],
          "service_specifications": [
            "Screening: target women 25\u201349 for cervical screening and organised recall systems.",
            "Diagnostics: 7\u201314 day pathology turnaround for priority cancers; imaging access (mammography, CT, MRI) in regional hubs.",
            "Treatment: standardised oncology protocols, chemotherapy safety standards, radiotherapy planning and maintenance schedules."
          ],
          "implementation_phases": [
            "Phase 1 (0\u201312 months): Scale screening in 15 high-burden counties and upgrade pathology hubs; strengthen referral navigation.",
            "Phase 2 (12\u201336 months): Procure and commission additional radiotherapy units and chemotherapy capacity in regional centres.",
            "Phase 3 (36\u201360 months): Full national coverage with tele-oncology support and integration into NHIF benefit packages."
          ]
        },
        "resource_requirements": {
          "human_resources": "Train pathologists (increase workforce by 50%), oncology nurses, radiotherapy physicists, clinical oncologists.",
          "infrastructure": "Additional LINACs, pathology labs, cold chain for HPV samples, mammography units in regional hubs.",
          "training_needs": "In-service training for screening, biopsy techniques, chemotherapy safety, telepathology systems.",
          "estimated_cost": "KES 12 billion over 5 years for phased scale-up (screening, diagnostics, radiotherapy expansion)."
        },
        "implementation_feasibility": {
          "technical_feasibility": "MEDIUM \u2014 requires capital equipment, workforce development and maintenance contracts.",
          "financial_feasibility": "MEDIUM to LOW \u2014 high capital costs but high impact; financing through public\u2013private partnerships and NHIF possible.",
          "political_feasibility": "HIGH \u2014 cancer control is a political priority with public support.",
          "timeline_realistic": "5 years for meaningful improvement in early detection and treatment capacity."
        },
        "success_metrics": {
          "process_indicators": "Proportion of eligible women screened annually; pathology turnaround times; LINAC operational hours.",
          "outcome_indicators": "Stage distribution at diagnosis (shift to earlier stages), time from diagnosis to treatment.",
          "impact_indicators": "Cancer-specific mortality rates and 5\u2011year survival for common cancers.",
          "equity_indicators": "Screening coverage by county and socio-economic quintile; rural access to diagnostic hubs."
        },
        "kenya_context_integration": {
          "county_variations": "High-burden and urban counties need advanced oncology; pastoral and remote counties need mobile screening and specimen transport.",
          "cultural_considerations": "Community sensitisation to counter stigma, use of CHVs and women's groups to increase uptake.",
          "integration_opportunities": "Integrate cervical screening into maternal & child health clinics and HIV platforms; use existing lab networks.",
          "sustainability_factors": "NHIF reimbursement for screening and treatment, county budget lines for maintenance and workforce retention."
        },
        "pdf_page_sources": [
          "Pages 19-54 (Annex Procedures)"
        ],
        "validation_ready": true
      },
      {
        "gap_id": "PNEUMONIA_PREVENTION_TREATMENT_003",
        "gap_category": "pneumonia_prevention_and_oxygen_therapy",
        "gap_type": "insufficient_service_coverage",
        "clinical_priority": "HIGH",
        "description": "Pneumonia is the leading registered cause of death yet gaps exist in preventive interventions (vaccination, nutrition), diagnosis, oxygen systems and community case management, especially for children and the elderly in rural areas.",
        "kenya_epidemiological_context": {
          "disease_burden": "Pneumonia is the foremost registered cause of death across age groups; major contributor to under-5 mortality.",
          "prevalence_data": "High incidence among children under 5 and increased vulnerability among adults with COPD, HIV and the elderly.",
          "current_outcomes": "Mortality remains high where oxygen therapy and timely antibiotics are not available.",
          "geographic_burden": "Rural counties and informal urban settlements have higher case-fatality due to delayed care and weak referral."
        },
        "affected_populations": {
          "primary_population": "Children under 5, elderly, and adults with chronic lung disease or immunosuppression.",
          "estimated_annual_cases": "Estimated severe pneumonia cases requiring admission in children and adults in the tens to hundreds of thousands annually (countrywide).",
          "demographic_profile": "Predominantly rural children under 5 and older adults across counties with low vaccination/nutrition coverage.",
          "vulnerable_groups": "Children <5, malnourished children, HIV-positive individuals, elderly, low-income households."
        },
        "current_coverage_assessment": {
          "existing_services": "Routine childhood immunisation exists but gaps in PCV/HiB coverage in some counties; oxygen supply unreliable in many facilities.",
          "geographic_availability": "Functional oxygen and pulse oximetry available in tertiary centres and some county hospitals; many Level 3\u20134 facilities lack equipment.",
          "capacity_utilization": "Referral hospitals overwhelmed during peaks (e.g., seasonal spikes).",
          "wait_times": "Delays in referral due to transport and bed shortages; limited community-level antibiotic availability for severe cases."
        },
        "health_system_impact_analysis": {
          "level_1_2_impact": "Community health volunteers not fully enabled for pneumonia identification and early referral; oral antibiotics inconsistent.",
          "level_3_impact": "Health centres lack pulse oximeters and continuous oxygen sources.",
          "level_4_impact": "County hospitals lack robust oxygen plants, concentrators maintenance and trained staff.",
          "level_5_6_impact": "Tertiary hospitals provide critical care but are distant for many patients.",
          "referral_pathway_gaps": "Weak emergency transport and triage; no standard oxygen maintenance plans at facility level."
        },
        "clinical_evidence_base": {
          "international_guidelines": "WHO IMCI and oxygen therapy guidelines recommend pulse oximetry and oxygen for hypoxaemia; PCV and Hib vaccines reduce severe pneumonia.",
          "clinical_effectiveness": "Pulse oximetry and reliable oxygen reduce pneumonia mortality substantially; vaccination reduces incidence markedly.",
          "timing_criticality": "Hypoxaemia identification and oxygen within hours can be life-saving.",
          "cost_effectiveness": "Oxygen systems, pulse oximetry and vaccination are highly cost-effective interventions."
        },
        "recommended_interventions": {
          "immediate_additions": [
            "Nationwide roll-out of pulse oximetry and oxygen concentrators with maintenance plans to all Level 3\u20135 facilities.",
            "Scale-up of PCV and Hib vaccination coverage and integrated management of childhood illness at community level.",
            "Strengthen community case management (CHVs) for early detection and referral and ensure emergency transport links."
          ],
          "service_specifications": [
            "Oxygen systems: continuous supply, concentrator plus cylinder backups, biomedical maintenance contracts.",
            "Community packages: IMCI-trained CHVs, stocked antibiotic kits, referral vouchers for transport.",
            "Monitoring: oxygen usage logs, pulse oximetry screening for all suspected pneumonia cases."
          ],
          "implementation_phases": [
            "Phase 1 (0\u20136 months): Provide pulse oximeters and concentrators to high-burden counties and train staff/CHVs.",
            "Phase 2 (6\u201324 months): Scale to all Level 3\u20135 facilities, establish maintenance contracts and oxygen plants where feasible.",
            "Phase 3 (24\u201348 months): Integrate preventive measures (nutrition, vaccination) and strengthen long-term supply chains."
          ]
        },
        "resource_requirements": {
          "human_resources": "Train clinicians and CHVs in IMCI, oxygen therapy, and equipment maintenance; strengthen biomedical technicians.",
          "infrastructure": "Purchase of pulse oximeters, oxygen concentrators, cylinders and maintenance tools; cold chain strengthening for vaccines.",
          "training_needs": "IMCI refresher, oxygen therapy protocols, biomedical technician apprenticeships.",
          "estimated_cost": "KES 2.5 billion over 3 years for equipment, training and maintenance in all counties."
        },
        "implementation_feasibility": {
          "technical_feasibility": "HIGH \u2014 proven technologies and delivery models with clear supply-chain and maintenance needs.",
          "financial_feasibility": "HIGH \u2014 relatively low-cost interventions with strong mortality reduction potential.",
          "political_feasibility": "HIGH \u2014 aligns with child survival and UHC priorities.",
          "timeline_realistic": "2\u20133 years for widespread functional oxygen and pulse oximetry coverage."
        },
        "success_metrics": {
          "process_indicators": "Proportion of facilities with functional pulse oximetry and continuous oxygen; vaccine coverage rates.",
          "outcome_indicators": "Under-5 pneumonia case fatality rates, hypoxaemia detection rates and time-to-oxygen.",
          "impact_indicators": "Reduction in pneumonia-attributable deaths across all ages.",
          "equity_indicators": "Coverage of oxygen and vaccination in rural vs urban facilities; CHV reach in remote wards."
        },
        "kenya_context_integration": {
          "county_variations": "Arid and remote counties need solar-powered concentrators and stronger transport systems; high-density urban settlements need outreach vaccination drives.",
          "cultural_considerations": "Community engagement to encourage early care-seeking and adherence to referral advice.",
          "integration_opportunities": "Link oxygen and IMCI strengthening with existing maternal-child health and immunisation programmes.",
          "sustainability_factors": "County budget allocation for biomedical maintenance, pooled procurement of concentrators and integration into NHIF essential packages."
        },
        "pdf_page_sources": [
          "Pages 1-18 (Policy Structure)"
        ],
        "validation_ready": true
      },
      {
        "gap_id": "EMERGENCY_OBSTETRIC_CARE_004",
        "gap_category": "emergency_obstetric_and_newborn_care",
        "gap_type": "service_capacity_gap",
        "clinical_priority": "HIGH",
        "description": "Emergency obstetric and neonatal care (EmONC) services are uneven across counties, contributing to persistently high maternal mortality ratio (130\u2013170/100,000) and perinatal deaths; gaps include surgical capacity, blood transfusion, newborn resuscitation and referral systems.",
        "kenya_epidemiological_context": {
          "disease_burden": "Maternal mortality remains high with substantial county variation; obstetric haemorrhage, sepsis and hypertensive disorders are major contributors.",
          "prevalence_data": "Estimated annual births ~1.0\u20131.2 million; ~15% will experience obstetric complications needing EmONC.",
          "current_outcomes": "Delays in receiving definitive care (second and third delays) drive mortality; perinatal mortality remains high in underserved counties.",
          "geographic_burden": "Rural and remote counties show higher MMR and lower facility-based delivery rates."
        },
        "affected_populations": {
          "primary_population": "Pregnant women during labour and postpartum period and neonates requiring resuscitation or specialised care.",
          "estimated_annual_cases": "Approximately 150,000\u2013200,000 obstetric complications annually (estimated 15% of births).",
          "demographic_profile": "Pregnant women across all reproductive-age groups with higher risk in adolescents and older mothers.",
          "vulnerable_groups": "Rural women, adolescents, women in informal settlements, those with limited financial means."
        },
        "current_coverage_assessment": {
          "existing_services": "Some county referral hospitals provide basic and comprehensive EmONC but many Level 3\u20134 facilities lack signal functions (e.g., blood transfusion, C-section capacity).",
          "geographic_availability": "C-section and blood transfusion services concentrated at Level 4\u20136 hospitals; many sub-counties lack timely access.",
          "capacity_utilization": "Referral hospitals overwhelmed during peak delivery periods; shortages of skilled birth attendants.",
          "wait_times": "Delays to surgery and blood transfusion measured in hours due to transport and availability."
        },
        "health_system_impact_analysis": {
          "level_1_2_impact": "Community recognition and referral cues exist but transport and birth-preparedness limited.",
          "level_3_impact": "Health centres often manage normal deliveries but lack capacity for obstetric emergencies.",
          "level_4_impact": "County hospitals variably provide comprehensive EmONC; workforce gaps for obstetrics and anaesthesia.",
          "level_5_6_impact": "Tertiary centres handle complex cases with referrals from multiple counties leading to overload.",
          "referral_pathway_gaps": "Weak ambulance networks, no standard transfer protocols, limited blood bank networks at county level."
        },
        "clinical_evidence_base": {
          "international_guidelines": "WHO and UN EmONC signal functions define life-saving interventions for maternal and newborn survival.",
          "clinical_effectiveness": "Timely EmONC (C-section, blood transfusion, parenteral antibiotics) prevents majority of maternal deaths.",
          "timing_criticality": "Interventions often needed within minutes to hours (e.g., postpartum haemorrhage management).",
          "cost_effectiveness": "Strengthening EmONC is highly cost-effective with large mortality reductions per investment unit."
        },
        "recommended_interventions": {
          "immediate_additions": [
            "Ensure all Level 4 hospitals provide comprehensive EmONC (6 signal functions), including 24/7 C-section and blood transfusion readiness.",
            "Strengthen newborn care (resuscitation, KMC units) at Level 4\u20135 facilities.",
            "Establish functional referral and emergency transport networks with standardised protocols."
          ],
          "service_specifications": [
            "24/7 skilled birth attendants, obstetric theatre readiness, on-call anaesthesia, rapid blood transfusion protocols and neonatal resuscitation equipment.",
            "Training: Emergency obstetric drills, obstetric anaesthesia skill enhancement, blood safety and storage protocols.",
            "Referral: Ambulance dispatch, stabilisation checklists, teleconsultation back-up to tertiary centres."
          ],
          "implementation_phases": [
            "Phase 1 (0\u20136 months): Map EmONC gaps, equip and staff 50 high-need Level 4 hospitals, establish blood storage hubs.",
            "Phase 2 (6\u201324 months): Scale to remaining Level 4 hospitals and strengthen referral networks and transport vouchers for poorest women.",
            "Phase 3 (24\u201348 months): Consolidate 24/7 services nationwide and integrate with maternal death surveillance and response (MDSR)."
          ]
        },
        "resource_requirements": {
          "human_resources": "Train additional obstetricians, anaesthetists, midwives and neonatal nurses; deploy anaesthesia technicians to county hospitals.",
          "infrastructure": "Theatres, blood storage and cold chain, neonatal units (KMC, CPAP), ambulances and communication systems.",
          "training_needs": "Advanced Life Support in Obstetrics, neonatal resuscitation, blood transfusion safety and surgical mentorship programs.",
          "estimated_cost": "KES 6 billion over 3 years for upgrades to 47 counties (theatre upgrades, staffing, ambulances and blood hubs)."
        },
        "implementation_feasibility": {
          "technical_feasibility": "HIGH \u2014 uses well-established EmONC models with clear signal functions.",
          "financial_feasibility": "MEDIUM \u2014 requires capital and recurrent staffing investments but substantial mortality reduction supports prioritisation.",
          "political_feasibility": "HIGH \u2014 maternal health is a top political and development priority across counties.",
          "timeline_realistic": "3 years to reach functional 24/7 EmONC in most county referral hospitals with phased investment."
        },
        "success_metrics": {
          "process_indicators": "Proportion of facilities with all EmONC signal functions; number of functional ambulances per county.",
          "outcome_indicators": "Facility maternal mortality ratio, case fatality rate for obstetric haemorrhage and sepsis.",
          "impact_indicators": "Reduction in national MMR and perinatal mortality rates.",
          "equity_indicators": "Proportion of sub-counties with timely access to C-section within 2 hours; financial protection for poorest women."
        },
        "kenya_context_integration": {
          "county_variations": "Arid and sparsely populated counties need tailored transport solutions; densely populated counties need more theatre throughput.",
          "cultural_considerations": "Engage TBAs, CHVs and community leaders for birth preparedness and referral acceptance.",
          "integration_opportunities": "Link EmONC strengthening with MNCH programmes, NHIF maternal packages and county emergency medical services.",
          "sustainability_factors": "County budget lines for staffing and ambulance maintenance; mentorship networks to retain staff in remote counties."
        },
        "pdf_page_sources": [
          "Pages 1-18 (Policy Structure)",
          "Pages 19-54 (Annex Procedures)"
        ],
        "validation_ready": true
      },
      {
        "gap_id": "MENTAL_HEALTH_INTEGRATION_005",
        "gap_category": "mental_health_services_integration",
        "gap_type": "service_delivery_gap",
        "clinical_priority": "HIGH",
        "description": "Mental health services remain fragmented with inadequate integration into primary care, severe workforce shortages and limited access to community-based care and inpatient psychiatric services, despite rising burden.",
        "kenya_epidemiological_context": {
          "disease_burden": "Growing burden of common mental disorders and substance use disorders; severe mental illness prevalence estimated at 1\u20133% with higher rates of depression/anxiety.",
          "prevalence_data": "Population-level estimates suggest substantial unmet need with many not accessing any care.",
          "current_outcomes": "High morbidity, reduced productivity, increased comorbidity with NCDs and elevated suicide risk in some groups.",
          "geographic_burden": "Specialist services concentrated in urban centres; rural counties have minimal or no psychiatric services."
        },
        "affected_populations": {
          "primary_population": "People with common mental disorders (depression, anxiety), severe mental illness (psychosis, bipolar), adolescents and substance users.",
          "estimated_annual_cases": "Millions affected by common mental disorders; severe cases in the low hundreds of thousands needing specialised care.",
          "demographic_profile": "Disproportionate impact on urban poor, young adults, and individuals with chronic NCDs or HIV.",
          "vulnerable_groups": "Adolescents, HIV-positive patients, people in informal settlements, internally displaced populations."
        },
        "current_coverage_assessment": {
          "existing_services": "Psychiatric hospitals and some county mental health units; limited outpatient counselling and community rehabilitation programmes.",
          "geographic_availability": "Services largely in Nairobi and a few county referral hospitals; many counties have no psychiatrist or clinical psychologist.",
          "capacity_utilization": "Existing specialist units overburdened; long waitlists for outpatient care.",
          "wait_times": "Weeks to months for specialist appointments; primary care providers have limited capacity to manage mental health needs."
        },
        "health_system_impact_analysis": {
          "level_1_2_impact": "CHVs and primary care rarely trained to detect and manage common mental disorders or refer appropriately.",
          "level_3_impact": "Health centres lack counselling services, psychotropic medication supply inconsistent.",
          "level_4_impact": "County hospitals need integrated mental health clinics, liaison psychiatry and social support links.",
          "level_5_6_impact": "Specialist hospitals handle complex cases but lack outreach and training programmes for counties.",
          "referral_pathway_gaps": "No systematic stepped-care model; weak community rehabilitation and social support services leading to relapse and rehospitalisation."
        },
        "clinical_evidence_base": {
          "international_guidelines": "WHO mhGAP recommends task-shifting to integrate mental health into primary care and community-based services.",
          "clinical_effectiveness": "Task-shared psychological interventions and psychotropic treatment in primary care reduce morbidity and are cost-effective.",
          "timing_criticality": "Early detection and treatment reduce chronicity and suicide risk; adolescent interventions have long-term benefits.",
          "cost_effectiveness": "Integration into PHC and task-shifting yields high returns via improved productivity and reduced inpatient costs."
        },
        "recommended_interventions": {
          "immediate_additions": [
            "Implement mhGAP-based integration into all Level 3\u20135 facilities with task-shifting to nurses and clinical officers.",
            "Establish county mental health units with outreach to primary care and CHV-supported community psychosocial programmes.",
            "Ensure steady supply of essential psychotropic medicines in the national EML and county pharmacies."
          ],
          "service_specifications": [
            "Stepped-care model: screening at community/primary care, brief psychosocial interventions, referral pathways to specialised care.",
            "Multidisciplinary teams: psychiatric clinical officers, psychologists, social workers, peer support groups.",
            "Digital/telepsychiatry support from tertiary centres for supervision and case management."
          ],
          "implementation_phases": [
            "Phase 1 (0\u20136 months): Pilot mhGAP training and supervision in 10 counties with highest service gaps.",
            "Phase 2 (6\u201324 months): Scale mhGAP training nationwide, set up county mental health focal points and supply chains.",
            "Phase 3 (24\u201348 months): Consolidate community rehabilitation, peer support and integrate mental health into NHIF benefit packages."
          ]
        },
        "resource_requirements": {
          "human_resources": "Scale training for ~2,500 primary care providers in mhGAP, recruit county-level psychiatric clinical officers and psychologists.",
          "infrastructure": "Basic counselling spaces in primary care, telemedicine platforms for supervision, community rehabilitation centres.",
          "training_needs": "mhGAP training, psychosocial interventions training, supervisory mentorship from psychiatrists.",
          "estimated_cost": "KES 1.8 billion over 3 years for training, supervision, essential medicines and telepsychiatry platforms."
        },
        "implementation_feasibility": {
          "technical_feasibility": "HIGH \u2014 strong evidence for task-shifting models and digital supervision.",
          "financial_feasibility": "MEDIUM \u2014 moderate recurrent costs; high value-for-money through reduced inpatient stays and improved productivity.",
          "political_feasibility": "MEDIUM to HIGH \u2014 growing recognition but stigma and competing priorities require advocacy.",
          "timeline_realistic": "3 years for functional integration into PHC with pilot-to-scale approach."
        },
        "success_metrics": {
          "process_indicators": "Number of primary care providers trained in mhGAP; proportion of facilities offering basic mental health services.",
          "outcome_indicators": "Reduction in untreated prevalence, symptom score improvements for treated patients, suicide attempt rates.",
          "impact_indicators": "Reduced psychiatric admissions for relapse, improved economic productivity indicators among beneficiaries.",
          "equity_indicators": "Access to mental health services in rural vs urban counties, uptake among adolescents and women."
        },
        "kenya_context_integration": {
          "county_variations": "Urban counties require youth-friendly mental health services; remote counties need telepsychiatry and CHV-led psychosocial support.",
          "cultural_considerations": "Stigma reduction campaigns, engagement with faith and community leaders, use of local languages in counselling.",
          "integration_opportunities": "Leverage HIV, maternal health and NCD platforms for screening and integrated care.",
          "sustainability_factors": "Inclusion of mental health in county health strategic plans, NHIF reimbursement for psychosocial interventions and psychotropic medicines, local workforce retention incentives."
        },
        "pdf_page_sources": [
          "Pages 1-18 (Policy Structure)"
        ],
        "validation_ready": true
      }
    ],
    "insights": [],
    "full_analysis": "CONTRADICTIONS ANALYSIS:\n[\n  {\n    \"contradiction_id\": \"DIAL_001_CRITICAL\",\n    \"medical_specialty\": \"nephrology\",\n    \"contradiction_type\": \"session_frequency_medical_inconsistency\",\n    \"clinical_severity\": \"CRITICAL\",\n    \"description\": \"Policy allows 3 haemodialysis (HD) sessions/week but restricts haemodiafiltration (HDF) to 2 sessions/week for equivalent end-stage renal disease (ESRD) care.\",\n    \"medical_analysis\": {\n      \"clinical_rationale\": \"HD and HDF are renal replacement therapies whose adequacy is defined by weekly delivered clearance (e.g., Kt/V). Clinical outcomes depend on total weekly clearance and fluid removal rather than modality name; therefore weekly session frequency standards should be equivalent for clinically similar indications.\",\n      \"medical_standards\": \"KDOQI guidance (and international dialysis standards) require a minimum of thrice-weekly HD or equivalent delivered clearance for most chronic ESRD patients; HDF has no evidence-based rationale for lower frequency limits.\",\n      \"clinical_equivalence\": \"HDF provides convective clearance but is not a lesser therapy; for chronic dialysis patients, both modalities generally require comparable frequency to achieve adequate solute and volume control.\",\n      \"contraindication_assessment\": \"No routine clinical indications justify systematically permitting fewer HDF sessions than HD for maintenance dialysis; doing so would constitute an unsafe restriction.\"\n    },\n    \"patient_safety_impact\": {\n      \"immediate_risk\": \"Patients assigned HDF by policy risk receiving inadequate dialysis frequency and clearance.\",\n      \"clinical_consequences\": \"Inadequate dialysis \u2192 accumulation of uremic toxins, hyperkalemia, fluid overload, pulmonary edema, hypertension, and increased cardiovascular events.\",\n      \"survival_impact\": \"Reduced dialysis adequacy/frequency is associated with higher hospitalization rates and increased mortality in ESRD cohorts.\",\n      \"quality_of_life\": \"Symptoms (fatigue, pruritus, nausea, cognitive impairment) and loss of functional status will increase.\"\n    },\n    \"kenya_health_system_impact\": {\n      \"facility_level_effects\": \"Level 4-6 hospitals that provide advanced dialysis modalities could face conflicting billing/authorization rules, causing delays in scheduling or modality selection.\",\n      \"geographic_access\": \"Rural patients (70% of population) already limited to fewer centers; arbitrary modality-based frequency limits will force travel or under-treatment.\",\n      \"resource_allocation\": \"Advanced HDF-capable machines may be underutilized or used suboptimally, wasting scarce capital.\",\n      \"provider_training\": \"Nephrology teams will need urgent policy clarification to avoid under-dialysis and legal/ethical conflicts across 47 counties.\"\n    },\n    \"epidemiological_context\": {\n      \"disease_burden\": \"Chronic kidney disease is rising in Kenya with hypertension prevalent in ~24% of adults \u2014 a sizable at-risk population.\",\n      \"population_impact\": \"Applying modality-based frequency restrictions could disproportionately harm the rural majority dependent on fewer dialysis centres.\",\n      \"health_system_capacity\": \"Limited dialysis capacity at Level 4-6 magnifies any policy-driven reduction in delivered dialysis.\"\n    },\n    \"evidence_documentation\": {\n      \"policy_text_hd\": \"Maximum of 3 sessions per week for haemodialysis\",\n      \"policy_text_hdf\": \"Maximum of 2 sessions per week for haemodiafiltration\",\n      \"page_references\": [\n        \"p8_renal_care\",\n        \"p8_advanced_dialysis\",\n        \"annex_renal_procedures\"\n      ],\n      \"clinical_guidelines\": \"KDOQI Clinical Practice Guidelines; ISPD/ERA-EDTA consensus on dialysis adequacy\"\n    },\n    \"recommended_resolution\": {\n      \"immediate_action\": \"Issue interim clinical directive permitting equivalent session frequency (minimum 3x/week) for HDF and HD where clinically indicated; suspend any modality-specific frequency limits.\",\n      \"policy_revision\": \"Amend renal care benefit language to define adequacy by weekly clearance targets (Kt/V or equivalent) rather than modality-specific session caps.\",\n      \"implementation_steps\": [\n        \"Distribute urgent circular to all accredited dialysis centres and county health directors clarifying interim practice.\",\n        \"Update benefit package and claims rules to remove modality-based frequency differentials.\",\n        \"Train nephrology teams and administrative staff across 47 counties on revised criteria and claims handling.\"\n      ],\n      \"timeline\": \"Immediate (interim directive within 72 hours); formal policy revision within 30 days.\"\n    },\n    \"quality_metrics\": {\n      \"detection_confidence\": 0.99,\n      \"clinical_impact_score\": 9.7,\n      \"urgency_level\": \"CRITICAL_IMMEDIATE_ACTION\",\n      \"validation_method\": \"Cross-reference with KDOQI and policy text contradictions\"\n    }\n  },\n  {\n    \"contradiction_id\": \"EMER_002_CRITICAL\",\n    \"medical_specialty\": \"emergency_medicine / critical_care\",\n    \"contradiction_type\": \"emergency_access_vs_level_mismatch\",\n    \"clinical_severity\": \"CRITICAL\",\n    \"description\": \"Critical illness and emergency care packages are funded and described, but access point designations predominantly restrict services to Level 4-6 centers while other policy language and county-level realities require timely emergency interventions at lower-level facilities (Level 2-3). This creates direct conflicts for time-sensitive care.\",\n    \"medical_analysis\": {\n      \"clinical_rationale\": \"Emergency conditions (sepsis, acute MI, stroke, obstetric hemorrhage, traumatic injuries) require rapid initial stabilization \u2014 airway, breathing, circulation, and time-sensitive interventions \u2014 that cannot be safely deferred pending transfer if lower levels are not permitted to provide covered emergency care.\",\n      \"medical_standards\": \"WHO Essential Emergency Care systems and Emergency Triage guidelines require stabilization capacity at first-contact facilities; referral pathways are intended for definitive care, not initial life-saving interventions.\",\n      \"clinical_equivalence\": \"Stabilization (oxygen, IV fluids, initial antibiotics, airway management) is standard across facility levels; coverage limitations that force delays violate emergency care principles.\",\n      \"contraindication_assessment\": \"No clinical or safety rationale supports denying coverage for initial emergency stabilization at Level 2-3 when those facilities are the first point of contact.\"\n    },\n    \"patient_safety_impact\": {\n      \"immediate_risk\": \"Patients in rural/remote areas may be denied covered stabilization or face claims denial for life-saving interventions performed at Level 2-3.\",\n      \"clinical_consequences\": \"Delays in stabilization/transfer increase mortality in sepsis, major hemorrhage, acute coronary syndromes, stroke, and trauma.\",\n      \"survival_impact\": \"Time-to-treatment is a key predictor of survival; policy-induced delays will increase preventable deaths.\",\n      \"quality_of_life\": \"Survivors of delayed emergency care have higher rates of disability (e.g., post-stroke deficits, amputations after limb ischemia).\"\n    },\n    \"kenya_health_system_impact\": {\n      \"facility_level_effects\": \"Uneven coverage discourages lower-level facilities from investing in emergency capacity and may create perverse incentives to bypass local care.\",\n      \"geographic_access\": \"Rural majority (70%) disproportionately affected \u2014 long travel times to Level 4-6 centres compound risks.\",\n      \"resource_allocation\": \"Funds concentrated on Level 4-6 for definitive care while neglecting emergency stabilization capacity at lower levels.\",\n      \"provider_training\": \"Confusion on what emergency care is reimbursable at each level will hamper triage, delay treatment, and fracture referral systems across 47 counties.\"\n    },\n    \"epidemiological_context\": {\n      \"disease_burden\": \"Top causes of death (pneumonia, cancer, CVD) and high admission rates for CVD (25%) require robust emergency response capabilities across levels.\",\n      \"population_impact\": \"Emergency access limitations will worsen mortality for leading causes and emergencies among rural populations.\",\n      \"health_system_capacity\": \"Limited availability of ambulances and Level 4-6 facilities increases dependence on lower-level stabilization capacity.\"\n    },\n    \"evidence_documentation\": {\n      \"policy_text_summary\": \"Emergency, Chronic and Critical Illness Fund exists but access designations concentrated at Level 4-6; some emergency packages listed under Level 2-3 but without clear scope.\",\n      \"page_references\": [\n        \"p4_emergency_package\",\n        \"p6_access_points\",\n        \"annex_emergency_procedures\"\n      ],\n      \"clinical_guidelines\": \"WHO Emergency Care Systems Framework; Kenya emergency medicine operational guidance\"\n    },\n    \"recommended_resolution\": {\n      \"immediate_action\": \"Issue directive that covers and reimburses initial emergency stabilization (ABC resuscitation, airway management, bleeding control, initial antibiotics, fluids, analgesia) at first-contact facilities (Level 2-3) with defined documentation and transfer criteria.\",\n      \"policy_revision\": \"Redefine emergency care benefits to differentiate between (a) stabilization at first contact (covered at Level 2-3), (b) definitive care (Level 4-6), and (c) clear referral/transfer escalation protocols.\",\n      \"implementation_steps\": [\n        \"Publish clinical stabilization package and billing codes for Level 2-3 facilities.\",\n        \"Train clinicians and administrative staff on documentation requirements for emergency stabilization and referral.\",\n        \"Equip and resource key Level 2-3 facilities with essential emergency supplies (oxygen, basic airway tools, IV fluids, basic monitoring).\",\n        \"Establish audit and quality metrics for time-to-stabilization and transfer.\"\n      ],\n      \"timeline\": \"Interim guidance within 7 days; policy revision and training rollout within 90 days.\"\n    },\n    \"quality_metrics\": {\n      \"detection_confidence\": 0.96,\n      \"clinical_impact_score\": 9.4,\n      \"urgency_level\": \"CRITICAL_IMMEDIATE_ACTION\",\n      \"validation_method\": \"Cross-check of access point distribution vs accepted emergency care frameworks\"\n    }\n  },\n  {\n    \"contradiction_id\": \"OBS_003_CRITICAL\",\n    \"medical_specialty\": \"obstetrics\",\n    \"contradiction_type\": \"maternal_surgical_access_mismatch\",\n    \"clinical_severity\": \"CRITICAL\",\n    \"description\": \"Policy lists obstetric services/delivery care within packages but several obstetric surgical procedures (cesarean section, management of obstetric hemorrhage, operative anesthesia) are either not explicitly assigned to appropriate Level 4-6 facilities or are ambiguously authorized at lower-level facilities lacking surgical capacity.\",\n    \"medical_analysis\": {\n      \"clinical_rationale\": \"Cesarean delivery and operative management of obstetric emergencies require sterile operating theatres, skilled surgical and anesthesia teams, blood transfusion capability, newborn resuscitation, and post-op critical care \u2014 infrastructure typically available at Level 4-6.\",\n      \"medical_standards\": \"WHO and ACOG standards require that emergency obstetric surgery be performed in facilities with surgical, anesthesia, transfusion and neonatal support. Lower-level facilities should provide stabilization and rapid referral.\",\n      \"clinical_equivalence\": \"Performing major obstetric surgery in inadequately resourced settings increases risk of perioperative hemorrhage, anesthesia complications, maternal death, and neonatal morbidity.\",\n      \"contraindication_assessment\": \"Authorizing cesarean sections at Level 2-3 without explicit facility readiness criteria is clinically unsafe.\"\n    },\n    \"patient_safety_impact\": {\n      \"immediate_risk\": \"Maternal hemorrhage, anesthesia complications, and neonatal hypoxia risk increase if surgical procedures performed in under-equipped settings.\",\n      \"clinical_consequences\": \"Higher maternal mortality, higher rates of severe maternal morbidity (hysterectomy, multi-organ failure), neonatal death and long-term disability.\",\n      \"survival_impact\": \"Delays in appropriate surgical care or inappropriate attempts at surgery in under-resourced facilities will increase maternal and perinatal mortality.\",\n      \"quality_of_life\": \"Survivors may have chronic health impairments and reduced future reproductive options.\"\n    },\n    \"kenya_health_system_impact\": {\n      \"facility_level_effects\": \"Confusion about where cesareans are authorized will lead to inappropriate case selection at lower-level facilities or delays in transfer to Level 4-6 centres.\",\n      \"geographic_access\": \"Rural women may be falsely reassured that surgical care is locally available or conversely be denied timely surgery when needed.\",\n      \"resource_allocation\": \"Counties may misallocate investments, failing to strengthen clear regional surgical centres and referral transport.\",\n      \"provider_training\": \"Midwives and clinicians need unambiguous protocols for stabilization, indications for transfer, and documentation to ensure coverage and safety.\"\n    },\n    \"epidemiological_context\": {\n      \"disease_burden\": \"Maternal causes remain critical contributors to morbidity and death; pneumonia and CVD also interact with pregnancy risks.\",\n      \"population_impact\": \"Rural maternal populations are most vulnerable; Kenya's facility tiering must align with safe surgical thresholds.\",\n      \"health_system_capacity\": \"Only Level 4-6 facilities likely have consistent blood transfusion, anesthesia and neonatal support \u2014 policies must reflect that reality.\"\n    },\n    \"evidence_documentation\": {\n      \"policy_text_summary\": \"Obstetric procedures included in packages (Obs & Gyn 46 annex entries) but access point mapping shows entries across Level 2-6 and several ambiguous Level 2-3 authorizations without facility readiness criteria.\",\n      \"page_references\": [\n        \"p6_maternal_package\",\n        \"p6_access_points\",\n        \"annex_obs_gyn_procedures\"\n      ],\n      \"clinical_guidelines\": \"WHO Safe Surgery and Emergency Obstetric Care guidance; ACOG practice bulletins\"\n    },\n    \"recommended_resolution\": {\n      \"immediate_action\": \"Issue directive clarifying that cesarean sections and operative obstetric procedures are to be covered and performed only at facilities meeting defined surgical, anesthesia, blood transfusion, and neonatal care readiness (minimum Level 4), except in documented, life-saving stabilization scenarios.\",\n      \"policy_revision\": \"Codify facility readiness criteria within benefit package; define covered stabilization interventions at Level 2-3 and transfer protocols with reimbursement guarantees.\",\n      \"implementation_steps\": [\n        \"Map current facilities to readiness matrix; publicize designated obstetric surgical centres per county.\",\n        \"Set clear billing rules covering stabilization care at lower levels and definitive surgery at designated Level 4-6 hospitals.\",\n        \"Invest rapidly in referral transport/ambulance coverage to reduce transfer delays.\",\n        \"Provide training and simulations in emergency obstetric stabilization to Level 2-3 staff.\"\n      ],\n      \"timeline\": \"Interim clarification within 14 days; full mapping and policy update within 60\u201390 days.\"\n    },\n    \"quality_metrics\": {\n      \"detection_confidence\": 0.95,\n      \"clinical_impact_score\": 9.6,\n      \"urgency_level\": \"CRITICAL_WITHIN_30_DAYS\",\n      \"validation_method\": \"Comparison of annex procedure locations vs required surgical readiness standards\"\n    }\n  },\n  {\n    \"contradiction_id\": \"PED_004_HIGH\",\n    \"medical_specialty\": \"pediatrics\",\n    \"contradiction_type\": \"insufficient_pediatric_specificity_age_inappropriate_protocols\",\n    \"clinical_severity\": \"HIGH\",\n    \"description\": \"Pediatric services are under-represented (12 annex entries) and many benefit descriptions appear adult-centric, with no explicit age-specific dosing, equipment, or follow-up requirements \u2014 risking application of adult protocols to children.\",\n    \"medical_analysis\": {\n      \"clinical_rationale\": \"Children have distinct physiological responses, weight-based drug dosing, equipment size requirements (airways, vascular access), and different thresholds for interventions; adult protocols cannot be safely applied without pediatric adaptation.\",\n      \"medical_standards\": \"Paediatric care standards (WHO, UNICEF, Paediatric Societies) mandate age/weight-based guidelines, pediatric emergency triage, and appropriate equipment availability.\",\n      \"clinical_equivalence\": \"Certain procedures may be clinically similar across ages, but safety depends on pediatric expertise and resources.\",\n      \"contraindication_assessment\": \"Absence of pediatric-specific protocols constitutes an implicit contraindication to safe pediatric care under the same terms as adult care.\"\n    },\n    \"patient_safety_impact\": {\n      \"immediate_risk\": \"Medication dosing errors, incorrect device sizes, inadequate monitoring, and inappropriate use of adult-sized interventions.\",\n      \"clinical_consequences\": \"Increased risk of respiratory compromise, fluid/electrolyte errors, medication toxicity or underdosing, and poor outcomes in sepsis or neonatal emergencies.\",\n      \"survival_impact\": \"Potential for higher pediatric morbidity and mortality, particularly among neonates and infants.\",\n      \"quality_of_life\": \"Risk of long-term developmental injury from substandard acute management.\"\n    },\n    \"kenya_health_system_impact\": {\n      \"facility_level_effects\": \"Lower-level facilities serving children may be falsely considered 'covered' for services without pediatric specifications, leading to unsafe care practices.\",\n      \"geographic_access\": \"Rural children disproportionately affected by lack of pediatric-specific services and equipment distribution.\",\n      \"resource_allocation\": \"Without explicit pediatric requirements, supply chains may not prioritize pediatric-sized consumables and meds.\",\n      \"provider_training\": \"Clinicians and pharmacists need pediatric dosing references and triage training to avoid errors across 47 counties.\"\n    },\n    \"epidemiological_context\": {\n      \"disease_burden\": \"Pneumonia is the leading registered cause of death \u2014 a disease particularly lethal in children if not managed with age-appropriate care.\",\n      \"population_impact\": \"Children in rural areas (70% of population) at highest risk from adult-centric policies.\",\n      \"health_system_capacity\": \"Limited pediatric specialists (only 12 annex entries) signal gaps in capacity to manage pediatric emergencies and chronic conditions.\"\n    },\n    \"evidence_documentation\": {\n      \"policy_text_summary\": \"Only 12 paediatric procedures in annex; many service packages lack explicit pediatric adaptation/instructions.\",\n      \"page_references\": [\n        \"annex_paediatric_procedures\",\n        \"p5_pharmacy_package\",\n        \"p6_emergency_package\"\n      ],\n      \"clinical_guidelines\": \"WHO Pocket Book of Hospital Care for Children; Kenyan paediatric emergency care recommendations\"\n    },\n    \"recommended_resolution\": {\n      \"immediate_action\": \"Issue guidance requiring that all clinical pathways and drug lists include pediatric age/weight-based dosing and a minimum list of pediatric-sized equipment for each facility level.\",\n      \"policy_revision\": \"Expand pediatric annex with clear delineation of covered pediatric procedures, minimum competency and equipment per level, and referral expectations.\",\n      \"implementation_steps\": [\n        \"Create and distribute pediatric dosing charts and emergency algorithms to all facilities.\",\n        \"Audit stocklists to ensure pediatric consumables (masks, ET tubes, intraosseous kits, weight-based drug formulations) are available.\",\n        \"Train clinicians in pediatric emergency triage (ETAT or equivalent) and weight-based dosing.\"\n      ],\n      \"timeline\": \"Guidance within 14 days; rollout and audits within 90 days.\"\n    },\n    \"quality_metrics\": {\n      \"detection_confidence\": 0.92,\n      \"clinical_impact_score\": 8.6,\n      \"urgency_level\": \"HIGH_WITHIN_30_DAYS\",\n      \"validation_method\": \"Gap analysis of annex pediatric entries vs expected pediatric service needs\"\n    }\n  },\n  {\n    \"contradiction_id\": \"NEURO_005_HIGH\",\n    \"medical_specialty\": \"neurosurgery / interventional_radiology\",\n    \"contradiction_type\": \"complex_procedures_at_low_level_facilities\",\n    \"clinical_severity\": \"HIGH\",\n    \"description\": \"Annex lists neurosurgery (29) and interventional radiology (32) procedures but access point mapping includes ambiguous authorizations at lower levels (Level 2-3), risking performance of high-complexity procedures in under-resourced settings.\",\n    \"medical_analysis\": {\n      \"clinical_rationale\": \"Complex neurosurgical and interventional radiology procedures require specialized theatres, imaging (CT/MRI/fluoroscopy), intensive care, neuro-anesthesia, blood products, and trained multidisciplinary teams \u2014 typically available at tertiary centres (Level 5-6).\",\n      \"medical_standards\": \"Neurosurgical societies and surgical safety guidelines require defined facility capabilities and postoperative neurocritical care for complex intracranial/vascular interventions.\",\n      \"clinical_equivalence\": \"Attempting such procedures at lower-level facilities lacking imaging or ICU capacity increases perioperative morbidity and mortality.\",\n      \"contraindication_assessment\": \"Performing complex neurosurgical or IR procedures outside designated centres is contraindicated unless stringent readiness criteria are met.\"\n    },\n    \"patient_safety_impact\": {\n      \"immediate_risk\": \"Intraoperative complications without access to imaging or intensive monitoring; inability to manage hemorrhagic complications or need for urgent re-intervention.\",\n      \"clinical_consequences\": \"Increased neurologic deficits, reoperation rates, infections, and preventable deaths.\",\n      \"survival_impact\": \"Higher perioperative mortality and long-term disability due to inadequate postoperative care.\",\n      \"quality_of_life\": \"Long-term disability burden increases, straining families and social support systems.\"\n    },\n    \"kenya_health_system_impact\": {\n      \"facility_level_effects\": \"Lower-level hospitals might attempt to perform procedures outside their capacity, exposing staff and hospitals to adverse outcomes and potential litigation.\",\n      \"geographic_access\": \"Rural patients could either be denied care locally or receive unsafe local interventions instead of transfer to Level 5-6 centres.\",\n      \"resource_allocation\": \"Misplaced investments could be made in lower-level centres without establishing full perioperative support.\",\n      \"provider_training\": \"Surgeons and physicians need clear scope-of-practice definitions and referral pathways to avoid unsafe practice.\"\n    },\n    \"epidemiological_context\": {\n      \"disease_burden\": \"Trauma, stroke and vascular disease contribute significantly to hospital admissions and need timely specialized interventions.\",\n      \"population_impact\": \"Limited tertiary centres (Level 4-6 designated for specialized imaging) mean rural patients are most at risk from misdirected policies.\",\n      \"health_system_capacity\": \"Imaging and ICU capacity concentrated in Level 4-6; policy must reflect this reality.\"\n    },\n    \"evidence_documentation\": {\n      \"policy_text_summary\": \"Interventional Radiology and Neurosurgery procedures listed in annex but access point data contains entries indicating Level 2-3 or ambiguous Level 2-6 designations.\",\n      \"page_references\": [\n        \"annex_neurosurgery\",\n        \"annex_interventional_radiology\",\n        \"p6_access_points\"\n      ],\n      \"clinical_guidelines\": \"WFNS/Neurosurgical Society recommendations; interventional radiology facility standards\"\n    },\n    \"recommended_resolution\": {\n      \"immediate_action\": \"Publish a list of designated centres allowed to perform complex neurosurgical and IR procedures, and prohibit these procedures at lower-level facilities unless documented readiness criteria are met.\",\n      \"policy_revision\": \"Define procedure-specific facility readiness (imaging, ICU, blood bank, specialist teams) and align annex access points to these criteria.\",\n      \"implementation_steps\": [\n        \"Map and accredit tertiary surgical centres per county/region.\",\n        \"Create referral/transfer protocols and emergency transport agreements.\",\n        \"Establish telemedicine consult pathways for triage decisions from lower-level facilities.\"\n      ],\n      \"timeline\": \"Directive within 14 days; accreditation and mapping within 60 days.\"\n    },\n    \"quality_metrics\": {\n      \"detection_confidence\": 0.93,\n      \"clinical_impact_score\": 8.9,\n      \"urgency_level\": \"HIGH_WITHIN_30_DAYS\",\n      \"validation_method\": \"Cross-reference of annex procedures vs access point allocations and facility capability expectations\"\n    }\n  },\n  {\n    \"contradiction_id\": \"ADMIN_006_MODERATE\",\n    \"medical_specialty\": \"health_systems / policy\",\n    \"contradiction_type\": \"missing_tariffs_and_fund_designations_creating_provider_confusion\",\n    \"clinical_severity\": \"MODERATE\",\n    \"description\": \"Most policy entries lack explicit fund designations (only 3/97 non-empty) and there are zero tariff entries. This administrative gap creates high risk for claims denial, delayed care authorizations, and inconsistent provider behaviour.\",\n    \"medical_analysis\": {\n      \"clinical_rationale\": \"Clear funding source and tariffs allow providers to know which services are reimbursable, how to code claims, and what preauthorization is required \u2014 absence leads to uncertainty and potential denial of essential care.\",\n      \"medical_standards\": \"Health financing best practice requires transparent benefit packages with pricing and funding streams to enable predictable service delivery.\",\n      \"clinical_equivalence\": \"Lack of tariffs is not a clinical contradiction per se but directly affects patient access and timely care.\",\n      \"contraindication_assessment\": \"No medical contraindications result, but administrative ambiguity translates into care access barriers.\"\n    },\n    \"patient_safety_impact\": {\n      \"immediate_risk\": \"Delays in care while funding/authorization is clarified; potential refusal of emergency interventions pending preauthorization.\",\n      \"clinical_consequences\": \"Worsening of conditions that could have been promptly treated; increased avoidable admissions.\",\n      \"survival_impact\": \"Indirect increase in morbidity/mortality due to delayed or denied care.\",\n      \"quality_of_life\": \"Financial unpredictability and interrupted treatments reduce adherence and continuity of care.\"\n    },\n    \"kenya_health_system_impact\": {\n      \"facility_level_effects\": \"Providers may refuse or delay services due to uncertain reimbursement, particularly in resource-constrained lower-level facilities.\",\n      \"geographic_access\": \"Counties with weaker administrative support will face more frequent coverage denial or delays.\",\n      \"resource_allocation\": \"Unable to plan budgets, procure consumables or staff because pricing and fund streams are undefined.\",\n      \"provider_training\": \"Administrative staff and clinicians will be confused about preauthorization processes and eligible services across 47 counties.\"\n    },\n    \"epidemiological_context\": {\n      \"disease_burden\": \"High-burden conditions (CVD, cancer, pneumonia, CKD) need predictable financing to ensure continuity of expensive chronic and emergency care.\",\n      \"population_impact\": \"Vulnerable populations (rural, low-income) most at risk of losing access if facilities stop providing services without clear reimbursement.\",\n      \"health_system_capacity\": \"Lack of tariffs undermines attempts to scale services at necessary facility levels.\"\n    },\n    \"evidence_documentation\": {\n      \"policy_text_summary\": \"Entries with Fund info: 3/97 non-empty; Entries with Tariffs: 0; Entries with Service info: 6/97 \u2014 widespread omissions noted.\",\n      \"page_references\": [\n        \"p2_funding_summary\",\n        \"p3_benefit_definitions\",\n        \"annex_financials\"\n      ],\n      \"clinical_guidelines\": \"WHO UHC and health financing best practice documentation\"\n    },\n    \"recommended_resolution\": {\n      \"immediate_action\": \"Issue administrative guidance to temporarily accept a standardized claims code set and provisional pricing schedule for urgent services to avoid denials.\",\n      \"policy_revision\": \"Complete benefit package with explicit fund assignment and tariffs for all listed services; publish clear preauthorization and emergency exemption rules.\",\n      \"implementation_steps\": [\n        \"Rapidly draft provisional tariffs for high-priority services (emergency stabilization, dialysis, obstetric surgery) and circulate to counties.\",\n        \"Schedule stakeholder consultations with providers, county health directors and insurers to finalize tariffs.\",\n        \"Deploy training to administrative staff on claims submission and emergency preauthorization exemptions.\"\n      ],\n      \"timeline\": \"Provisional tariff schedule within 14 days; full tariff and fund assignment within 90 days.\"\n    },\n    \"quality_metrics\": {\n      \"detection_confidence\": 0.94,\n      \"clinical_impact_score\": 7.2,\n      \"urgency_level\": \"MODERATE_URGENT\",\n      \"validation_method\": \"Quantitative review of dataset fields and administrative requirements\"\n    }\n  }\n]\n\nGAPS ANALYSIS:\n[\n  {\n    \"gap_id\": \"CVD_REHAB_CRITICAL_001\",\n    \"gap_category\": \"cardiovascular_rehabilitation_services\",\n    \"gap_type\": \"missing_essential_service\",\n    \"clinical_priority\": \"HIGH\",\n    \"description\": \"Comprehensive cardiac rehabilitation and structured secondary prevention services are largely absent outside a few tertiary centres despite cardiovascular disease causing 25% of admissions and 13% of deaths.\",\n    \"kenya_epidemiological_context\": {\n      \"disease_burden\": \"CVD accounts for ~25% of hospital admissions and ~13% of deaths; hypertension prevalence ~24% of adults.\",\n      \"prevalence_data\": \"Estimated 13.4 million adults with hypertension; rising ischemic heart disease and heart failure admissions.\",\n      \"current_outcomes\": \"High readmission rates, prolonged disability, suboptimal risk-factor control.\",\n      \"geographic_burden\": \"Concentrated in urban and peri\u2011urban areas but expanding into rural counties as risk factors rise.\"\n    },\n    \"affected_populations\": {\n      \"primary_population\": \"Patients post-acute coronary syndrome, heart failure, valve surgery and stroke needing secondary prevention and rehab.\",\n      \"estimated_annual_cases\": \"Approx. 250,000\u2013320,000 admissions annually relevant for rehab (based on 25% of total admissions estimate).\",\n      \"demographic_profile\": \"Adults aged 40+ (rising burden in middle-aged adults); heavier burden in urban counties.\",\n      \"vulnerable_groups\": \"Rural patients with poor access to tertiary centres, low-income households, elderly.\"\n    },\n    \"current_coverage_assessment\": {\n      \"existing_services\": \"Limited cardiac rehab programmes at KNH, MTRH and select private hospitals; few outpatient/community links.\",\n      \"geographic_availability\": \"Mostly Nairobi, Mombasa and a handful of county referral hospitals; >40 counties lack services.\",\n      \"capacity_utilization\": \"Tertiary sites operating over capacity with long waits for enrolment.\",\n      \"wait_times\": \"Assessment-to-enrolment waits reported 3\u20138 months in tertiary centres.\"\n    },\n    \"health_system_impact_analysis\": {\n      \"level_1_2_impact\": \"No community-based secondary prevention integration with CHVs and primary care.\",\n      \"level_3_impact\": \"Health centres cannot provide structured rehabilitation or risk-factor clinics.\",\n      \"level_4_impact\": \"County hospitals need dedicated rehab outpatient clinics and equipment.\",\n      \"level_5_6_impact\": \"Tertiary hospitals carry the bulk of complex rehab without community continuation.\",\n      \"referral_pathway_gaps\": \"No standardised discharge-to-community rehabilitation pathway; poor follow-up and adherence monitoring.\"\n    },\n    \"clinical_evidence_base\": {\n      \"international_guidelines\": \"WHO PEN and ESC guidelines recommend structured cardiac rehab and risk-factor management.\",\n      \"clinical_effectiveness\": \"Cardiac rehab reduces mortality 13\u201320% and readmissions ~25% in meta-analyses.\",\n      \"timing_criticality\": \"Optimal within first 12 weeks post-event for maximal functional recovery.\",\n      \"cost_effectiveness\": \"Demonstrated reductions in long-term costs through fewer readmissions and improved productivity.\"\n    },\n    \"recommended_interventions\": {\n      \"immediate_additions\": [\n        \"Establish cardiac rehab units at all Level 5\u20136 hospitals and pilot community rehab in 10 high-burden counties.\",\n        \"Integrate outpatient secondary prevention clinics at Level 4\u20135 with tele-rehab components.\",\n        \"Standardised discharge plans linking patients to CHVs and county NCD clinics.\"\n      ],\n      \"service_specifications\": [\n        \"12-week structured programme: supervised exercise, risk-factor counselling, psychosocial support, medication optimisation.\",\n        \"Multidisciplinary teams: cardiologist/physician, physiotherapist, nurse, nutritionist, psychologist.\",\n        \"Monitoring and referral protocols with clear KPIs.\"\n      ],\n      \"implementation_phases\": [\n        \"Phase 1 (0\u20136 months): Pilot 10 county hospitals + training of multidisciplinary teams.\",\n        \"Phase 2 (6\u201318 months): Scale to all Level 5 facilities and select Level 4 centres with high caseloads.\",\n        \"Phase 3 (18\u201336 months): Community-based continuation in all counties; telehealth integration for remote follow\u2011up.\"\n      ]\n    },\n    \"resource_requirements\": {\n      \"human_resources\": \"Training for ~800 physiotherapists, 400 cardiac rehab nurses and 200 specialists countrywide.\",\n      \"infrastructure\": \"Exercise areas, ECG monitoring, basic rehab equipment, telehealth kits for remote follow-up.\",\n      \"training_needs\": \"Short-course cardiac rehab certification, CME for primary care on secondary prevention.\",\n      \"estimated_cost\": \"KES 4.2 billion over 3 years for phased national rollout (capital + recurrent + training).\"\n    },\n    \"implementation_feasibility\": {\n      \"technical_feasibility\": \"HIGH \u2014 builds on existing cardiology and physiotherapy cadres with scalable telehealth options.\",\n      \"financial_feasibility\": \"MEDIUM \u2014 upfront capital, but high ROI via reduced admissions and improved productivity.\",\n      \"political_feasibility\": \"HIGH \u2014 aligns with county NCD priorities and UHC agenda.\",\n      \"timeline_realistic\": \"3 years for meaningful nationwide coverage with pilots in Year 1.\"\n    },\n    \"success_metrics\": {\n      \"process_indicators\": \"Number of facilities offering cardiac rehab; patients enrolled and completing 12-week programmes.\",\n      \"outcome_indicators\": \"30\u2011day and 1\u2011year readmission rates, BP and lipid control rates at 6 months.\",\n      \"impact_indicators\": \"Reduction in CVD mortality and hospital bed-days attributable to CVD.\",\n      \"equity_indicators\": \"Proportion of counties with functioning rehab services; rural vs urban enrolment rates.\"\n    },\n    \"kenya_context_integration\": {\n      \"county_variations\": \"Urban counties require advanced programmes; poorer/rural counties require basic home/community rehab models.\",\n      \"cultural_considerations\": \"Family\u2011centred rehab messaging and use of CHVs to support adherence.\",\n      \"integration_opportunities\": \"Link with existing NCD clinics, community health strategy and NHIF benefit packages.\",\n      \"sustainability_factors\": \"County ownership, incorporation into NHIF and PHC fund lines, task\u2011shifting to nurses and CHVs.\"\n    }\n  },\n  {\n    \"gap_id\": \"CANCER_EARLY_DETECTION_002\",\n    \"gap_category\": \"cancer_early_detection_and_access_to_curative_treatment\",\n    \"gap_type\": \"insufficient_service_coverage\",\n    \"clinical_priority\": \"HIGH\",\n    \"description\": \"Late diagnosis and limited access to diagnostic imaging, pathology and radiotherapy contribute to high cancer mortality; early detection and treatment capacity is inadequate across most counties.\",\n    \"kenya_epidemiological_context\": {\n      \"disease_burden\": \"Cancer is the second leading cause of registered deaths in Kenya; high-case fatality from late-stage presentations.\",\n      \"prevalence_data\": \"Estimated new cancer cases annually ~40,000\u201350,000 (growing trend); common cancers include breast, cervical, prostate, esophageal).\",\n      \"current_outcomes\": \"Low 5\u2011year survival for common cancers due to late presentation and limited curative services.\",\n      \"geographic_burden\": \"Diagnostic and treatment services concentrated in major urban centres (Nairobi, Mombasa, Eldoret).\"\n    },\n    \"affected_populations\": {\n      \"primary_population\": \"Adults with screening-detectable cancers (breast, cervical) and symptomatic patients needing diagnostics and radiotherapy.\",\n      \"estimated_annual_cases\": \"Approx. 40,000\u201350,000 new cases annually; ~60\u201370% present at late stage requiring complex care.\",\n      \"demographic_profile\": \"Adults aged 30\u201370; disparity with poorer outcomes in rural and low-income groups.\",\n      \"vulnerable_groups\": \"Women (screening access), rural populations, patients requiring high-cost therapies.\"\n    },\n    \"current_coverage_assessment\": {\n      \"existing_services\": \"Limited organised screening (county pilot sites), few pathology labs with capacity, 4\u20136 radiotherapy centres mostly urban.\",\n      \"geographic_availability\": \"Majority of counties lack radiotherapy and comprehensive oncology services.\",\n      \"capacity_utilization\": \"Radiotherapy centres operate at high utilisation with long queues.\",\n      \"wait_times\": \"Delays from referral to diagnostic biopsy and to initiation of therapy commonly 1\u20136 months.\"\n    },\n    \"health_system_impact_analysis\": {\n      \"level_1_2_impact\": \"Limited community awareness and screening outreach; CHVs underutilised for cancer education.\",\n      \"level_3_impact\": \"Health centres lack capacity for visual inspection for cervical cancer, clinical breast exam training.\",\n      \"level_4_impact\": \"County hospitals lack pathology turnaround, chemotherapy safety infrastructure and radiotherapy.\",\n      \"level_5_6_impact\": \"Tertiary centres overwhelmed with advanced cases; limited palliative care integration.\",\n      \"referral_pathway_gaps\": \"Weak referral coordination, limited patient navigators, high out-of-pocket costs causing treatment interruption.\"\n    },\n    \"clinical_evidence_base\": {\n      \"international_guidelines\": \"WHO recommends organised cervical screening (HPV testing/VIA) and breast awareness with timely referral; radiotherapy is essential for curative care.\",\n      \"clinical_effectiveness\": \"Screening and early treatment markedly reduce mortality (cervical screening can reduce incidence by >50%).\",\n      \"timing_criticality\": \"Early-stage treatment window narrow \u2014 delays shift patients to palliative care.\",\n      \"cost_effectiveness\": \"Screening (HPV/VIA) and timely radiotherapy/chemotherapy are cost-effective relative to late-stage care and palliative-only approaches.\"\n    },\n    \"recommended_interventions\": {\n      \"immediate_additions\": [\n        \"Scale national cervical and breast screening to all counties using HPV testing/VIA and clinical breast exam with referral pathways.\",\n        \"Expand diagnostic pathology capacity via hub-and-spoke models and telepathology.\",\n        \"Increase radiotherapy capacity (additional LINACs) and decentralise chemotherapy to Level 5 hospitals with safe infusion units.\"\n      ],\n      \"service_specifications\": [\n        \"Screening: target women 25\u201349 for cervical screening and organised recall systems.\",\n        \"Diagnostics: 7\u201314 day pathology turnaround for priority cancers; imaging access (mammography, CT, MRI) in regional hubs.\",\n        \"Treatment: standardised oncology protocols, chemotherapy safety standards, radiotherapy planning and maintenance schedules.\"\n      ],\n      \"implementation_phases\": [\n        \"Phase 1 (0\u201312 months): Scale screening in 15 high-burden counties and upgrade pathology hubs; strengthen referral navigation.\",\n        \"Phase 2 (12\u201336 months): Procure and commission additional radiotherapy units and chemotherapy capacity in regional centres.\",\n        \"Phase 3 (36\u201360 months): Full national coverage with tele-oncology support and integration into NHIF benefit packages.\"\n      ]\n    },\n    \"resource_requirements\": {\n      \"human_resources\": \"Train pathologists (increase workforce by 50%), oncology nurses, radiotherapy physicists, clinical oncologists.\",\n      \"infrastructure\": \"Additional LINACs, pathology labs, cold chain for HPV samples, mammography units in regional hubs.\",\n      \"training_needs\": \"In-service training for screening, biopsy techniques, chemotherapy safety, telepathology systems.\",\n      \"estimated_cost\": \"KES 12 billion over 5 years for phased scale-up (screening, diagnostics, radiotherapy expansion).\"\n    },\n    \"implementation_feasibility\": {\n      \"technical_feasibility\": \"MEDIUM \u2014 requires capital equipment, workforce development and maintenance contracts.\",\n      \"financial_feasibility\": \"MEDIUM to LOW \u2014 high capital costs but high impact; financing through public\u2013private partnerships and NHIF possible.\",\n      \"political_feasibility\": \"HIGH \u2014 cancer control is a political priority with public support.\",\n      \"timeline_realistic\": \"5 years for meaningful improvement in early detection and treatment capacity.\"\n    },\n    \"success_metrics\": {\n      \"process_indicators\": \"Proportion of eligible women screened annually; pathology turnaround times; LINAC operational hours.\",\n      \"outcome_indicators\": \"Stage distribution at diagnosis (shift to earlier stages), time from diagnosis to treatment.\",\n      \"impact_indicators\": \"Cancer-specific mortality rates and 5\u2011year survival for common cancers.\",\n      \"equity_indicators\": \"Screening coverage by county and socio-economic quintile; rural access to diagnostic hubs.\"\n    },\n    \"kenya_context_integration\": {\n      \"county_variations\": \"High-burden and urban counties need advanced oncology; pastoral and remote counties need mobile screening and specimen transport.\",\n      \"cultural_considerations\": \"Community sensitisation to counter stigma, use of CHVs and women's groups to increase uptake.\",\n      \"integration_opportunities\": \"Integrate cervical screening into maternal & child health clinics and HIV platforms; use existing lab networks.\",\n      \"sustainability_factors\": \"NHIF reimbursement for screening and treatment, county budget lines for maintenance and workforce retention.\"\n    }\n  },\n  {\n    \"gap_id\": \"PNEUMONIA_PREVENTION_TREATMENT_003\",\n    \"gap_category\": \"pneumonia_prevention_and_oxygen_therapy\",\n    \"gap_type\": \"insufficient_service_coverage\",\n    \"clinical_priority\": \"HIGH\",\n    \"description\": \"Pneumonia is the leading registered cause of death yet gaps exist in preventive interventions (vaccination, nutrition), diagnosis, oxygen systems and community case management, especially for children and the elderly in rural areas.\",\n    \"kenya_epidemiological_context\": {\n      \"disease_burden\": \"Pneumonia is the foremost registered cause of death across age groups; major contributor to under-5 mortality.\",\n      \"prevalence_data\": \"High incidence among children under 5 and increased vulnerability among adults with COPD, HIV and the elderly.\",\n      \"current_outcomes\": \"Mortality remains high where oxygen therapy and timely antibiotics are not available.\",\n      \"geographic_burden\": \"Rural counties and informal urban settlements have higher case-fatality due to delayed care and weak referral.\"\n    },\n    \"affected_populations\": {\n      \"primary_population\": \"Children under 5, elderly, and adults with chronic lung disease or immunosuppression.\",\n      \"estimated_annual_cases\": \"Estimated severe pneumonia cases requiring admission in children and adults in the tens to hundreds of thousands annually (countrywide).\",\n      \"demographic_profile\": \"Predominantly rural children under 5 and older adults across counties with low vaccination/nutrition coverage.\",\n      \"vulnerable_groups\": \"Children <5, malnourished children, HIV-positive individuals, elderly, low-income households.\"\n    },\n    \"current_coverage_assessment\": {\n      \"existing_services\": \"Routine childhood immunisation exists but gaps in PCV/HiB coverage in some counties; oxygen supply unreliable in many facilities.\",\n      \"geographic_availability\": \"Functional oxygen and pulse oximetry available in tertiary centres and some county hospitals; many Level 3\u20134 facilities lack equipment.\",\n      \"capacity_utilization\": \"Referral hospitals overwhelmed during peaks (e.g., seasonal spikes).\",\n      \"wait_times\": \"Delays in referral due to transport and bed shortages; limited community-level antibiotic availability for severe cases.\"\n    },\n    \"health_system_impact_analysis\": {\n      \"level_1_2_impact\": \"Community health volunteers not fully enabled for pneumonia identification and early referral; oral antibiotics inconsistent.\",\n      \"level_3_impact\": \"Health centres lack pulse oximeters and continuous oxygen sources.\",\n      \"level_4_impact\": \"County hospitals lack robust oxygen plants, concentrators maintenance and trained staff.\",\n      \"level_5_6_impact\": \"Tertiary hospitals provide critical care but are distant for many patients.\",\n      \"referral_pathway_gaps\": \"Weak emergency transport and triage; no standard oxygen maintenance plans at facility level.\"\n    },\n    \"clinical_evidence_base\": {\n      \"international_guidelines\": \"WHO IMCI and oxygen therapy guidelines recommend pulse oximetry and oxygen for hypoxaemia; PCV and Hib vaccines reduce severe pneumonia.\",\n      \"clinical_effectiveness\": \"Pulse oximetry and reliable oxygen reduce pneumonia mortality substantially; vaccination reduces incidence markedly.\",\n      \"timing_criticality\": \"Hypoxaemia identification and oxygen within hours can be life-saving.\",\n      \"cost_effectiveness\": \"Oxygen systems, pulse oximetry and vaccination are highly cost-effective interventions.\"\n    },\n    \"recommended_interventions\": {\n      \"immediate_additions\": [\n        \"Nationwide roll-out of pulse oximetry and oxygen concentrators with maintenance plans to all Level 3\u20135 facilities.\",\n        \"Scale-up of PCV and Hib vaccination coverage and integrated management of childhood illness at community level.\",\n        \"Strengthen community case management (CHVs) for early detection and referral and ensure emergency transport links.\"\n      ],\n      \"service_specifications\": [\n        \"Oxygen systems: continuous supply, concentrator plus cylinder backups, biomedical maintenance contracts.\",\n        \"Community packages: IMCI-trained CHVs, stocked antibiotic kits, referral vouchers for transport.\",\n        \"Monitoring: oxygen usage logs, pulse oximetry screening for all suspected pneumonia cases.\"\n      ],\n      \"implementation_phases\": [\n        \"Phase 1 (0\u20136 months): Provide pulse oximeters and concentrators to high-burden counties and train staff/CHVs.\",\n        \"Phase 2 (6\u201324 months): Scale to all Level 3\u20135 facilities, establish maintenance contracts and oxygen plants where feasible.\",\n        \"Phase 3 (24\u201348 months): Integrate preventive measures (nutrition, vaccination) and strengthen long-term supply chains.\"\n      ]\n    },\n    \"resource_requirements\": {\n      \"human_resources\": \"Train clinicians and CHVs in IMCI, oxygen therapy, and equipment maintenance; strengthen biomedical technicians.\",\n      \"infrastructure\": \"Purchase of pulse oximeters, oxygen concentrators, cylinders and maintenance tools; cold chain strengthening for vaccines.\",\n      \"training_needs\": \"IMCI refresher, oxygen therapy protocols, biomedical technician apprenticeships.\",\n      \"estimated_cost\": \"KES 2.5 billion over 3 years for equipment, training and maintenance in all counties.\"\n    },\n    \"implementation_feasibility\": {\n      \"technical_feasibility\": \"HIGH \u2014 proven technologies and delivery models with clear supply-chain and maintenance needs.\",\n      \"financial_feasibility\": \"HIGH \u2014 relatively low-cost interventions with strong mortality reduction potential.\",\n      \"political_feasibility\": \"HIGH \u2014 aligns with child survival and UHC priorities.\",\n      \"timeline_realistic\": \"2\u20133 years for widespread functional oxygen and pulse oximetry coverage.\"\n    },\n    \"success_metrics\": {\n      \"process_indicators\": \"Proportion of facilities with functional pulse oximetry and continuous oxygen; vaccine coverage rates.\",\n      \"outcome_indicators\": \"Under-5 pneumonia case fatality rates, hypoxaemia detection rates and time-to-oxygen.\",\n      \"impact_indicators\": \"Reduction in pneumonia-attributable deaths across all ages.\",\n      \"equity_indicators\": \"Coverage of oxygen and vaccination in rural vs urban facilities; CHV reach in remote wards.\"\n    },\n    \"kenya_context_integration\": {\n      \"county_variations\": \"Arid and remote counties need solar-powered concentrators and stronger transport systems; high-density urban settlements need outreach vaccination drives.\",\n      \"cultural_considerations\": \"Community engagement to encourage early care-seeking and adherence to referral advice.\",\n      \"integration_opportunities\": \"Link oxygen and IMCI strengthening with existing maternal-child health and immunisation programmes.\",\n      \"sustainability_factors\": \"County budget allocation for biomedical maintenance, pooled procurement of concentrators and integration into NHIF essential packages.\"\n    }\n  },\n  {\n    \"gap_id\": \"EMERGENCY_OBSTETRIC_CARE_004\",\n    \"gap_category\": \"emergency_obstetric_and_newborn_care\",\n    \"gap_type\": \"service_capacity_gap\",\n    \"clinical_priority\": \"HIGH\",\n    \"description\": \"Emergency obstetric and neonatal care (EmONC) services are uneven across counties, contributing to persistently high maternal mortality ratio (130\u2013170/100,000) and perinatal deaths; gaps include surgical capacity, blood transfusion, newborn resuscitation and referral systems.\",\n    \"kenya_epidemiological_context\": {\n      \"disease_burden\": \"Maternal mortality remains high with substantial county variation; obstetric haemorrhage, sepsis and hypertensive disorders are major contributors.\",\n      \"prevalence_data\": \"Estimated annual births ~1.0\u20131.2 million; ~15% will experience obstetric complications needing EmONC.\",\n      \"current_outcomes\": \"Delays in receiving definitive care (second and third delays) drive mortality; perinatal mortality remains high in underserved counties.\",\n      \"geographic_burden\": \"Rural and remote counties show higher MMR and lower facility-based delivery rates.\"\n    },\n    \"affected_populations\": {\n      \"primary_population\": \"Pregnant women during labour and postpartum period and neonates requiring resuscitation or specialised care.\",\n      \"estimated_annual_cases\": \"Approximately 150,000\u2013200,000 obstetric complications annually (estimated 15% of births).\",\n      \"demographic_profile\": \"Pregnant women across all reproductive-age groups with higher risk in adolescents and older mothers.\",\n      \"vulnerable_groups\": \"Rural women, adolescents, women in informal settlements, those with limited financial means.\"\n    },\n    \"current_coverage_assessment\": {\n      \"existing_services\": \"Some county referral hospitals provide basic and comprehensive EmONC but many Level 3\u20134 facilities lack signal functions (e.g., blood transfusion, C-section capacity).\",\n      \"geographic_availability\": \"C-section and blood transfusion services concentrated at Level 4\u20136 hospitals; many sub-counties lack timely access.\",\n      \"capacity_utilization\": \"Referral hospitals overwhelmed during peak delivery periods; shortages of skilled birth attendants.\",\n      \"wait_times\": \"Delays to surgery and blood transfusion measured in hours due to transport and availability.\"\n    },\n    \"health_system_impact_analysis\": {\n      \"level_1_2_impact\": \"Community recognition and referral cues exist but transport and birth-preparedness limited.\",\n      \"level_3_impact\": \"Health centres often manage normal deliveries but lack capacity for obstetric emergencies.\",\n      \"level_4_impact\": \"County hospitals variably provide comprehensive EmONC; workforce gaps for obstetrics and anaesthesia.\",\n      \"level_5_6_impact\": \"Tertiary centres handle complex cases with referrals from multiple counties leading to overload.\",\n      \"referral_pathway_gaps\": \"Weak ambulance networks, no standard transfer protocols, limited blood bank networks at county level.\"\n    },\n    \"clinical_evidence_base\": {\n      \"international_guidelines\": \"WHO and UN EmONC signal functions define life-saving interventions for maternal and newborn survival.\",\n      \"clinical_effectiveness\": \"Timely EmONC (C-section, blood transfusion, parenteral antibiotics) prevents majority of maternal deaths.\",\n      \"timing_criticality\": \"Interventions often needed within minutes to hours (e.g., postpartum haemorrhage management).\",\n      \"cost_effectiveness\": \"Strengthening EmONC is highly cost-effective with large mortality reductions per investment unit.\"\n    },\n    \"recommended_interventions\": {\n      \"immediate_additions\": [\n        \"Ensure all Level 4 hospitals provide comprehensive EmONC (6 signal functions), including 24/7 C-section and blood transfusion readiness.\",\n        \"Strengthen newborn care (resuscitation, KMC units) at Level 4\u20135 facilities.\",\n        \"Establish functional referral and emergency transport networks with standardised protocols.\"\n      ],\n      \"service_specifications\": [\n        \"24/7 skilled birth attendants, obstetric theatre readiness, on-call anaesthesia, rapid blood transfusion protocols and neonatal resuscitation equipment.\",\n        \"Training: Emergency obstetric drills, obstetric anaesthesia skill enhancement, blood safety and storage protocols.\",\n        \"Referral: Ambulance dispatch, stabilisation checklists, teleconsultation back-up to tertiary centres.\"\n      ],\n      \"implementation_phases\": [\n        \"Phase 1 (0\u20136 months): Map EmONC gaps, equip and staff 50 high-need Level 4 hospitals, establish blood storage hubs.\",\n        \"Phase 2 (6\u201324 months): Scale to remaining Level 4 hospitals and strengthen referral networks and transport vouchers for poorest women.\",\n        \"Phase 3 (24\u201348 months): Consolidate 24/7 services nationwide and integrate with maternal death surveillance and response (MDSR).\"\n      ]\n    },\n    \"resource_requirements\": {\n      \"human_resources\": \"Train additional obstetricians, anaesthetists, midwives and neonatal nurses; deploy anaesthesia technicians to county hospitals.\",\n      \"infrastructure\": \"Theatres, blood storage and cold chain, neonatal units (KMC, CPAP), ambulances and communication systems.\",\n      \"training_needs\": \"Advanced Life Support in Obstetrics, neonatal resuscitation, blood transfusion safety and surgical mentorship programs.\",\n      \"estimated_cost\": \"KES 6 billion over 3 years for upgrades to 47 counties (theatre upgrades, staffing, ambulances and blood hubs).\"\n    },\n    \"implementation_feasibility\": {\n      \"technical_feasibility\": \"HIGH \u2014 uses well-established EmONC models with clear signal functions.\",\n      \"financial_feasibility\": \"MEDIUM \u2014 requires capital and recurrent staffing investments but substantial mortality reduction supports prioritisation.\",\n      \"political_feasibility\": \"HIGH \u2014 maternal health is a top political and development priority across counties.\",\n      \"timeline_realistic\": \"3 years to reach functional 24/7 EmONC in most county referral hospitals with phased investment.\"\n    },\n    \"success_metrics\": {\n      \"process_indicators\": \"Proportion of facilities with all EmONC signal functions; number of functional ambulances per county.\",\n      \"outcome_indicators\": \"Facility maternal mortality ratio, case fatality rate for obstetric haemorrhage and sepsis.\",\n      \"impact_indicators\": \"Reduction in national MMR and perinatal mortality rates.\",\n      \"equity_indicators\": \"Proportion of sub-counties with timely access to C-section within 2 hours; financial protection for poorest women.\"\n    },\n    \"kenya_context_integration\": {\n      \"county_variations\": \"Arid and sparsely populated counties need tailored transport solutions; densely populated counties need more theatre throughput.\",\n      \"cultural_considerations\": \"Engage TBAs, CHVs and community leaders for birth preparedness and referral acceptance.\",\n      \"integration_opportunities\": \"Link EmONC strengthening with MNCH programmes, NHIF maternal packages and county emergency medical services.\",\n      \"sustainability_factors\": \"County budget lines for staffing and ambulance maintenance; mentorship networks to retain staff in remote counties.\"\n    }\n  },\n  {\n    \"gap_id\": \"MENTAL_HEALTH_INTEGRATION_005\",\n    \"gap_category\": \"mental_health_services_integration\",\n    \"gap_type\": \"service_delivery_gap\",\n    \"clinical_priority\": \"HIGH\",\n    \"description\": \"Mental health services remain fragmented with inadequate integration into primary care, severe workforce shortages and limited access to community-based care and inpatient psychiatric services, despite rising burden.\",\n    \"kenya_epidemiological_context\": {\n      \"disease_burden\": \"Growing burden of common mental disorders and substance use disorders; severe mental illness prevalence estimated at 1\u20133% with higher rates of depression/anxiety.\",\n      \"prevalence_data\": \"Population-level estimates suggest substantial unmet need with many not accessing any care.\",\n      \"current_outcomes\": \"High morbidity, reduced productivity, increased comorbidity with NCDs and elevated suicide risk in some groups.\",\n      \"geographic_burden\": \"Specialist services concentrated in urban centres; rural counties have minimal or no psychiatric services.\"\n    },\n    \"affected_populations\": {\n      \"primary_population\": \"People with common mental disorders (depression, anxiety), severe mental illness (psychosis, bipolar), adolescents and substance users.\",\n      \"estimated_annual_cases\": \"Millions affected by common mental disorders; severe cases in the low hundreds of thousands needing specialised care.\",\n      \"demographic_profile\": \"Disproportionate impact on urban poor, young adults, and individuals with chronic NCDs or HIV.\",\n      \"vulnerable_groups\": \"Adolescents, HIV-positive patients, people in informal settlements, internally displaced populations.\"\n    },\n    \"current_coverage_assessment\": {\n      \"existing_services\": \"Psychiatric hospitals and some county mental health units; limited outpatient counselling and community rehabilitation programmes.\",\n      \"geographic_availability\": \"Services largely in Nairobi and a few county referral hospitals; many counties have no psychiatrist or clinical psychologist.\",\n      \"capacity_utilization\": \"Existing specialist units overburdened; long waitlists for outpatient care.\",\n      \"wait_times\": \"Weeks to months for specialist appointments; primary care providers have limited capacity to manage mental health needs.\"\n    },\n    \"health_system_impact_analysis\": {\n      \"level_1_2_impact\": \"CHVs and primary care rarely trained to detect and manage common mental disorders or refer appropriately.\",\n      \"level_3_impact\": \"Health centres lack counselling services, psychotropic medication supply inconsistent.\",\n      \"level_4_impact\": \"County hospitals need integrated mental health clinics, liaison psychiatry and social support links.\",\n      \"level_5_6_impact\": \"Specialist hospitals handle complex cases but lack outreach and training programmes for counties.\",\n      \"referral_pathway_gaps\": \"No systematic stepped-care model; weak community rehabilitation and social support services leading to relapse and rehospitalisation.\"\n    },\n    \"clinical_evidence_base\": {\n      \"international_guidelines\": \"WHO mhGAP recommends task-shifting to integrate mental health into primary care and community-based services.\",\n      \"clinical_effectiveness\": \"Task-shared psychological interventions and psychotropic treatment in primary care reduce morbidity and are cost-effective.\",\n      \"timing_criticality\": \"Early detection and treatment reduce chronicity and suicide risk; adolescent interventions have long-term benefits.\",\n      \"cost_effectiveness\": \"Integration into PHC and task-shifting yields high returns via improved productivity and reduced inpatient costs.\"\n    },\n    \"recommended_interventions\": {\n      \"immediate_additions\": [\n        \"Implement mhGAP-based integration into all Level 3\u20135 facilities with task-shifting to nurses and clinical officers.\",\n        \"Establish county mental health units with outreach to primary care and CHV-supported community psychosocial programmes.\",\n        \"Ensure steady supply of essential psychotropic medicines in the national EML and county pharmacies.\"\n      ],\n      \"service_specifications\": [\n        \"Stepped-care model: screening at community/primary care, brief psychosocial interventions, referral pathways to specialised care.\",\n        \"Multidisciplinary teams: psychiatric clinical officers, psychologists, social workers, peer support groups.\",\n        \"Digital/telepsychiatry support from tertiary centres for supervision and case management.\"\n      ],\n      \"implementation_phases\": [\n        \"Phase 1 (0\u20136 months): Pilot mhGAP training and supervision in 10 counties with highest service gaps.\",\n        \"Phase 2 (6\u201324 months): Scale mhGAP training nationwide, set up county mental health focal points and supply chains.\",\n        \"Phase 3 (24\u201348 months): Consolidate community rehabilitation, peer support and integrate mental health into NHIF benefit packages.\"\n      ]\n    },\n    \"resource_requirements\": {\n      \"human_resources\": \"Scale training for ~2,500 primary care providers in mhGAP, recruit county-level psychiatric clinical officers and psychologists.\",\n      \"infrastructure\": \"Basic counselling spaces in primary care, telemedicine platforms for supervision, community rehabilitation centres.\",\n      \"training_needs\": \"mhGAP training, psychosocial interventions training, supervisory mentorship from psychiatrists.\",\n      \"estimated_cost\": \"KES 1.8 billion over 3 years for training, supervision, essential medicines and telepsychiatry platforms.\"\n    },\n    \"implementation_feasibility\": {\n      \"technical_feasibility\": \"HIGH \u2014 strong evidence for task-shifting models and digital supervision.\",\n      \"financial_feasibility\": \"MEDIUM \u2014 moderate recurrent costs; high value-for-money through reduced inpatient stays and improved productivity.\",\n      \"political_feasibility\": \"MEDIUM to HIGH \u2014 growing recognition but stigma and competing priorities require advocacy.\",\n      \"timeline_realistic\": \"3 years for functional integration into PHC with pilot-to-scale approach.\"\n    },\n    \"success_metrics\": {\n      \"process_indicators\": \"Number of primary care providers trained in mhGAP; proportion of facilities offering basic mental health services.\",\n      \"outcome_indicators\": \"Reduction in untreated prevalence, symptom score improvements for treated patients, suicide attempt rates.\",\n      \"impact_indicators\": \"Reduced psychiatric admissions for relapse, improved economic productivity indicators among beneficiaries.\",\n      \"equity_indicators\": \"Access to mental health services in rural vs urban counties, uptake among adolescents and women.\"\n    },\n    \"kenya_context_integration\": {\n      \"county_variations\": \"Urban counties require youth-friendly mental health services; remote counties need telepsychiatry and CHV-led psychosocial support.\",\n      \"cultural_considerations\": \"Stigma reduction campaigns, engagement with faith and community leaders, use of local languages in counselling.\",\n      \"integration_opportunities\": \"Leverage HIV, maternal health and NCD platforms for screening and integrated care.\",\n      \"sustainability_factors\": \"Inclusion of mental health in county health strategic plans, NHIF reimbursement for psychosocial interventions and psychotropic medicines, local workforce retention incentives.\"\n    }\n  }\n]"
  },
  "coverage_analysis": {
    "coverage_gaps": [
      {
        "gap_id": "COVERAGE_SERVICE_CATEGORY_01",
        "gap_category": "service_category",
        "gap_type": "Community health workforce functionality",
        "coverage_priority": "HIGH",
        "description": "Large variability in functionality, supervision, remuneration and commodity support for Community Health Volunteers (CHVs) leading to inconsistent outreach, health promotion, early case detection and referral from Level 1. Gaps include weak supervision, irregular stipends, and lack of standardized CHV service packages under SHIF/PHC fund.",
        "kenya_context": {
          "service_delivery_platform": "Level 1 (community units) with interfaces to Level 2-3",
          "population_impact": "Rural households, low\u2011income urban informal settlements, pregnant women, children under 5",
          "geographic_scope": "National but concentrated effect in arid and marginalized counties (Garissa, Mandera, Wajir, Turkana, Samburu); urban informal settlements (Nairobi, Mombasa)",
          "current_coverage_level": "Estimated functional CHV coverage ~50% (wide county variation: 20\u201380%)"
        },
        "who_essential_services": "Preventive services (health promotion, community case management)",
        "coverage_analysis": {
          "service_availability": "Limited",
          "geographic_accessibility": "Variable - good in some counties, poor in remote/arid counties",
          "financial_accessibility": "Mostly affordable to users but sustainability issues due to lack of CHV financing",
          "quality_adequacy": "Suboptimal (training, supervision and SOPs inconsistent)"
        },
        "clinical_integration": "Supports but differs from emergency obstetric and newborn care gaps \u2014 CHVs are critical for early identification/referral (antenatal visits, danger signs) but clinical EmONC service availability is separate.",
        "interventions": {
          "immediate_coverage_expansion": [
            "Standardize and finance a CHV package (stipend, training, supervision) under PHC Fund/SHIF with performance monitoring",
            "Provide basic commodity kits (malaria RDTs, oral rehydration salts, contraceptives) to CHVs"
          ],
          "service_integration_opportunities": [
            "Link CHV outreach with immunization campaigns, TB/HIV community differentiation of care, NCD screening drives"
          ],
          "infrastructure_requirements": [
            "Digital supervision tools (mobile reporting), transport allowances, supply chain linkage to Level 2 facilities"
          ]
        },
        "implementation": {
          "county_integration": "Counties adopt standardized CHV package, integrate in county HR plans and provide top-ups via PHC Fund; CHV roles integrated into referral workflows",
          "funding_mechanisms": "PHC Fund for recurrent CHV costs; SHIF to reimburse CHV\u2011facilitated referrals; county budgets co\u2011finance",
          "timeline_realistic": "12\u201324 months (policy standardization 3\u20136 months; phased roll\u2011out 12\u201324 months)"
        },
        "detection_method": "ai_coverage_analysis",
        "analysis_type": "comprehensive_coverage",
        "pdf_page_sources": [
          "Pages 1-18 (Policy Structure)"
        ],
        "validation_ready": true
      },
      {
        "gap_id": "COVERAGE_SERVICE_CATEGORY_02",
        "gap_category": "service_category",
        "gap_type": "Primary care diagnostic capacity (laboratory and point\u2011of\u2011care)",
        "coverage_priority": "HIGH",
        "description": "Primary care facilities (Level 2\u20133) frequently lack basic diagnostic tests (biochemistry, basic hematology, point\u2011of\u2011care glucose, rapid diagnostics) and trained lab staff, limiting evidence\u2011based management of common conditions (malaria, sepsis, NCDs).",
        "kenya_context": {
          "service_delivery_platform": "Level 2\u20133 (dispensaries, health centres)",
          "population_impact": "Rural populations and peri\u2011urban poor who rely on primary care for first contact",
          "geographic_scope": "Widespread gaps, worse in small counties and remote sub\u2011counties (Northern and ASAL counties)",
          "current_coverage_level": "Estimated availability of basic diagnostics at Level 2\u20133 ~40%"
        },
        "who_essential_services": "Curative services (diagnostic capacity for primary care management)",
        "coverage_analysis": {
          "service_availability": "Limited",
          "geographic_accessibility": "Limited (many communities must travel to Level 4+ for tests)",
          "financial_accessibility": "Limited \u2014 out\u2011of\u2011pocket testing common when not provided free",
          "quality_adequacy": "Suboptimal (equipment maintenance, QC and trained personnel lacking)"
        },
        "clinical_integration": "Relates to cancer and imaging gaps in higher levels but focuses on basic diagnostics required to manage most primary care conditions, not specialised imaging.",
        "interventions": {
          "immediate_coverage_expansion": [
            "Deploy standard essential point\u2011of\u2011care test (POCT) packages to Level 2\u20133 (malaria RDT, urine dipstick, glucometer, Hb, RPR/HIV rapid tests)",
            "Task\u2011shift training and mentorship for facility staff in POCT use and quality control"
          ],
          "service_integration_opportunities": [
            "Integrate POCT into NCD and maternal health visits, HIV/TB screening and referral algorithms"
          ],
          "infrastructure_requirements": [
            "Cold chain where needed, basic lab benches, QA systems, supply chain strengthening"
          ]
        },
        "implementation": {
          "county_integration": "County labs to adopt hub\u2011and\u2011spoke model with Level 3 as hubs for confirmatory testing; county quality assurance teams supervise",
          "funding_mechanisms": "PHC Fund procurement for POCT; SHIF reimbursement linked to diagnostics performed at accredited primary facilities",
          "timeline_realistic": "6\u201318 months for POCT roll\u2011out and training; ongoing QA"
        },
        "detection_method": "ai_coverage_analysis",
        "analysis_type": "comprehensive_coverage",
        "pdf_page_sources": [
          "Pages 1-18 (Policy Structure)"
        ],
        "validation_ready": true
      },
      {
        "gap_id": "COVERAGE_SERVICE_CATEGORY_03",
        "gap_category": "service_category",
        "gap_type": "Essential medicines and commodity security at primary level",
        "coverage_priority": "HIGH",
        "description": "Frequent stockouts of essential medicines and family planning commodities at Level 2\u20133 disrupt continuity of care, increase OOP spending and drive bypassing to higher levels.",
        "kenya_context": {
          "service_delivery_platform": "Level 2\u20133 primarily; impacts Level 1 outreach services",
          "population_impact": "Pregnant women, children, NCD patients, contraceptive users, rural poor",
          "geographic_scope": "National with higher stockout rates in remote counties and during supply chain shocks",
          "current_coverage_level": "Estimated continuous availability of key tracer medicines at primary care ~55%"
        },
        "who_essential_services": "Curative services (essential medicines provision)",
        "coverage_analysis": {
          "service_availability": "Limited",
          "geographic_accessibility": "Variable with remote clinics frequently out of stock",
          "financial_accessibility": "Limited \u2014 patients purchase meds OOP when stockouts occur",
          "quality_adequacy": "Suboptimal (expiry management, forecasting weaknesses)"
        },
        "clinical_integration": "Essential medicines gaps compound clinical gaps (e.g., in surgical and emergency care) by limiting peri\u2011operative and chronic disease management, but this gap focuses on supply chain and availability rather than clinical capacity.",
        "interventions": {
          "immediate_coverage_expansion": [
            "Strengthen county-led quantification and push/pull supply systems for PHC facilities; procure buffer stocks for remote clinics",
            "Introduce performance\u2011based supply indicators tied to PHC Fund disbursements"
          ],
          "service_integration_opportunities": [
            "Align commodity forecasting across programs (maternal, HIV, NCDs) to maximize procurement efficiencies"
          ],
          "infrastructure_requirements": [
            "Improved storage at facility level, supply chain information systems (eLMIS) integration to county DHIS2"
          ]
        },
        "implementation": {
          "county_integration": "Counties incorporate essential medicine performance metrics into annual workplans and allocate PHC funds for logistics; SHIF lists medicines for reimbursement to reduce OOP",
          "funding_mechanisms": "PHC Fund for recurrent procurement and storage; SHIF reimbursements for medicines provided during accredited service encounters",
          "timeline_realistic": "6\u201324 months (short\u2011term buffer stocks immediately; system fixes within 12\u201324 months)"
        },
        "detection_method": "ai_coverage_analysis",
        "analysis_type": "comprehensive_coverage",
        "pdf_page_sources": [
          "Pages 1-18 (Policy Structure)"
        ],
        "validation_ready": true
      },
      {
        "gap_id": "COVERAGE_CARE_LEVEL_01",
        "gap_category": "care_level",
        "gap_type": "Referral and transport system weaknesses",
        "coverage_priority": "HIGH",
        "description": "Fragmented ambulance services, poor referral communication, and no standardized county ambulance dispatch lead to delays in time\u2011sensitive referrals (medical, surgical, trauma).",
        "kenya_context": {
          "service_delivery_platform": "Inter\u2011level (Level 2\u20136 referrals), emergency corridor",
          "population_impact": "All age groups requiring urgent transfer \u2014 trauma victims, surgical emergencies, severe medical cases from rural areas",
          "geographic_scope": "Nationwide, acute impact in remote and sparsely populated counties (ASALs)",
          "current_coverage_level": "Estimated coverage of functional ambulance referral system ~30%"
        },
        "who_essential_services": "Emergency care services (timely access to higher\u2011level care)",
        "coverage_analysis": {
          "service_availability": "Limited",
          "geographic_accessibility": "Poor in remote regions (long travel times)",
          "financial_accessibility": "Often expensive or unavailable - high indirect costs",
          "quality_adequacy": "Suboptimal (lack of trained pre\u2011hospital staff, no standard triage/ referral protocols)"
        },
        "clinical_integration": "Supports emergency obstetric/newborn care and critical care pathways but targets system processes (transport and communication) rather than clinical service content.",
        "interventions": {
          "immediate_coverage_expansion": [
            "Establish county ambulance hub networks with GPS dispatch and triage protocols; use private fleet contracting where feasible",
            "Standardize referral forms and digital referral tracking integrated into DHIS2"
          ],
          "service_integration_opportunities": [
            "Link ambulance services to CHV early detection and to facility triage for time\u2011sensitive referrals (e.g., stroke, trauma, obstetric emergencies)"
          ],
          "infrastructure_requirements": [
            "Ambulance vehicles, communication infrastructure, fuel/subsidy schemes, pre\u2011hospital care training"
          ]
        },
        "implementation": {
          "county_integration": "Counties develop ambulance service plans, integrate with emergency call centres and hospital on\u2011call rosters",
          "funding_mechanisms": "Emergency, Chronic and Critical Illness Fund for acute transport start\u2011up; SHIF to reimburse transfers tied to approved referral pathways; county budgets for recurrent costs",
          "timeline_realistic": "6\u201336 months (urban hubs faster; remote county coverage requires phased scale up over 18\u201336 months)"
        },
        "detection_method": "ai_coverage_analysis",
        "analysis_type": "comprehensive_coverage",
        "pdf_page_sources": [
          "Pages 1-18 (Policy Structure)",
          "Pages 19-54 (Annex Procedures)"
        ],
        "validation_ready": true
      },
      {
        "gap_id": "COVERAGE_CARE_LEVEL_02",
        "gap_category": "care_level",
        "gap_type": "Emergency unit readiness at secondary hospitals",
        "coverage_priority": "HIGH",
        "description": "Many Level 4 county hospitals lack organized emergency units with trained staff, triage systems, essential emergency drugs and equipment, compromising timely acute care for trauma, sepsis and acute NCD events.",
        "kenya_context": {
          "service_delivery_platform": "Level 4 (county hospitals) with referral links to Level 5",
          "population_impact": "Urban and rural populations reliant on county hospitals for emergency care",
          "geographic_scope": "County hospitals nationally; worse in smaller counties with limited budgets",
          "current_coverage_level": "Estimated fully operational emergency units in Level 4 hospitals ~40%"
        },
        "who_essential_services": "Emergency care services (facility readiness and emergency treatment)",
        "coverage_analysis": {
          "service_availability": "Limited",
          "geographic_accessibility": "Moderate (hospitals exist but not fully functional emergency units)",
          "financial_accessibility": "Mixed \u2014 some services require OOP when commodities lacking",
          "quality_adequacy": "Suboptimal (triage and resuscitation protocols inconsistently applied)"
        },
        "clinical_integration": "Complementary to EmONC gaps (obstetric emergencies) but broader \u2014 covering trauma, surgical and medical emergencies not limited to maternal/newborn care.",
        "interventions": {
          "immediate_coverage_expansion": [
            "Roll out WHO Basic Emergency Care training for facility teams and establish triage areas in Level 4 hospitals",
            "Equip emergency units with essential resuscitation kits and emergency drug stocks"
          ],
          "service_integration_opportunities": [
            "Integrate emergency data into county health information systems and SHIF reporting to track outcomes"
          ],
          "infrastructure_requirements": [
            "Designated emergency unit space, oxygen supply reliability, basic monitoring equipment"
          ]
        },
        "implementation": {
          "county_integration": "Counties prioritize emergency unit upgrades in annual plans; integrate with ambulance referral pathways",
          "funding_mechanisms": "SHIF and Emergency Fund for capital/initial kit purchases; PHC Fund and county recurrent budgets for staffing and maintenance",
          "timeline_realistic": "6\u201324 months (training and basic equipment within 6\u201312 months; physical renovations 12\u201324 months)"
        },
        "detection_method": "ai_coverage_analysis",
        "analysis_type": "comprehensive_coverage",
        "pdf_page_sources": [
          "Pages 1-18 (Policy Structure)"
        ],
        "validation_ready": true
      },
      {
        "gap_id": "COVERAGE_SERVICE_CATEGORY_04",
        "gap_category": "service_category",
        "gap_type": "Intensive care and critical care capacity (adult and paediatric)",
        "coverage_priority": "HIGH",
        "description": "Limited ICU beds, ventilators, trained critical care nurses and physicians at Level 4\u20136 resulting in constrained capacity to manage severe medical and surgical conditions, seasonal surges and public health emergencies.",
        "kenya_context": {
          "service_delivery_platform": "Level 4\u20136 (county, referral and national hospitals)",
          "population_impact": "Severe cases across age groups, including trauma, sepsis, severe NCD exacerbations and perioperative critical care",
          "geographic_scope": "Concentrated in urban and referral centres (Nairobi, Mombasa, Kisumu); northern and rural counties largely unserved",
          "current_coverage_level": "Estimated functional ICU bed coverage nationally ~20% of estimated need"
        },
        "who_essential_services": "Curative services (critical care and management of severe illness)",
        "coverage_analysis": {
          "service_availability": "Limited",
          "geographic_accessibility": "Poor outside tertiary urban centres",
          "financial_accessibility": "Expensive due to high-intensity care; limited SHIF tariffs for critical care",
          "quality_adequacy": "Variable \u2014 equipment without trained staff reduces effectiveness"
        },
        "clinical_integration": "Relates to Critical Illness Fund entries in policy but focuses on expanding capacity and equitable geographic distribution rather than clinical guidelines.",
        "interventions": {
          "immediate_coverage_expansion": [
            "Scale up high\u2011dependency units at Level 4 hospitals with basic ventilatory support and oxygen monitoring",
            "Train multidisciplinary teams (nurses, anaesthetists) in critical care protocols"
          ],
          "service_integration_opportunities": [
            "Link critical care capacity planning to surgical, obstetric and emergency services to maximize use",
            "Use tele\u2011ICU mentorship from Level 6 national referral centres"
          ],
          "infrastructure_requirements": [
            "Oxygen plants, reliable power, patient monitoring, ventilators, staff accommodation for shift patterns"
          ]
        },
        "implementation": {
          "county_integration": "Counties designate at least one Level 4 hospital as HDU hub; coordinate with regional referral hospitals for mentorship",
          "funding_mechanisms": "Emergency, Chronic and Critical Illness Fund for capital; SHIF to define critical care reimbursement packages; county budgets for staffing",
          "timeline_realistic": "18\u201336 months (HDU scale up feasible in 18 months; full ICU expansion longer)"
        },
        "detection_method": "ai_coverage_analysis",
        "analysis_type": "comprehensive_coverage",
        "pdf_page_sources": [
          "Pages 1-18 (Policy Structure)",
          "Pages 19-54 (Annex Procedures)"
        ],
        "validation_ready": true
      },
      {
        "gap_id": "COVERAGE_SERVICE_CATEGORY_05",
        "gap_category": "service_category",
        "gap_type": "Surgical workforce distribution and theatre capacity at county level",
        "coverage_priority": "HIGH",
        "description": "Despite an extensive annex of surgical procedures, there is uneven distribution of surgeons, anaesthetists and functioning theatres across counties, limiting access to essential, safe surgery within timely windows.",
        "kenya_context": {
          "service_delivery_platform": "Level 3\u20134 primarily (theatres in Level 4 county hospitals and Level 5 regional hospitals)",
          "population_impact": "Patients needing general, obstetric, orthopaedic, and emergency surgery; rural populations disproportionately affected",
          "geographic_scope": "Urban concentration of specialists in Nairobi, Mombasa and Kisumu; shortage in northern and small rural counties",
          "current_coverage_level": "Access to essential surgical care within 2 hours estimated ~60% nationally but much lower in remote counties"
        },
        "who_essential_services": "Curative services (surgical services and safe anaesthesia)",
        "coverage_analysis": {
          "service_availability": "Limited (procedures listed but capacity uneven)",
          "geographic_accessibility": "Poor in remote counties; travel often >2 hours",
          "financial_accessibility": "Expensive for patients when private providers used",
          "quality_adequacy": "Variable \u2014 infection prevention and anaesthesia safety standards not uniform"
        },
        "clinical_integration": "Complements surgical entries in policy annex and the surgical services package but focuses on human resources and equitable distribution rather than procedural lists.",
        "interventions": {
          "immediate_coverage_expansion": [
            "County surgical workforce plans including incentives/retention packages for specialists to underserved counties",
            "Strengthen surgical hubs with outreach/supervision from Level 5 hospitals"
          ],
          "service_integration_opportunities": [
            "Integrate surgical outreach with CHV referrals, ambulance networks and rehabilitation services"
          ],
          "infrastructure_requirements": [
            "Functional theatres, sterilization equipment, blood bank linkages, perioperative monitoring"
          ]
        },
        "implementation": {
          "county_integration": "Counties create surgical service plans and partner with referral hospitals for mentorship and periodic specialist outreach camps",
          "funding_mechanisms": "SHIF tariff alignment for surgical packages; county capital investments and PHC fund for outreach logistics",
          "timeline_realistic": "12\u201336 months (staffing strategies over 12\u201324 months; infrastructure upgrades 18\u201336 months)"
        },
        "detection_method": "ai_coverage_analysis",
        "analysis_type": "comprehensive_coverage",
        "pdf_page_sources": [
          "Pages 19-54 (Annex Procedures)"
        ],
        "validation_ready": true
      },
      {
        "gap_id": "COVERAGE_SERVICE_CATEGORY_06",
        "gap_category": "service_category",
        "gap_type": "Blood transfusion services and safe blood availability",
        "coverage_priority": "MEDIUM",
        "description": "Inadequate blood collection, screening, storage and distribution systems lead to shortages at county hospitals, affecting obstetric haemorrhage, trauma and surgical safety.",
        "kenya_context": {
          "service_delivery_platform": "Level 4\u20136 hospitals; collection at designated centres",
          "population_impact": "Pregnant/postpartum women, trauma patients, surgical patients",
          "geographic_scope": "Regional disparities: better supply near national/regional centres; shortages in remote counties",
          "current_coverage_level": "Availability of screened blood components for emergencies estimated ~40\u201360% depending on county"
        },
        "who_essential_services": "Curative services (safe blood and transfusion services)",
        "coverage_analysis": {
          "service_availability": "Limited",
          "geographic_accessibility": "Poor in remote/rural counties",
          "financial_accessibility": "Often subsidized but logistic costs high; occasional OOP for private blood",
          "quality_adequacy": "Suboptimal in some storage/ screening practices"
        },
        "clinical_integration": "Supports emergency obstetric and surgical services by ensuring availability of blood but focuses on systems for collection and distribution rather than clinical transfu\u00adsion protocols.",
        "interventions": {
          "immediate_coverage_expansion": [
            "Strengthen county blood collection drives and community donor pools; ensure consistent screening capacity",
            "Establish regional blood storage hubs with reliable cold chain"
          ],
          "service_integration_opportunities": [
            "Coordinate blood availability with referral protocols and ambulance dispatch for time\u2011sensitive transfers"
          ],
          "infrastructure_requirements": [
            "Cold chain equipment for blood storage, testing labs, transport logistics"
          ]
        },
        "implementation": {
          "county_integration": "Counties support blood donor mobilisation and maintain cold storage; integrate with regional hub operations",
          "funding_mechanisms": "SHIF to cover costs of transfusion during accredited episodes; county health budgets and donor support for capital equipment",
          "timeline_realistic": "12\u201324 months for hub establishment and system strengthening"
        },
        "detection_method": "ai_coverage_analysis",
        "analysis_type": "comprehensive_coverage",
        "pdf_page_sources": [
          "Pages 1-18 (Policy Structure)",
          "Pages 19-54 (Annex Procedures)"
        ],
        "validation_ready": true
      },
      {
        "gap_id": "COVERAGE_POPULATION_GROUP_01",
        "gap_category": "population_group",
        "gap_type": "Continuity of TB services including DR\u2011TB in remote areas",
        "coverage_priority": "HIGH",
        "description": "Diagnosis, linkage to care and adherence support for TB and drug\u2011resistant TB remain inconsistent in remote counties, with delays in laboratory turnaround and limited access to new TB diagnostics and second\u2011line drugs at Level 4 and below.",
        "kenya_context": {
          "service_delivery_platform": "Level 2\u20135 (case detection at primary; treatment at higher levels depending on regimen)",
          "population_impact": "Rural populations, PLHIV, marginalized communities, contacts of index TB cases",
          "geographic_scope": "Higher burden and service gaps in populous informal settlements and remote counties (coastal and ASAL zones)",
          "current_coverage_level": "Estimated case detection and treatment completion vary; overall effective coverage ~60\u201370% with DR\u2011TB lower (~30\u201350% depending on county)"
        },
        "who_essential_services": "Preventive and curative services (TB detection and continuity of care)",
        "coverage_analysis": {
          "service_availability": "Limited for DR\u2011TB services; moderate for drug\u2011sensitive TB",
          "geographic_accessibility": "Limited in remote areas due to lab access and stock of second\u2011line drugs",
          "financial_accessibility": "Treatment ostensibly free but access costs and travel pose barriers",
          "quality_adequacy": "Variable \u2014 delays in diagnostics and follow\u2011up"
        },
        "clinical_integration": "Complements HIV service continuity and community health work; distinct from clinical priority gaps listed earlier.",
        "interventions": {
          "immediate_coverage_expansion": [
            "Expand GeneXpert/rapid diagnostic networks with sample referral systems; decentralize DR\u2011TB treatment support including community DSD models",
            "Provide adherence support (digital adherence technologies, CHV follow\u2011up)"
          ],
          "service_integration_opportunities": [
            "Integrate TB screening with HIV, maternal and NCD clinics and CHV outreach"
          ],
          "infrastructure_requirements": [
            "Specimen transport networks, cold chain for some medications, decentralised storage and dispensing points"
          ]
        },
        "implementation": {
          "county_integration": "Counties integrate TB services in PHC packages, allocate staff for sample transport and community follow\u2011up",
          "funding_mechanisms": "PHC Fund for community adherence models; SHIF for reimbursing facility TB management episodes; donor transition support for diagnostics",
          "timeline_realistic": "6\u201324 months (diagnostics expansion faster; DR\u2011TB decentralization over 12\u201324 months)"
        },
        "detection_method": "ai_coverage_analysis",
        "analysis_type": "comprehensive_coverage",
        "pdf_page_sources": [
          "Pages 1-18 (Policy Structure)"
        ],
        "validation_ready": true
      },
      {
        "gap_id": "COVERAGE_SERVICE_CATEGORY_07",
        "gap_category": "service_category",
        "gap_type": "NCD primary care management (hypertension, diabetes, asthma)",
        "coverage_priority": "HIGH",
        "description": "Weak chronic care models at primary care level \u2014 poor screening, treatment initiation, follow\u2011up, monitoring and medication continuity for NCDs \u2014 leading to high uncontrolled disease and avoidable complications.",
        "kenya_context": {
          "service_delivery_platform": "Level 2\u20134 (primary care and county hospitals)",
          "population_impact": "Adults (working age and older adults), urban poor with rising NCD burden",
          "geographic_scope": "Nationwide; urban and peri\u2011urban counties show high prevalence but rural management systems weaker",
          "current_coverage_level": "Effective coverage for hypertension/diabetes (diagnosed and controlled) estimated ~30\u201340%"
        },
        "who_essential_services": "Curative and preventive services (chronic disease management and screening)",
        "coverage_analysis": {
          "service_availability": "Limited",
          "geographic_accessibility": "Moderate in urban areas, poor in rural counties",
          "financial_accessibility": "Limited \u2014 OOP for medicines common when public stocks fail",
          "quality_adequacy": "Suboptimal (no standardised chronic care follow\u2011up or registries at PHC level)"
        },
        "clinical_integration": "Differs from specialist-level NCD interventions (e.g., cardiac rehab) by focusing on longitudinal primary care systems to prevent progression to specialist needs.",
        "interventions": {
          "immediate_coverage_expansion": [
            "Introduce standardized NCD chronic care pathways at Level 2\u20133 with registries, appointment systems, and simplified treatment algorithms",
            "Ensure consistent supply of core NCD medicines (antihypertensives, metformin, insulin where indicated)"
          ],
          "service_integration_opportunities": [
            "Combine NCD screening with maternal/child clinics and HIV platforms for integrated multi\u2011morbid care",
            "Use CHVs for adherence support and home follow\u2011up"
          ],
          "infrastructure_requirements": [
            "Patient registers/EMR modules for NCDs, point\u2011of\u2011care HbA1c/glucose monitoring, training modules for clinical staff"
          ]
        },
        "implementation": {
          "county_integration": "Counties adopt NCD targets and integrate chronic care into PHC incentives and outreach schedules",
          "funding_mechanisms": "PHC Fund to underwrite primary NCD medicines and clinics; SHIF to define and reimburse chronic care consultations and meds",
          "timeline_realistic": "12\u201336 months for establishing registries, medication supply chains and staff capacity"
        },
        "detection_method": "ai_coverage_analysis",
        "analysis_type": "comprehensive_coverage",
        "pdf_page_sources": [
          "Pages 1-18 (Policy Structure)",
          "Pages 19-54 (Annex Procedures)"
        ],
        "validation_ready": true
      },
      {
        "gap_id": "COVERAGE_SERVICE_CATEGORY_08",
        "gap_category": "service_category",
        "gap_type": "Rehabilitation services beyond cardiac (stroke, musculoskeletal, prosthetics)",
        "coverage_priority": "MEDIUM",
        "description": "Rehabilitation services (physiotherapy, occupational therapy, prosthetics/orthotics, community\u2011based rehab) are scarce at Level 3\u20134, limiting recovery after stroke, injuries and surgery.",
        "kenya_context": {
          "service_delivery_platform": "Level 3\u20135 (some services at referral centres), community-based rehabilitation at Level 1 limited",
          "population_impact": "Stroke survivors, trauma victims, people with disabilities, post\u2011surgical patients",
          "geographic_scope": "Concentrated in urban referral hospitals; rural counties lack accessible services",
          "current_coverage_level": "Estimated access to structured rehabilitation services ~25%"
        },
        "who_essential_services": "Rehabilitative services",
        "coverage_analysis": {
          "service_availability": "Limited",
          "geographic_accessibility": "Poor outside major urban centres",
          "financial_accessibility": "Often expensive with OOP for private rehab",
          "quality_adequacy": "Variable \u2014 few trained therapists and no standardized PHC rehab protocols"
        },
        "clinical_integration": "Complements but is distinct from cardiac rehabilitation gap by addressing a broader range of rehabilitation needs across conditions.",
        "interventions": {
          "immediate_coverage_expansion": [
            "Train and deploy mid\u2011level rehabilitation workers to county hospitals; develop basic physiotherapy services at Level 3",
            "Establish community\u2011based rehabilitation linkages using CHVs"
          ],
          "service_integration_opportunities": [
            "Integrate rehab referrals from surgical, trauma, and NCD clinics; include prosthetics in surgical care pathways"
          ],
          "infrastructure_requirements": [
            "Rehab workspaces, basic therapy equipment, assistive device procurement and maintenance"
          ]
        },
        "implementation": {
          "county_integration": "Counties include rehabilitation in essential PHC package and workforce plans; partner with NGOs for prosthetics programs",
          "funding_mechanisms": "PHC Fund for basic rehab services; SHIF to include rehab encounter tariffs for higher\u2011level services",
          "timeline_realistic": "12\u201336 months (training and basic services within 12 months; prosthetics scale up 24\u201336 months)"
        },
        "detection_method": "ai_coverage_analysis",
        "analysis_type": "comprehensive_coverage",
        "pdf_page_sources": [
          "Pages 1-18 (Policy Structure)"
        ],
        "validation_ready": true
      },
      {
        "gap_id": "COVERAGE_SERVICE_CATEGORY_09",
        "gap_category": "service_category",
        "gap_type": "Palliative and end\u2011of\u2011life care integration",
        "coverage_priority": "MEDIUM",
        "description": "Palliative care services (pain management, psychosocial support, home\u2011based palliative care) are limited and not integrated into PHC or SHIF benefit packages, leaving terminal patients without standardized supportive care.",
        "kenya_context": {
          "service_delivery_platform": "Level 2\u20136 (home\u2011based care via CHVs limited), hospices concentrated in urban areas",
          "population_impact": "Patients with advanced cancer, progressive NCDs, HIV with advanced disease, elderly",
          "geographic_scope": "Concentrated in urban centres; rural counties lack services",
          "current_coverage_level": "Palliative care coverage estimated ~20% nationally"
        },
        "who_essential_services": "Palliative services",
        "coverage_analysis": {
          "service_availability": "Absent to limited",
          "geographic_accessibility": "Poor outside urban centres",
          "financial_accessibility": "Often OOP or NGO\u2011dependent",
          "quality_adequacy": "Suboptimal (limited training, analgesic access challenges)"
        },
        "clinical_integration": "Differs from clinical cure\u2011focused gaps (e.g., cancer treatment) by addressing symptom relief and quality of life needs; should be linked to those services.",
        "interventions": {
          "immediate_coverage_expansion": [
            "Incorporate basic palliative care training into PHC worker curricula and CHV outreach; ensure morphine/analgesic availability at Level 4",
            "Develop home\u2011based palliative care protocols and referral linkages"
          ],
          "service_integration_opportunities": [
            "Link palliative care to NCD, HIV and oncology services for continuum of care"
          ],
          "infrastructure_requirements": [
            "Medication procurement (opioid balance and regulation), psychosocial support teams, tele\u2011palliative consultation systems"
          ]
        },
        "implementation": {
          "county_integration": "Counties adopt palliative care guidelines, integrate into PHC capacity building and home care services",
          "funding_mechanisms": "PHC Fund for community\u2011based palliative care; SHIF to reimburse facility palliative consultations and medications",
          "timeline_realistic": "6\u201324 months (training and medication access quickly; service scale\u2011up over 12\u201324 months)"
        },
        "detection_method": "ai_coverage_analysis",
        "analysis_type": "comprehensive_coverage",
        "pdf_page_sources": [
          "Pages 1-18 (Policy Structure)",
          "Pages 19-54 (Annex Procedures)"
        ],
        "validation_ready": true
      },
      {
        "gap_id": "COVERAGE_POPULATION_GROUP_02",
        "gap_category": "population_group",
        "gap_type": "Geriatric services and long\u2011term care",
        "coverage_priority": "MEDIUM",
        "description": "Lack of age\u2011appropriate services, geriatric assessment, dementia care and long\u2011term care options in PHC and county hospital settings as the older population increases.",
        "kenya_context": {
          "service_delivery_platform": "Level 2\u20134 (primary care and county hospitals), limited community long\u2011term care",
          "population_impact": "Elderly population, people with chronic multimorbidity, dementia patients",
          "geographic_scope": "Nationwide, but access worse in rural counties with high out\u2011migration of working age adults",
          "current_coverage_level": "Estimated geriatric service availability ~15%"
        },
        "who_essential_services": "Preventive and curative services across the life course (geriatric care)",
        "coverage_analysis": {
          "service_availability": "Absent to limited",
          "geographic_accessibility": "Poor especially in rural settings",
          "financial_accessibility": "High OOP for long\u2011term care options",
          "quality_adequacy": "Suboptimal (few trained staff and no guidelines at PHC)"
        },
        "clinical_integration": "Complementary to NCD chronic care gap; focuses on age\u2011tailored assessments, polypharmacy and long\u2011term support rather than disease\u2011specific clinical interventions.",
        "interventions": {
          "immediate_coverage_expansion": [
            "Introduce basic geriatric screening in PHC clinics, training on polypharmacy and dementia recognition",
            "Pilot community\u2011based long\u2011term care and caregiver support models using CHVs"
          ],
          "service_integration_opportunities": [
            "Integrate geriatric assessments into NCD clinics and home care programs"
          ],
          "infrastructure_requirements": [
            "Training materials, home care kits, referral links to social services"
          ]
        },
        "implementation": {
          "county_integration": "Counties include geriatric care elements in PHC packages and social support programmes",
          "funding_mechanisms": "PHC Fund for community and primary geriatric services; SHIF reimbursement of geriatric clinic visits where defined",
          "timeline_realistic": "12\u201336 months (pilots 12 months; scale 24\u201336 months)"
        },
        "detection_method": "ai_coverage_analysis",
        "analysis_type": "comprehensive_coverage",
        "pdf_page_sources": [
          "Pages 1-18 (Policy Structure)"
        ],
        "validation_ready": true
      },
      {
        "gap_id": "COVERAGE_POPULATION_GROUP_03",
        "gap_category": "population_group",
        "gap_type": "Adolescent\u2011friendly health services (sexual/reproductive health, substance use, mental health linkage)",
        "coverage_priority": "HIGH",
        "description": "Limited availability of confidential, accessible and age\u2011appropriate services for adolescents including contraception, STI services, mental health screening and substance use counselling.",
        "kenya_context": {
          "service_delivery_platform": "Level 2\u20134 (PHC clinics, youth centres), community outreach",
          "population_impact": "Adolescents (10\u201319 years), particularly girls in rural and informal urban settings",
          "geographic_scope": "Nationwide; hotspots in counties with early pregnancy and school dropout rates",
          "current_coverage_level": "Adolescent\u2011friendly service coverage estimated ~30%"
        },
        "who_essential_services": "Preventive and curative services for adolescents (SRH and mental health linkage)",
        "coverage_analysis": {
          "service_availability": "Limited",
          "geographic_accessibility": "Moderate in urban centres, poor in rural areas",
          "financial_accessibility": "Often free but confidentiality and acceptability barriers reduce effective access",
          "quality_adequacy": "Suboptimal (staff not trained in adolescent\u2011friendly approaches)"
        },
        "clinical_integration": "Overlaps with mental health integration priorities but emphasises adolescent\u2011specific service models and SRH rather than adult mental health systems.",
        "interventions": {
          "immediate_coverage_expansion": [
            "Establish adolescent\u2011friendly corners in PHC facilities with trained staff and youth outreach services",
            "Scale school\u2011based SRH and mental health promotion with referral linkages"
          ],
          "service_integration_opportunities": [
            "Use CHVs and community outreach to link adolescents to services; integrate SRH with HPV vaccination and NCD screening as age\u2011appropriate"
          ],
          "infrastructure_requirements": [
            "Private consultation spaces, youth outreach kits, youth\u2011friendly IEC materials"
          ]
        },
        "implementation": {
          "county_integration": "Counties incorporate youth health targets into PHC service packages and partner with education and youth departments",
          "funding_mechanisms": "PHC Fund for adolescent service operational costs; SHIF to include adolescent consultations in benefit package",
          "timeline_realistic": "6\u201318 months for setting up youth corners and training"
        },
        "detection_method": "ai_coverage_analysis",
        "analysis_type": "comprehensive_coverage",
        "pdf_page_sources": [
          "Pages 1-18 (Policy Structure)"
        ],
        "validation_ready": true
      },
      {
        "gap_id": "COVERAGE_SERVICE_CATEGORY_10",
        "gap_category": "service_category",
        "gap_type": "Child health preventive services and IMCI fidelity (excluding pneumonia oxygen)",
        "coverage_priority": "HIGH",
        "description": "While vaccination coverage is relatively high in many counties, other child preventive services \u2014 growth monitoring, Integrated Management of Childhood Illness (IMCI) implementation, nutrition screening and community follow\u2011up \u2014 are inconsistently delivered.",
        "kenya_context": {
          "service_delivery_platform": "Level 1\u20133 (community, dispensary, health centre)",
          "population_impact": "Children under 5 years, caregivers in rural and informal urban settings",
          "geographic_scope": "Nationwide gaps, worse in remote counties with pastoralist populations",
          "current_coverage_level": "Composite coverage for growth monitoring/IMCI fidelity estimated ~60%"
        },
        "who_essential_services": "Preventive and curative child health services",
        "coverage_analysis": {
          "service_availability": "Limited to moderate",
          "geographic_accessibility": "Variable \u2014 outreach services inconsistent",
          "financial_accessibility": "Mostly affordable but poor service availability drives access issues",
          "quality_adequacy": "Suboptimal (IMCI training and supervision gaps)"
        },
        "clinical_integration": "Avoids duplication with pneumonia/oxygen clinical gap by focusing on broader child preventive and follow\u2011up systems rather than oxygen therapy.",
        "interventions": {
          "immediate_coverage_expansion": [
            "Reinstate regular growth monitoring outreach and strengthen IMCI training + mentorship at Level 2\u20133",
            "Link community malnutrition screening to rapid referral and ready\u2011to\u2011use therapeutic food supply chains"
          ],
          "service_integration_opportunities": [
            "Combine child health outreaches with immunisation days and maternal health visits"
          ],
          "infrastructure_requirements": [
            "Growth monitoring equipment, nutrition supply chains, CHV referral tools"
          ]
        },
        "implementation": {
          "county_integration": "Counties schedule routine outreaches and include child health performance in PHC reporting",
          "funding_mechanisms": "PHC Fund for outreach and commodities; SHIF to reimburse facility child health visits under defined package",
          "timeline_realistic": "6\u201318 months"
        },
        "detection_method": "ai_coverage_analysis",
        "analysis_type": "comprehensive_coverage",
        "pdf_page_sources": [
          "Pages 1-18 (Policy Structure)",
          "Pages 19-54 (Annex Procedures)"
        ],
        "validation_ready": true
      },
      {
        "gap_id": "COVERAGE_SERVICE_CATEGORY_11",
        "gap_category": "service_category",
        "gap_type": "Diagnostic imaging equity for routine imaging (X\u2011ray, ultrasound) at lower levels",
        "coverage_priority": "MEDIUM",
        "description": "Policy indicates imaging is concentrated at Level 4\u20136; however, lack of routine x\u2011ray and ultrasound at Level 3/4 limits timely diagnosis of common conditions (fractures, obstetric scans, abdominal emergencies).",
        "kenya_context": {
          "service_delivery_platform": "Level 3\u20134 (health centres and county hospitals) primarily affected",
          "population_impact": "Patients requiring basic imaging \u2014 trauma patients, pregnant women needing ultrasound, patients with chest symptoms requiring x\u2011ray",
          "geographic_scope": "Most counties have limited lower\u2011level imaging; urban referral centres better equipped",
          "current_coverage_level": "Basic imaging availability at Level 3\u20134 estimated ~40%"
        },
        "who_essential_services": "Curative services (diagnostic imaging for essential care)",
        "coverage_analysis": {
          "service_availability": "Limited at lower levels",
          "geographic_accessibility": "Poor outside Level 4+ equipped facilities",
          "financial_accessibility": "Out\u2011of\u2011pocket or travel costs often required",
          "quality_adequacy": "Variable \u2014 maintenance and radiographer availability issues"
        },
        "clinical_integration": "Relates to policy imaging concentration but differs from cancer imaging gaps by focusing on routine imaging needed for common acute care and obstetric services.",
        "interventions": {
          "immediate_coverage_expansion": [
            "Provide portable ultrasound units and basic digital x\u2011ray systems to priority Level 4 hospitals and selected Level 3 hubs",
            "Train mid\u2011level staff in focused ultrasound use (e.g., FOCUS, obstetric) and tele\u2011radiology linkages"
          ],
          "service_integration_opportunities": [
            "Combine imaging with emergency, maternal and trauma services; tele\u2011interpretation links to Level 5/6 radiologists"
          ],
          "infrastructure_requirements": [
            "Stable power, image PACS or cloud storage solutions, maintenance contracts"
          ]
        },
        "implementation": {
          "county_integration": "Counties identify Level 3/4 hubs for imaging upgrade and link with referral hospitals for reporting",
          "funding_mechanisms": "PHC Fund for portable ultrasound; SHIF to cover imaging tariffs at accredited facilities; targeted capital grants for x\u2011ray",
          "timeline_realistic": "6\u201324 months"
        },
        "detection_method": "ai_coverage_analysis",
        "analysis_type": "comprehensive_coverage",
        "pdf_page_sources": [
          "Pages 1-18 (Policy Structure)"
        ],
        "validation_ready": true
      },
      {
        "gap_id": "COVERAGE_SERVICE_CATEGORY_12",
        "gap_category": "service_category",
        "gap_type": "Health information systems and referral data use",
        "coverage_priority": "MEDIUM",
        "description": "Although DHIS2 is deployed, gaps exist in real\u2011time referral tracking, data quality, interoperability with eLMIS and SHIF claims systems, limiting performance monitoring and resource targeting.",
        "kenya_context": {
          "service_delivery_platform": "All levels (data flow across Level 1\u20136)",
          "population_impact": "Entire population \u2014 affects planning and resource allocation",
          "geographic_scope": "National; poorer data quality in remote counties and small facilities",
          "current_coverage_level": "Reporting coverage ~80% but data quality and interoperability usable for decision\u2011making ~60%"
        },
        "who_essential_services": "Cross\u2011cutting systems capacity affecting all WHO essential services",
        "coverage_analysis": {
          "service_availability": "Available but not fully fit for purpose",
          "geographic_accessibility": "Accessible but variable data quality",
          "financial_accessibility": "N/A (system gap)",
          "quality_adequacy": "Suboptimal (incomplete, late or inconsistent reporting; poor referral tracking)"
        },
        "clinical_integration": "Enables measurement of clinical gaps (e.g., surgical, cancer delays) but is a system gap addressing monitoring rather than direct clinical service delivery.",
        "interventions": {
          "immediate_coverage_expansion": [
            "Integrate referral module into DHIS2 with unique identifiers and digital referral tracking from Level 2\u20136",
            "Improve data quality through targeted training, audits and feedback loops"
          ],
          "service_integration_opportunities": [
            "Link DHIS2 with eLMIS and SHIF claims to monitor service availability, stockouts and utilization"
          ],
          "infrastructure_requirements": [
            "Connectivity, facility computers/tablets, interoperability middleware and user support"
          ]
        },
        "implementation": {
          "county_integration": "Counties institutionalise data quality improvement cycles and use data for resource allocation",
          "funding_mechanisms": "PHC Fund for facility ICT needs; SHIF administrative budgets for interoperability; partners for technical assistance",
          "timeline_realistic": "6\u201318 months for module integration and training"
        },
        "detection_method": "ai_coverage_analysis",
        "analysis_type": "comprehensive_coverage",
        "pdf_page_sources": [
          "Pages 1-18 (Policy Structure)"
        ],
        "validation_ready": true
      },
      {
        "gap_id": "COVERAGE_GEOGRAPHIC_ACCESS_01",
        "gap_category": "geographic_access",
        "gap_type": "Rural and remote county service deserts (northern/ASAL counties)",
        "coverage_priority": "HIGH",
        "description": "Geographic inequities leave large areas with minimal facility density and long travel times to any functional health facility, worsening preventable morbidity and mortality.",
        "kenya_context": {
          "service_delivery_platform": "All levels but limited physical facilities in ASAL and border regions",
          "population_impact": "Pastoralist populations, internally displaced and nomadic groups in Garissa, Wajir, Mandera, Turkana",
          "geographic_scope": "Northern and ASAL counties, border regions",
          "current_coverage_level": "Access to a basic health facility within 2 hours in worst\u2011served counties estimated <50%"
        },
        "who_essential_services": "Equitable access to WHO essential services (preventive, curative, emergency)",
        "coverage_analysis": {
          "service_availability": "Poor (few facilities and sparse outreach)",
          "geographic_accessibility": "Poor (long distances, seasonal barriers)",
          "financial_accessibility": "Limited (transport and opportunity costs high)",
          "quality_adequacy": "Suboptimal due to staff shortages and irregular supplies"
        },
        "clinical_integration": "Geographic gap exacerbates clinical priority gaps (e.g., delayed cancer diagnosis, EmONC) but focuses on spatial accessibility solutions rather than condition\u2011specific clinical care.",
        "interventions": {
          "immediate_coverage_expansion": [
            "Deploy mobile clinics and scheduled outreach (maternal, immunization, NCD screening) with CHV identification",
            "Use telemedicine hubs at county hospitals linked to remote outreach points"
          ],
          "service_integration_opportunities": [
            "Coordinate outreach across programs (immunization, TB, NCDs, SRH) to maximise visits",
            "Cross\u2011sector linkages with transport and security agencies for access"
          ],
          "infrastructure_requirements": [
            "Mobile clinic vehicles, solar power systems, portable diagnostics, network connectivity"
          ]
        },
        "implementation": {
          "county_integration": "County health departments plan outreach schedules aligned with community calendars and partner with NGOs for mobile services",
          "funding_mechanisms": "PHC Fund for recurrent outreach costs; SHIF to reimburse accredited mobile clinic service packages; donor bridge financing for initial scale",
          "timeline_realistic": "6\u201324 months (mobile services and telemedicine pilots within 6\u201312 months; scale\u2011up 18\u201324 months)"
        },
        "detection_method": "ai_coverage_analysis",
        "analysis_type": "comprehensive_coverage",
        "pdf_page_sources": [
          "Pages 1-18 (Policy Structure)"
        ],
        "validation_ready": true
      },
      {
        "gap_id": "COVERAGE_GEOGRAPHIC_ACCESS_02",
        "gap_category": "geographic_access",
        "gap_type": "Urban primary care overcrowding and referral bypassing",
        "coverage_priority": "MEDIUM",
        "description": "High patient volumes and perceived low quality at primary care in urban informal settlements lead to bypassing to higher\u2011level hospitals, creating congestion, longer wait times and inefficiencies.",
        "kenya_context": {
          "service_delivery_platform": "Level 2\u20134 in urban areas; tertiary hospitals receive excess primary care cases",
          "population_impact": "Residents of informal settlements in Nairobi, Mombasa, Kisumu, Eldoret",
          "geographic_scope": "Urban counties with large informal settlements",
          "current_coverage_level": "Effective primary care usage in urban poor groups estimated ~40% with high bypass rates"
        },
        "who_essential_services": "Accessible, quality primary care services",
        "coverage_analysis": {
          "service_availability": "Available but perceived as poor",
          "geographic_accessibility": "Physically accessible but functionally poor",
          "financial_accessibility": "Mixed; cost not the sole barrier",
          "quality_adequacy": "Suboptimal leading to loss of trust and bypassing"
        },
        "clinical_integration": "Impacts service utilization patterns that affect specialized services but is a systems and trust issue rather than a clinical content gap.",
        "interventions": {
          "immediate_coverage_expansion": [
            "Strengthen staffing, extend hours and provide essential diagnostics at urban PHC facilities",
            "Public information campaigns and community engagement to rebuild trust in PHC"
          ],
          "service_integration_opportunities": [
            "Link PHC to referral hospitals through appointment and triage systems to reduce unnecessary referrals"
          ],
          "infrastructure_requirements": [
            "Clinic expansion where feasible, patient flow improvements, digital appointment systems"
          ]
        },
        "implementation": {
          "county_integration": "Urban counties prioritize PHC strengthening in high\u2011burden facilities and include utilization metrics in performance contracts",
          "funding_mechanisms": "PHC Fund for staffing and extended hours; SHIF to incentivize care at accredited primary facilities through differential tariffs",
          "timeline_realistic": "6\u201318 months"
        },
        "detection_method": "ai_coverage_analysis",
        "analysis_type": "comprehensive_coverage",
        "pdf_page_sources": [
          "Pages 1-18 (Policy Structure)"
        ],
        "validation_ready": true
      },
      {
        "gap_id": "COVERAGE_GEOGRAPHIC_ACCESS_03",
        "gap_category": "geographic_access",
        "gap_type": "Cross\u2011border and refugee population health service access",
        "coverage_priority": "MEDIUM",
        "description": "Border counties and refugee camps face strained health services with gaps in continuity, financing and integration with county health systems, causing gaps in maternal, child and communicable disease services.",
        "kenya_context": {
          "service_delivery_platform": "County facilities in border counties, health posts in camps, NGO and UNHCR partners",
          "population_impact": "Refugee populations (Dadaab, Kakuma), cross\u2011border mobile populations",
          "geographic_scope": "Border counties (Turkana, Garissa, Kwale, Mandera) and refugee settlements",
          "current_coverage_level": "Service coverage variable; integrated county access limited \u2014 effective coverage for routine services in these populations ~50%"
        },
        "who_essential_services": "Essential preventive and curative services for vulnerable populations",
        "coverage_analysis": {
          "service_availability": "Variable (NGO support often fills gaps)",
          "geographic_accessibility": "Restricted due to administrative and logistic challenges",
          "financial_accessibility": "Often subsidized by humanitarian partners, but coordination with SHIF limited",
          "quality_adequacy": "Mixed depending on partner presence"
        },
        "clinical_integration": "This gap interacts with maternal and child service gaps and TB/HIV continuity but is focused on population groups with special access needs.",
        "interventions": {
          "immediate_coverage_expansion": [
            "Formalize agreements between counties and humanitarian partners to integrate services and data sharing",
            "Extend PHC outreach and referral pathways to refugee health posts"
          ],
          "service_integration_opportunities": [
            "Leverage CHV networks and NGO resources to provide continuity of care for chronic conditions and vaccinations"
          ],
          "infrastructure_requirements": [
            "Supply chain linkages, interoperable HIS for refugee health data, cold chain in camps"
          ]
        },
        "implementation": {
          "county_integration": "Counties coordinate with national government and UNHCR to co\u2011plan and finance integrated service delivery",
          "funding_mechanisms": "PHC Fund to support outreach to mixed populations; SHIF policy clarity for reimbursement of services in camps; donor support for transition",
          "timeline_realistic": "6\u201324 months depending on coordination complexity"
        },
        "detection_method": "ai_coverage_analysis",
        "analysis_type": "comprehensive_coverage",
        "pdf_page_sources": [
          "Pages 1-18 (Policy Structure)"
        ],
        "validation_ready": true
      },
      {
        "gap_id": "COVERAGE_SERVICE_CATEGORY_13",
        "gap_category": "service_category",
        "gap_type": "Workforce distribution and retention in remote/arid counties",
        "coverage_priority": "HIGH",
        "description": "Chronic shortages and high turnover of skilled health workers (nurses, midwives, clinical officers, certain specialists) in remote and arid counties undermine service continuity and quality.",
        "kenya_context": {
          "service_delivery_platform": "All care levels in underserved counties (Level 2\u20134 primarily affected)",
          "population_impact": "Residents of northern and ASAL counties; services like maternal health, chronic care and emergency care impacted",
          "geographic_scope": "ASAL counties, sparsely populated regions, and some islands (Lamu)",
          "current_coverage_level": "Estimated staffing adequacy in worst counties ~40% of required complement"
        },
        "who_essential_services": "Cross\u2011cutting HRH for WHO essential services",
        "coverage_analysis": {
          "service_availability": "Limited due to staff shortages",
          "geographic_accessibility": "Poor in remote postings",
          "financial_accessibility": "N/A (workforce issue)",
          "quality_adequacy": "Suboptimal due to lack of experienced clinicians and continuous training"
        },
        "clinical_integration": "Workforce shortages underpin many clinical gaps (e.g., surgical, obstetric), but this entry targets retention policies and distribution rather than single\u2011disease clinical interventions.",
        "interventions": {
          "immediate_coverage_expansion": [
            "Implement financial and non\u2011financial incentive packages (housing, hardship allowances, career progression) for remote postings",
            "Scale telemedicine and specialist outreach to supplement local capacity"
          ],
          "service_integration_opportunities": [
            "Use staff rotation and hub\u2011and\u2011spoke mentoring between referral and county hospitals",
            "Integrate training with continuous professional development credits"
          ],
          "infrastructure_requirements": [
            "Staff housing, reliable utilities, internet connectivity for telemedicine"
          ]
        },
        "implementation": {
          "county_integration": "Counties adopt retention packages and link to national bonding/placement policies; partner with training institutions for rural placements",
          "funding_mechanisms": "County HR budgets augmented by conditional grants; SHIF to reimburse for accredited services that require rural posting incentives",
          "timeline_realistic": "12\u201336 months (policy adoption and incentive disbursement 12 months; retention effects observable 24\u201336 months)"
        },
        "detection_method": "ai_coverage_analysis",
        "analysis_type": "comprehensive_coverage",
        "pdf_page_sources": [
          "Pages 19-54 (Annex Procedures)"
        ],
        "validation_ready": true
      },
      {
        "gap_id": "COVERAGE_SERVICE_CATEGORY_14",
        "gap_category": "service_category",
        "gap_type": "Cold chain and vaccine delivery resilience in arid and remote regions",
        "coverage_priority": "MEDIUM",
        "description": "Cold chain failures and limited outreach scheduling in hot/arid regions compromise vaccine potency and reduce immunization coverage especially during seasonal mobility of pastoralist populations.",
        "kenya_context": {
          "service_delivery_platform": "Level 1\u20133 outreach and facility immunization points",
          "population_impact": "Children and pregnant women in ASAL and remote counties",
          "geographic_scope": "ASAL counties and hard\u2011to\u2011reach sub\u2011counties",
          "current_coverage_level": "Routine immunization functional coverage variable; effective cold chain reliability in these areas ~50\u201360%"
        },
        "who_essential_services": "Preventive services (immunization supply chain resilience)",
        "coverage_analysis": {
          "service_availability": "Available but compromised by cold chain lapses",
          "geographic_accessibility": "Limited during seasonal movements",
          "financial_accessibility": "Mostly free but indirect costs hinder uptake",
          "quality_adequacy": "At risk due to cold chain instability"
        },
        "clinical_integration": "Supports pneumonia prevention and other immunization\u2011preventable disease control but is a supply/logistics gap rather than a clinical treatment gap.",
        "interventions": {
          "immediate_coverage_expansion": [
            "Deploy solar direct\u2011drive refrigerators and vaccine carriers suitable for ASAL conditions; schedule flexible outreach aligned with pastoral movement",
            "Strengthen vaccine stock visibility and cold chain monitoring (remote temperature loggers)"
          ],
          "service_integration_opportunities": [
            "Integrate with mobile clinics providing integrated mother\u2011child services and NCD screening where feasible",
            "Coordinate vaccination with food security and livestock outreach programs"
          ],
          "infrastructure_requirements": [
            "Solar cold chain equipment, reliable transport, data loggers and training for cold chain management"
          ]
        },
        "implementation": {
          "county_integration": "Counties prioritize cold chain upgrades in their immunization plans and coordinate outreach with community leaders",
          "funding_mechanisms": "PHC Fund for recurrent outreach costs and cold chain maintenance; partners/donors for initial capital investments; SHIF to cover facility\u2011based immunizations within benefit package",
          "timeline_realistic": "6\u201318 months for equipment deployment and outreach rescheduling"
        },
        "detection_method": "ai_coverage_analysis",
        "analysis_type": "comprehensive_coverage",
        "pdf_page_sources": [
          "Pages 1-18 (Policy Structure)"
        ],
        "validation_ready": true
      },
      {
        "gap_id": "COVERAGE_GEOGRAPHIC_ACCESS_04",
        "gap_category": "geographic_access",
        "gap_type": "Facility distribution and catchment mismatches",
        "coverage_priority": "MEDIUM",
        "description": "Facility locations, catchment sizes and service mixes are not systematically aligned with population density and travel patterns leading to underserved pockets even within counties with adequate aggregate facility counts.",
        "kenya_context": {
          "service_delivery_platform": "All facility levels, planning and GIS mapping needed",
          "population_impact": "Communities living at the margins of facility catchments \u2014 often peri\u2011urban and remote rural hamlets",
          "geographic_scope": "Scattered nationally; pronounced in rapidly urbanising peri\u2011urban zones and remote wards",
          "current_coverage_level": "Effective geographic coverage (population within 2 km/30 min) variable; in many wards <70%"
        },
        "who_essential_services": "Access to essential services through appropriate facility placement",
        "coverage_analysis": {
          "service_availability": "Facilities exist but location misalignment reduces functional accessibility",
          "geographic_accessibility": "Variable with localized poor coverage",
          "financial_accessibility": "Indirect costs increase when travel distances rise",
          "quality_adequacy": "Facility quality may be adequate but underutilised due to access barriers"
        },
        "clinical_integration": "Affects reach of all clinical services including maternal care and chronic disease management but is a spatial planning and equity gap rather than a clinical capability issue.",
        "interventions": {
          "immediate_coverage_expansion": [
            "Conduct facility catchment and travel time GIS mapping at county level to identify service deserts",
            "Re\u2011allocate outreach and mobile services to identified gaps and consider facility relocation/upgrades where necessary"
          ],
          "service_integration_opportunities": [
            "Establish satellite clinics or periodic services in underserved wards combining multiple programmatic needs"
          ],
          "infrastructure_requirements": [
            "Geospatial analysis capacity, transport for outreach, temporary clinic infrastructure"
          ]
        },
        "implementation": {
          "county_integration": "Counties use mapping to inform annual investment and outreach plans; revise facility placement policies",
          "funding_mechanisms": "County capital budgets for targeted facility upgrades; PHC Fund for outreach; SHIF to recognise accredited satellite service points",
          "timeline_realistic": "6\u201324 months for mapping and initial re\u2011allocation; infrastructure changes 12\u201336 months"
        },
        "detection_method": "ai_coverage_analysis",
        "analysis_type": "comprehensive_coverage",
        "pdf_page_sources": [
          "Pages 1-18 (Policy Structure)"
        ],
        "validation_ready": true
      },
      {
        "gap_id": "COVERAGE_SERVICE_CATEGORY_15",
        "gap_category": "service_category",
        "gap_type": "PHC funding and benefit package skew towards higher\u2011level services",
        "coverage_priority": "HIGH",
        "description": "Policy inputs indicate a concentration of SHIF entries and access points at Level 4\u20136, with limited PHC Fund allocations and primary-care service coverage in the SHIF benefit design \u2014 risking underinvestment in first\u2011contact care essential for UHC.",
        "kenya_context": {
          "service_delivery_platform": "System\u2011wide financing misalignment affecting Level 1\u20133 primarily",
          "population_impact": "All populations, disproportionately affecting those who need primary care the most (rural poor, informal urban)",
          "geographic_scope": "National policy and benefit design issue with local execution effects",
          "current_coverage_level": "Proportion of SHIF/benefit emphasis at Level 2\u20133 currently low; PHC Fund allocations cover limited entitlements \u2014 estimated primary care package coverage ~35%"
        },
        "who_essential_services": "Health financing and service coverage for preventive and basic curative services",
        "coverage_analysis": {
          "service_availability": "Primary care services available but not adequately funded",
          "geographic_accessibility": "Physically accessible but limited by service scope and supplies",
          "financial_accessibility": "Coverage gaps lead to higher OOP and bypassing",
          "quality_adequacy": "Constrained by limited recurrent funding and human resources"
        },
        "clinical_integration": "Touches all clinical gaps by influencing where resources are allocated; distinct from clinical priorities since it is about benefit design and financing skew.",
        "interventions": {
          "immediate_coverage_expansion": [
            "Rebalance SHIF benefit package to explicitly define and fund a basic PHC package with clear entitlements at Level 2\u20133",
            "Increase PHC Fund allocation to cover core recurrent PHC costs (staff, medicines, diagnostics)"
          ],
          "service_integration_opportunities": [
            "Use SHIF accreditation and reimbursement incentives to encourage cases to be managed at PHC where appropriate",
            "Align PHC Fund performance indicators with SHIF contracting"
          ],
          "infrastructure_requirements": [
            "Updated benefits management systems, provider payment reforms and claims processing that recognise PHC services"
          ]
        },
        "implementation": {
          "county_integration": "Counties revise benefit delivery plans to prioritise PHC, ring\u2011fence PHC Fund disbursements for primary services",
          "funding_mechanisms": "PHC Fund to finance recurrent PHC entitlements; SHIF to develop PHC reimbursement tariffs and capitation models; transitional donor support for reform",
          "timeline_realistic": "6\u201324 months for benefit redesign and pilots; scale up over 12\u201336 months"
        },
        "detection_method": "ai_coverage_analysis",
        "analysis_type": "comprehensive_coverage",
        "pdf_page_sources": [
          "Pages 1-18 (Policy Structure)"
        ],
        "validation_ready": true
      }
    ],
    "coverage_analysis": "[\n  {\n    \"gap_id\": \"COVERAGE_SERVICE_CATEGORY_01\",\n    \"gap_category\": \"service_category\",\n    \"gap_type\": \"Community health workforce functionality\",\n    \"coverage_priority\": \"HIGH\",\n    \"description\": \"Large variability in functionality, supervision, remuneration and commodity support for Community Health Volunteers (CHVs) leading to inconsistent outreach, health promotion, early case detection and referral from Level 1. Gaps include weak supervision, irregular stipends, and lack of standardized CHV service packages under SHIF/PHC fund.\",\n    \"kenya_health_system_context\": {\n      \"service_delivery_platform\": \"Level 1 (community units) with interfaces to Level 2-3\",\n      \"population_impact\": \"Rural households, low\u2011income urban informal settlements, pregnant women, children under 5\",\n      \"geographic_scope\": \"National but concentrated effect in arid and marginalized counties (Garissa, Mandera, Wajir, Turkana, Samburu); urban informal settlements (Nairobi, Mombasa)\",\n      \"current_coverage_level\": \"Estimated functional CHV coverage ~50% (wide county variation: 20\u201380%)\"\n    },\n    \"who_essential_services_gap\": \"Preventive services (health promotion, community case management)\",\n    \"coverage_completeness_analysis\": {\n      \"service_availability\": \"Limited\",\n      \"geographic_accessibility\": \"Variable - good in some counties, poor in remote/arid counties\",\n      \"financial_accessibility\": \"Mostly affordable to users but sustainability issues due to lack of CHV financing\",\n      \"quality_adequacy\": \"Suboptimal (training, supervision and SOPs inconsistent)\"\n    },\n    \"integration_with_clinical_gaps\": \"Supports but differs from emergency obstetric and newborn care gaps \u2014 CHVs are critical for early identification/referral (antenatal visits, danger signs) but clinical EmONC service availability is separate.\",\n    \"recommended_coverage_interventions\": {\n      \"immediate_coverage_expansion\": [\n        \"Standardize and finance a CHV package (stipend, training, supervision) under PHC Fund/SHIF with performance monitoring\",\n        \"Provide basic commodity kits (malaria RDTs, oral rehydration salts, contraceptives) to CHVs\"\n      ],\n      \"service_integration_opportunities\": [\n        \"Link CHV outreach with immunization campaigns, TB/HIV community differentiation of care, NCD screening drives\"\n      ],\n      \"infrastructure_requirements\": [\n        \"Digital supervision tools (mobile reporting), transport allowances, supply chain linkage to Level 2 facilities\"\n      ]\n    },\n    \"implementation_pathway\": {\n      \"county_integration\": \"Counties adopt standardized CHV package, integrate in county HR plans and provide top-ups via PHC Fund; CHV roles integrated into referral workflows\",\n      \"funding_mechanisms\": \"PHC Fund for recurrent CHV costs; SHIF to reimburse CHV\u2011facilitated referrals; county budgets co\u2011finance\",\n      \"timeline_realistic\": \"12\u201324 months (policy standardization 3\u20136 months; phased roll\u2011out 12\u201324 months)\"\n    }\n  },\n  {\n    \"gap_id\": \"COVERAGE_SERVICE_CATEGORY_02\",\n    \"gap_category\": \"service_category\",\n    \"gap_type\": \"Primary care diagnostic capacity (laboratory and point\u2011of\u2011care)\",\n    \"coverage_priority\": \"HIGH\",\n    \"description\": \"Primary care facilities (Level 2\u20133) frequently lack basic diagnostic tests (biochemistry, basic hematology, point\u2011of\u2011care glucose, rapid diagnostics) and trained lab staff, limiting evidence\u2011based management of common conditions (malaria, sepsis, NCDs).\",\n    \"kenya_health_system_context\": {\n      \"service_delivery_platform\": \"Level 2\u20133 (dispensaries, health centres)\",\n      \"population_impact\": \"Rural populations and peri\u2011urban poor who rely on primary care for first contact\",\n      \"geographic_scope\": \"Widespread gaps, worse in small counties and remote sub\u2011counties (Northern and ASAL counties)\",\n      \"current_coverage_level\": \"Estimated availability of basic diagnostics at Level 2\u20133 ~40%\"\n    },\n    \"who_essential_services_gap\": \"Curative services (diagnostic capacity for primary care management)\",\n    \"coverage_completeness_analysis\": {\n      \"service_availability\": \"Limited\",\n      \"geographic_accessibility\": \"Limited (many communities must travel to Level 4+ for tests)\",\n      \"financial_accessibility\": \"Limited \u2014 out\u2011of\u2011pocket testing common when not provided free\",\n      \"quality_adequacy\": \"Suboptimal (equipment maintenance, QC and trained personnel lacking)\"\n    },\n    \"integration_with_clinical_gaps\": \"Relates to cancer and imaging gaps in higher levels but focuses on basic diagnostics required to manage most primary care conditions, not specialised imaging.\",\n    \"recommended_coverage_interventions\": {\n      \"immediate_coverage_expansion\": [\n        \"Deploy standard essential point\u2011of\u2011care test (POCT) packages to Level 2\u20133 (malaria RDT, urine dipstick, glucometer, Hb, RPR/HIV rapid tests)\",\n        \"Task\u2011shift training and mentorship for facility staff in POCT use and quality control\"\n      ],\n      \"service_integration_opportunities\": [\n        \"Integrate POCT into NCD and maternal health visits, HIV/TB screening and referral algorithms\"\n      ],\n      \"infrastructure_requirements\": [\n        \"Cold chain where needed, basic lab benches, QA systems, supply chain strengthening\"\n      ]\n    },\n    \"implementation_pathway\": {\n      \"county_integration\": \"County labs to adopt hub\u2011and\u2011spoke model with Level 3 as hubs for confirmatory testing; county quality assurance teams supervise\",\n      \"funding_mechanisms\": \"PHC Fund procurement for POCT; SHIF reimbursement linked to diagnostics performed at accredited primary facilities\",\n      \"timeline_realistic\": \"6\u201318 months for POCT roll\u2011out and training; ongoing QA\"\n    }\n  },\n  {\n    \"gap_id\": \"COVERAGE_SERVICE_CATEGORY_03\",\n    \"gap_category\": \"service_category\",\n    \"gap_type\": \"Essential medicines and commodity security at primary level\",\n    \"coverage_priority\": \"HIGH\",\n    \"description\": \"Frequent stockouts of essential medicines and family planning commodities at Level 2\u20133 disrupt continuity of care, increase OOP spending and drive bypassing to higher levels.\",\n    \"kenya_health_system_context\": {\n      \"service_delivery_platform\": \"Level 2\u20133 primarily; impacts Level 1 outreach services\",\n      \"population_impact\": \"Pregnant women, children, NCD patients, contraceptive users, rural poor\",\n      \"geographic_scope\": \"National with higher stockout rates in remote counties and during supply chain shocks\",\n      \"current_coverage_level\": \"Estimated continuous availability of key tracer medicines at primary care ~55%\"\n    },\n    \"who_essential_services_gap\": \"Curative services (essential medicines provision)\",\n    \"coverage_completeness_analysis\": {\n      \"service_availability\": \"Limited\",\n      \"geographic_accessibility\": \"Variable with remote clinics frequently out of stock\",\n      \"financial_accessibility\": \"Limited \u2014 patients purchase meds OOP when stockouts occur\",\n      \"quality_adequacy\": \"Suboptimal (expiry management, forecasting weaknesses)\"\n    },\n    \"integration_with_clinical_gaps\": \"Essential medicines gaps compound clinical gaps (e.g., in surgical and emergency care) by limiting peri\u2011operative and chronic disease management, but this gap focuses on supply chain and availability rather than clinical capacity.\",\n    \"recommended_coverage_interventions\": {\n      \"immediate_coverage_expansion\": [\n        \"Strengthen county-led quantification and push/pull supply systems for PHC facilities; procure buffer stocks for remote clinics\",\n        \"Introduce performance\u2011based supply indicators tied to PHC Fund disbursements\"\n      ],\n      \"service_integration_opportunities\": [\n        \"Align commodity forecasting across programs (maternal, HIV, NCDs) to maximize procurement efficiencies\"\n      ],\n      \"infrastructure_requirements\": [\n        \"Improved storage at facility level, supply chain information systems (eLMIS) integration to county DHIS2\"\n      ]\n    },\n    \"implementation_pathway\": {\n      \"county_integration\": \"Counties incorporate essential medicine performance metrics into annual workplans and allocate PHC funds for logistics; SHIF lists medicines for reimbursement to reduce OOP\",\n      \"funding_mechanisms\": \"PHC Fund for recurrent procurement and storage; SHIF reimbursements for medicines provided during accredited service encounters\",\n      \"timeline_realistic\": \"6\u201324 months (short\u2011term buffer stocks immediately; system fixes within 12\u201324 months)\"\n    }\n  },\n  {\n    \"gap_id\": \"COVERAGE_CARE_LEVEL_01\",\n    \"gap_category\": \"care_level\",\n    \"gap_type\": \"Referral and transport system weaknesses\",\n    \"coverage_priority\": \"HIGH\",\n    \"description\": \"Fragmented ambulance services, poor referral communication, and no standardized county ambulance dispatch lead to delays in time\u2011sensitive referrals (medical, surgical, trauma).\",\n    \"kenya_health_system_context\": {\n      \"service_delivery_platform\": \"Inter\u2011level (Level 2\u20136 referrals), emergency corridor\",\n      \"population_impact\": \"All age groups requiring urgent transfer \u2014 trauma victims, surgical emergencies, severe medical cases from rural areas\",\n      \"geographic_scope\": \"Nationwide, acute impact in remote and sparsely populated counties (ASALs)\",\n      \"current_coverage_level\": \"Estimated coverage of functional ambulance referral system ~30%\"\n    },\n    \"who_essential_services_gap\": \"Emergency care services (timely access to higher\u2011level care)\",\n    \"coverage_completeness_analysis\": {\n      \"service_availability\": \"Limited\",\n      \"geographic_accessibility\": \"Poor in remote regions (long travel times)\",\n      \"financial_accessibility\": \"Often expensive or unavailable - high indirect costs\",\n      \"quality_adequacy\": \"Suboptimal (lack of trained pre\u2011hospital staff, no standard triage/ referral protocols)\"\n    },\n    \"integration_with_clinical_gaps\": \"Supports emergency obstetric/newborn care and critical care pathways but targets system processes (transport and communication) rather than clinical service content.\",\n    \"recommended_coverage_interventions\": {\n      \"immediate_coverage_expansion\": [\n        \"Establish county ambulance hub networks with GPS dispatch and triage protocols; use private fleet contracting where feasible\",\n        \"Standardize referral forms and digital referral tracking integrated into DHIS2\"\n      ],\n      \"service_integration_opportunities\": [\n        \"Link ambulance services to CHV early detection and to facility triage for time\u2011sensitive referrals (e.g., stroke, trauma, obstetric emergencies)\"\n      ],\n      \"infrastructure_requirements\": [\n        \"Ambulance vehicles, communication infrastructure, fuel/subsidy schemes, pre\u2011hospital care training\"\n      ]\n    },\n    \"implementation_pathway\": {\n      \"county_integration\": \"Counties develop ambulance service plans, integrate with emergency call centres and hospital on\u2011call rosters\",\n      \"funding_mechanisms\": \"Emergency, Chronic and Critical Illness Fund for acute transport start\u2011up; SHIF to reimburse transfers tied to approved referral pathways; county budgets for recurrent costs\",\n      \"timeline_realistic\": \"6\u201336 months (urban hubs faster; remote county coverage requires phased scale up over 18\u201336 months)\"\n    }\n  },\n  {\n    \"gap_id\": \"COVERAGE_CARE_LEVEL_02\",\n    \"gap_category\": \"care_level\",\n    \"gap_type\": \"Emergency unit readiness at secondary hospitals\",\n    \"coverage_priority\": \"HIGH\",\n    \"description\": \"Many Level 4 county hospitals lack organized emergency units with trained staff, triage systems, essential emergency drugs and equipment, compromising timely acute care for trauma, sepsis and acute NCD events.\",\n    \"kenya_health_system_context\": {\n      \"service_delivery_platform\": \"Level 4 (county hospitals) with referral links to Level 5\",\n      \"population_impact\": \"Urban and rural populations reliant on county hospitals for emergency care\",\n      \"geographic_scope\": \"County hospitals nationally; worse in smaller counties with limited budgets\",\n      \"current_coverage_level\": \"Estimated fully operational emergency units in Level 4 hospitals ~40%\"\n    },\n    \"who_essential_services_gap\": \"Emergency care services (facility readiness and emergency treatment)\",\n    \"coverage_completeness_analysis\": {\n      \"service_availability\": \"Limited\",\n      \"geographic_accessibility\": \"Moderate (hospitals exist but not fully functional emergency units)\",\n      \"financial_accessibility\": \"Mixed \u2014 some services require OOP when commodities lacking\",\n      \"quality_adequacy\": \"Suboptimal (triage and resuscitation protocols inconsistently applied)\"\n    },\n    \"integration_with_clinical_gaps\": \"Complementary to EmONC gaps (obstetric emergencies) but broader \u2014 covering trauma, surgical and medical emergencies not limited to maternal/newborn care.\",\n    \"recommended_coverage_interventions\": {\n      \"immediate_coverage_expansion\": [\n        \"Roll out WHO Basic Emergency Care training for facility teams and establish triage areas in Level 4 hospitals\",\n        \"Equip emergency units with essential resuscitation kits and emergency drug stocks\"\n      ],\n      \"service_integration_opportunities\": [\n        \"Integrate emergency data into county health information systems and SHIF reporting to track outcomes\"\n      ],\n      \"infrastructure_requirements\": [\n        \"Designated emergency unit space, oxygen supply reliability, basic monitoring equipment\"\n      ]\n    },\n    \"implementation_pathway\": {\n      \"county_integration\": \"Counties prioritize emergency unit upgrades in annual plans; integrate with ambulance referral pathways\",\n      \"funding_mechanisms\": \"SHIF and Emergency Fund for capital/initial kit purchases; PHC Fund and county recurrent budgets for staffing and maintenance\",\n      \"timeline_realistic\": \"6\u201324 months (training and basic equipment within 6\u201312 months; physical renovations 12\u201324 months)\"\n    }\n  },\n  {\n    \"gap_id\": \"COVERAGE_SERVICE_CATEGORY_04\",\n    \"gap_category\": \"service_category\",\n    \"gap_type\": \"Intensive care and critical care capacity (adult and paediatric)\",\n    \"coverage_priority\": \"HIGH\",\n    \"description\": \"Limited ICU beds, ventilators, trained critical care nurses and physicians at Level 4\u20136 resulting in constrained capacity to manage severe medical and surgical conditions, seasonal surges and public health emergencies.\",\n    \"kenya_health_system_context\": {\n      \"service_delivery_platform\": \"Level 4\u20136 (county, referral and national hospitals)\",\n      \"population_impact\": \"Severe cases across age groups, including trauma, sepsis, severe NCD exacerbations and perioperative critical care\",\n      \"geographic_scope\": \"Concentrated in urban and referral centres (Nairobi, Mombasa, Kisumu); northern and rural counties largely unserved\",\n      \"current_coverage_level\": \"Estimated functional ICU bed coverage nationally ~20% of estimated need\"\n    },\n    \"who_essential_services_gap\": \"Curative services (critical care and management of severe illness)\",\n    \"coverage_completeness_analysis\": {\n      \"service_availability\": \"Limited\",\n      \"geographic_accessibility\": \"Poor outside tertiary urban centres\",\n      \"financial_accessibility\": \"Expensive due to high-intensity care; limited SHIF tariffs for critical care\",\n      \"quality_adequacy\": \"Variable \u2014 equipment without trained staff reduces effectiveness\"\n    },\n    \"integration_with_clinical_gaps\": \"Relates to Critical Illness Fund entries in policy but focuses on expanding capacity and equitable geographic distribution rather than clinical guidelines.\",\n    \"recommended_coverage_interventions\": {\n      \"immediate_coverage_expansion\": [\n        \"Scale up high\u2011dependency units at Level 4 hospitals with basic ventilatory support and oxygen monitoring\",\n        \"Train multidisciplinary teams (nurses, anaesthetists) in critical care protocols\"\n      ],\n      \"service_integration_opportunities\": [\n        \"Link critical care capacity planning to surgical, obstetric and emergency services to maximize use\",\n        \"Use tele\u2011ICU mentorship from Level 6 national referral centres\"\n      ],\n      \"infrastructure_requirements\": [\n        \"Oxygen plants, reliable power, patient monitoring, ventilators, staff accommodation for shift patterns\"\n      ]\n    },\n    \"implementation_pathway\": {\n      \"county_integration\": \"Counties designate at least one Level 4 hospital as HDU hub; coordinate with regional referral hospitals for mentorship\",\n      \"funding_mechanisms\": \"Emergency, Chronic and Critical Illness Fund for capital; SHIF to define critical care reimbursement packages; county budgets for staffing\",\n      \"timeline_realistic\": \"18\u201336 months (HDU scale up feasible in 18 months; full ICU expansion longer)\"\n    }\n  },\n  {\n    \"gap_id\": \"COVERAGE_SERVICE_CATEGORY_05\",\n    \"gap_category\": \"service_category\",\n    \"gap_type\": \"Surgical workforce distribution and theatre capacity at county level\",\n    \"coverage_priority\": \"HIGH\",\n    \"description\": \"Despite an extensive annex of surgical procedures, there is uneven distribution of surgeons, anaesthetists and functioning theatres across counties, limiting access to essential, safe surgery within timely windows.\",\n    \"kenya_health_system_context\": {\n      \"service_delivery_platform\": \"Level 3\u20134 primarily (theatres in Level 4 county hospitals and Level 5 regional hospitals)\",\n      \"population_impact\": \"Patients needing general, obstetric, orthopaedic, and emergency surgery; rural populations disproportionately affected\",\n      \"geographic_scope\": \"Urban concentration of specialists in Nairobi, Mombasa and Kisumu; shortage in northern and small rural counties\",\n      \"current_coverage_level\": \"Access to essential surgical care within 2 hours estimated ~60% nationally but much lower in remote counties\"\n    },\n    \"who_essential_services_gap\": \"Curative services (surgical services and safe anaesthesia)\",\n    \"coverage_completeness_analysis\": {\n      \"service_availability\": \"Limited (procedures listed but capacity uneven)\",\n      \"geographic_accessibility\": \"Poor in remote counties; travel often >2 hours\",\n      \"financial_accessibility\": \"Expensive for patients when private providers used\",\n      \"quality_adequacy\": \"Variable \u2014 infection prevention and anaesthesia safety standards not uniform\"\n    },\n    \"integration_with_clinical_gaps\": \"Complements surgical entries in policy annex and the surgical services package but focuses on human resources and equitable distribution rather than procedural lists.\",\n    \"recommended_coverage_interventions\": {\n      \"immediate_coverage_expansion\": [\n        \"County surgical workforce plans including incentives/retention packages for specialists to underserved counties\",\n        \"Strengthen surgical hubs with outreach/supervision from Level 5 hospitals\"\n      ],\n      \"service_integration_opportunities\": [\n        \"Integrate surgical outreach with CHV referrals, ambulance networks and rehabilitation services\"\n      ],\n      \"infrastructure_requirements\": [\n        \"Functional theatres, sterilization equipment, blood bank linkages, perioperative monitoring\"\n      ]\n    },\n    \"implementation_pathway\": {\n      \"county_integration\": \"Counties create surgical service plans and partner with referral hospitals for mentorship and periodic specialist outreach camps\",\n      \"funding_mechanisms\": \"SHIF tariff alignment for surgical packages; county capital investments and PHC fund for outreach logistics\",\n      \"timeline_realistic\": \"12\u201336 months (staffing strategies over 12\u201324 months; infrastructure upgrades 18\u201336 months)\"\n    }\n  },\n  {\n    \"gap_id\": \"COVERAGE_SERVICE_CATEGORY_06\",\n    \"gap_category\": \"service_category\",\n    \"gap_type\": \"Blood transfusion services and safe blood availability\",\n    \"coverage_priority\": \"MEDIUM\",\n    \"description\": \"Inadequate blood collection, screening, storage and distribution systems lead to shortages at county hospitals, affecting obstetric haemorrhage, trauma and surgical safety.\",\n    \"kenya_health_system_context\": {\n      \"service_delivery_platform\": \"Level 4\u20136 hospitals; collection at designated centres\",\n      \"population_impact\": \"Pregnant/postpartum women, trauma patients, surgical patients\",\n      \"geographic_scope\": \"Regional disparities: better supply near national/regional centres; shortages in remote counties\",\n      \"current_coverage_level\": \"Availability of screened blood components for emergencies estimated ~40\u201360% depending on county\"\n    },\n    \"who_essential_services_gap\": \"Curative services (safe blood and transfusion services)\",\n    \"coverage_completeness_analysis\": {\n      \"service_availability\": \"Limited\",\n      \"geographic_accessibility\": \"Poor in remote/rural counties\",\n      \"financial_accessibility\": \"Often subsidized but logistic costs high; occasional OOP for private blood\",\n      \"quality_adequacy\": \"Suboptimal in some storage/ screening practices\"\n    },\n    \"integration_with_clinical_gaps\": \"Supports emergency obstetric and surgical services by ensuring availability of blood but focuses on systems for collection and distribution rather than clinical transfu\u00adsion protocols.\",\n    \"recommended_coverage_interventions\": {\n      \"immediate_coverage_expansion\": [\n        \"Strengthen county blood collection drives and community donor pools; ensure consistent screening capacity\",\n        \"Establish regional blood storage hubs with reliable cold chain\"\n      ],\n      \"service_integration_opportunities\": [\n        \"Coordinate blood availability with referral protocols and ambulance dispatch for time\u2011sensitive transfers\"\n      ],\n      \"infrastructure_requirements\": [\n        \"Cold chain equipment for blood storage, testing labs, transport logistics\"\n      ]\n    },\n    \"implementation_pathway\": {\n      \"county_integration\": \"Counties support blood donor mobilisation and maintain cold storage; integrate with regional hub operations\",\n      \"funding_mechanisms\": \"SHIF to cover costs of transfusion during accredited episodes; county health budgets and donor support for capital equipment\",\n      \"timeline_realistic\": \"12\u201324 months for hub establishment and system strengthening\"\n    }\n  },\n  {\n    \"gap_id\": \"COVERAGE_POPULATION_GROUP_01\",\n    \"gap_category\": \"population_group\",\n    \"gap_type\": \"Continuity of TB services including DR\u2011TB in remote areas\",\n    \"coverage_priority\": \"HIGH\",\n    \"description\": \"Diagnosis, linkage to care and adherence support for TB and drug\u2011resistant TB remain inconsistent in remote counties, with delays in laboratory turnaround and limited access to new TB diagnostics and second\u2011line drugs at Level 4 and below.\",\n    \"kenya_health_system_context\": {\n      \"service_delivery_platform\": \"Level 2\u20135 (case detection at primary; treatment at higher levels depending on regimen)\",\n      \"population_impact\": \"Rural populations, PLHIV, marginalized communities, contacts of index TB cases\",\n      \"geographic_scope\": \"Higher burden and service gaps in populous informal settlements and remote counties (coastal and ASAL zones)\",\n      \"current_coverage_level\": \"Estimated case detection and treatment completion vary; overall effective coverage ~60\u201370% with DR\u2011TB lower (~30\u201350% depending on county)\"\n    },\n    \"who_essential_services_gap\": \"Preventive and curative services (TB detection and continuity of care)\",\n    \"coverage_completeness_analysis\": {\n      \"service_availability\": \"Limited for DR\u2011TB services; moderate for drug\u2011sensitive TB\",\n      \"geographic_accessibility\": \"Limited in remote areas due to lab access and stock of second\u2011line drugs\",\n      \"financial_accessibility\": \"Treatment ostensibly free but access costs and travel pose barriers\",\n      \"quality_adequacy\": \"Variable \u2014 delays in diagnostics and follow\u2011up\"\n    },\n    \"integration_with_clinical_gaps\": \"Complements HIV service continuity and community health work; distinct from clinical priority gaps listed earlier.\",\n    \"recommended_coverage_interventions\": {\n      \"immediate_coverage_expansion\": [\n        \"Expand GeneXpert/rapid diagnostic networks with sample referral systems; decentralize DR\u2011TB treatment support including community DSD models\",\n        \"Provide adherence support (digital adherence technologies, CHV follow\u2011up)\"\n      ],\n      \"service_integration_opportunities\": [\n        \"Integrate TB screening with HIV, maternal and NCD clinics and CHV outreach\"\n      ],\n      \"infrastructure_requirements\": [\n        \"Specimen transport networks, cold chain for some medications, decentralised storage and dispensing points\"\n      ]\n    },\n    \"implementation_pathway\": {\n      \"county_integration\": \"Counties integrate TB services in PHC packages, allocate staff for sample transport and community follow\u2011up\",\n      \"funding_mechanisms\": \"PHC Fund for community adherence models; SHIF for reimbursing facility TB management episodes; donor transition support for diagnostics\",\n      \"timeline_realistic\": \"6\u201324 months (diagnostics expansion faster; DR\u2011TB decentralization over 12\u201324 months)\"\n    }\n  },\n  {\n    \"gap_id\": \"COVERAGE_SERVICE_CATEGORY_07\",\n    \"gap_category\": \"service_category\",\n    \"gap_type\": \"NCD primary care management (hypertension, diabetes, asthma)\",\n    \"coverage_priority\": \"HIGH\",\n    \"description\": \"Weak chronic care models at primary care level \u2014 poor screening, treatment initiation, follow\u2011up, monitoring and medication continuity for NCDs \u2014 leading to high uncontrolled disease and avoidable complications.\",\n    \"kenya_health_system_context\": {\n      \"service_delivery_platform\": \"Level 2\u20134 (primary care and county hospitals)\",\n      \"population_impact\": \"Adults (working age and older adults), urban poor with rising NCD burden\",\n      \"geographic_scope\": \"Nationwide; urban and peri\u2011urban counties show high prevalence but rural management systems weaker\",\n      \"current_coverage_level\": \"Effective coverage for hypertension/diabetes (diagnosed and controlled) estimated ~30\u201340%\"\n    },\n    \"who_essential_services_gap\": \"Curative and preventive services (chronic disease management and screening)\",\n    \"coverage_completeness_analysis\": {\n      \"service_availability\": \"Limited\",\n      \"geographic_accessibility\": \"Moderate in urban areas, poor in rural counties\",\n      \"financial_accessibility\": \"Limited \u2014 OOP for medicines common when public stocks fail\",\n      \"quality_adequacy\": \"Suboptimal (no standardised chronic care follow\u2011up or registries at PHC level)\"\n    },\n    \"integration_with_clinical_gaps\": \"Differs from specialist-level NCD interventions (e.g., cardiac rehab) by focusing on longitudinal primary care systems to prevent progression to specialist needs.\",\n    \"recommended_coverage_interventions\": {\n      \"immediate_coverage_expansion\": [\n        \"Introduce standardized NCD chronic care pathways at Level 2\u20133 with registries, appointment systems, and simplified treatment algorithms\",\n        \"Ensure consistent supply of core NCD medicines (antihypertensives, metformin, insulin where indicated)\"\n      ],\n      \"service_integration_opportunities\": [\n        \"Combine NCD screening with maternal/child clinics and HIV platforms for integrated multi\u2011morbid care\",\n        \"Use CHVs for adherence support and home follow\u2011up\"\n      ],\n      \"infrastructure_requirements\": [\n        \"Patient registers/EMR modules for NCDs, point\u2011of\u2011care HbA1c/glucose monitoring, training modules for clinical staff\"\n      ]\n    },\n    \"implementation_pathway\": {\n      \"county_integration\": \"Counties adopt NCD targets and integrate chronic care into PHC incentives and outreach schedules\",\n      \"funding_mechanisms\": \"PHC Fund to underwrite primary NCD medicines and clinics; SHIF to define and reimburse chronic care consultations and meds\",\n      \"timeline_realistic\": \"12\u201336 months for establishing registries, medication supply chains and staff capacity\"\n    }\n  },\n  {\n    \"gap_id\": \"COVERAGE_SERVICE_CATEGORY_08\",\n    \"gap_category\": \"service_category\",\n    \"gap_type\": \"Rehabilitation services beyond cardiac (stroke, musculoskeletal, prosthetics)\",\n    \"coverage_priority\": \"MEDIUM\",\n    \"description\": \"Rehabilitation services (physiotherapy, occupational therapy, prosthetics/orthotics, community\u2011based rehab) are scarce at Level 3\u20134, limiting recovery after stroke, injuries and surgery.\",\n    \"kenya_health_system_context\": {\n      \"service_delivery_platform\": \"Level 3\u20135 (some services at referral centres), community-based rehabilitation at Level 1 limited\",\n      \"population_impact\": \"Stroke survivors, trauma victims, people with disabilities, post\u2011surgical patients\",\n      \"geographic_scope\": \"Concentrated in urban referral hospitals; rural counties lack accessible services\",\n      \"current_coverage_level\": \"Estimated access to structured rehabilitation services ~25%\"\n    },\n    \"who_essential_services_gap\": \"Rehabilitative services\",\n    \"coverage_completeness_analysis\": {\n      \"service_availability\": \"Limited\",\n      \"geographic_accessibility\": \"Poor outside major urban centres\",\n      \"financial_accessibility\": \"Often expensive with OOP for private rehab\",\n      \"quality_adequacy\": \"Variable \u2014 few trained therapists and no standardized PHC rehab protocols\"\n    },\n    \"integration_with_clinical_gaps\": \"Complements but is distinct from cardiac rehabilitation gap by addressing a broader range of rehabilitation needs across conditions.\",\n    \"recommended_coverage_interventions\": {\n      \"immediate_coverage_expansion\": [\n        \"Train and deploy mid\u2011level rehabilitation workers to county hospitals; develop basic physiotherapy services at Level 3\",\n        \"Establish community\u2011based rehabilitation linkages using CHVs\"\n      ],\n      \"service_integration_opportunities\": [\n        \"Integrate rehab referrals from surgical, trauma, and NCD clinics; include prosthetics in surgical care pathways\"\n      ],\n      \"infrastructure_requirements\": [\n        \"Rehab workspaces, basic therapy equipment, assistive device procurement and maintenance\"\n      ]\n    },\n    \"implementation_pathway\": {\n      \"county_integration\": \"Counties include rehabilitation in essential PHC package and workforce plans; partner with NGOs for prosthetics programs\",\n      \"funding_mechanisms\": \"PHC Fund for basic rehab services; SHIF to include rehab encounter tariffs for higher\u2011level services\",\n      \"timeline_realistic\": \"12\u201336 months (training and basic services within 12 months; prosthetics scale up 24\u201336 months)\"\n    }\n  },\n  {\n    \"gap_id\": \"COVERAGE_SERVICE_CATEGORY_09\",\n    \"gap_category\": \"service_category\",\n    \"gap_type\": \"Palliative and end\u2011of\u2011life care integration\",\n    \"coverage_priority\": \"MEDIUM\",\n    \"description\": \"Palliative care services (pain management, psychosocial support, home\u2011based palliative care) are limited and not integrated into PHC or SHIF benefit packages, leaving terminal patients without standardized supportive care.\",\n    \"kenya_health_system_context\": {\n      \"service_delivery_platform\": \"Level 2\u20136 (home\u2011based care via CHVs limited), hospices concentrated in urban areas\",\n      \"population_impact\": \"Patients with advanced cancer, progressive NCDs, HIV with advanced disease, elderly\",\n      \"geographic_scope\": \"Concentrated in urban centres; rural counties lack services\",\n      \"current_coverage_level\": \"Palliative care coverage estimated ~20% nationally\"\n    },\n    \"who_essential_services_gap\": \"Palliative services\",\n    \"coverage_completeness_analysis\": {\n      \"service_availability\": \"Absent to limited\",\n      \"geographic_accessibility\": \"Poor outside urban centres\",\n      \"financial_accessibility\": \"Often OOP or NGO\u2011dependent\",\n      \"quality_adequacy\": \"Suboptimal (limited training, analgesic access challenges)\"\n    },\n    \"integration_with_clinical_gaps\": \"Differs from clinical cure\u2011focused gaps (e.g., cancer treatment) by addressing symptom relief and quality of life needs; should be linked to those services.\",\n    \"recommended_coverage_interventions\": {\n      \"immediate_coverage_expansion\": [\n        \"Incorporate basic palliative care training into PHC worker curricula and CHV outreach; ensure morphine/analgesic availability at Level 4\",\n        \"Develop home\u2011based palliative care protocols and referral linkages\"\n      ],\n      \"service_integration_opportunities\": [\n        \"Link palliative care to NCD, HIV and oncology services for continuum of care\"\n      ],\n      \"infrastructure_requirements\": [\n        \"Medication procurement (opioid balance and regulation), psychosocial support teams, tele\u2011palliative consultation systems\"\n      ]\n    },\n    \"implementation_pathway\": {\n      \"county_integration\": \"Counties adopt palliative care guidelines, integrate into PHC capacity building and home care services\",\n      \"funding_mechanisms\": \"PHC Fund for community\u2011based palliative care; SHIF to reimburse facility palliative consultations and medications\",\n      \"timeline_realistic\": \"6\u201324 months (training and medication access quickly; service scale\u2011up over 12\u201324 months)\"\n    }\n  },\n  {\n    \"gap_id\": \"COVERAGE_POPULATION_GROUP_02\",\n    \"gap_category\": \"population_group\",\n    \"gap_type\": \"Geriatric services and long\u2011term care\",\n    \"coverage_priority\": \"MEDIUM\",\n    \"description\": \"Lack of age\u2011appropriate services, geriatric assessment, dementia care and long\u2011term care options in PHC and county hospital settings as the older population increases.\",\n    \"kenya_health_system_context\": {\n      \"service_delivery_platform\": \"Level 2\u20134 (primary care and county hospitals), limited community long\u2011term care\",\n      \"population_impact\": \"Elderly population, people with chronic multimorbidity, dementia patients\",\n      \"geographic_scope\": \"Nationwide, but access worse in rural counties with high out\u2011migration of working age adults\",\n      \"current_coverage_level\": \"Estimated geriatric service availability ~15%\"\n    },\n    \"who_essential_services_gap\": \"Preventive and curative services across the life course (geriatric care)\",\n    \"coverage_completeness_analysis\": {\n      \"service_availability\": \"Absent to limited\",\n      \"geographic_accessibility\": \"Poor especially in rural settings\",\n      \"financial_accessibility\": \"High OOP for long\u2011term care options\",\n      \"quality_adequacy\": \"Suboptimal (few trained staff and no guidelines at PHC)\"\n    },\n    \"integration_with_clinical_gaps\": \"Complementary to NCD chronic care gap; focuses on age\u2011tailored assessments, polypharmacy and long\u2011term support rather than disease\u2011specific clinical interventions.\",\n    \"recommended_coverage_interventions\": {\n      \"immediate_coverage_expansion\": [\n        \"Introduce basic geriatric screening in PHC clinics, training on polypharmacy and dementia recognition\",\n        \"Pilot community\u2011based long\u2011term care and caregiver support models using CHVs\"\n      ],\n      \"service_integration_opportunities\": [\n        \"Integrate geriatric assessments into NCD clinics and home care programs\"\n      ],\n      \"infrastructure_requirements\": [\n        \"Training materials, home care kits, referral links to social services\"\n      ]\n    },\n    \"implementation_pathway\": {\n      \"county_integration\": \"Counties include geriatric care elements in PHC packages and social support programmes\",\n      \"funding_mechanisms\": \"PHC Fund for community and primary geriatric services; SHIF reimbursement of geriatric clinic visits where defined\",\n      \"timeline_realistic\": \"12\u201336 months (pilots 12 months; scale 24\u201336 months)\"\n    }\n  },\n  {\n    \"gap_id\": \"COVERAGE_POPULATION_GROUP_03\",\n    \"gap_category\": \"population_group\",\n    \"gap_type\": \"Adolescent\u2011friendly health services (sexual/reproductive health, substance use, mental health linkage)\",\n    \"coverage_priority\": \"HIGH\",\n    \"description\": \"Limited availability of confidential, accessible and age\u2011appropriate services for adolescents including contraception, STI services, mental health screening and substance use counselling.\",\n    \"kenya_health_system_context\": {\n      \"service_delivery_platform\": \"Level 2\u20134 (PHC clinics, youth centres), community outreach\",\n      \"population_impact\": \"Adolescents (10\u201319 years), particularly girls in rural and informal urban settings\",\n      \"geographic_scope\": \"Nationwide; hotspots in counties with early pregnancy and school dropout rates\",\n      \"current_coverage_level\": \"Adolescent\u2011friendly service coverage estimated ~30%\"\n    },\n    \"who_essential_services_gap\": \"Preventive and curative services for adolescents (SRH and mental health linkage)\",\n    \"coverage_completeness_analysis\": {\n      \"service_availability\": \"Limited\",\n      \"geographic_accessibility\": \"Moderate in urban centres, poor in rural areas\",\n      \"financial_accessibility\": \"Often free but confidentiality and acceptability barriers reduce effective access\",\n      \"quality_adequacy\": \"Suboptimal (staff not trained in adolescent\u2011friendly approaches)\"\n    },\n    \"integration_with_clinical_gaps\": \"Overlaps with mental health integration priorities but emphasises adolescent\u2011specific service models and SRH rather than adult mental health systems.\",\n    \"recommended_coverage_interventions\": {\n      \"immediate_coverage_expansion\": [\n        \"Establish adolescent\u2011friendly corners in PHC facilities with trained staff and youth outreach services\",\n        \"Scale school\u2011based SRH and mental health promotion with referral linkages\"\n      ],\n      \"service_integration_opportunities\": [\n        \"Use CHVs and community outreach to link adolescents to services; integrate SRH with HPV vaccination and NCD screening as age\u2011appropriate\"\n      ],\n      \"infrastructure_requirements\": [\n        \"Private consultation spaces, youth outreach kits, youth\u2011friendly IEC materials\"\n      ]\n    },\n    \"implementation_pathway\": {\n      \"county_integration\": \"Counties incorporate youth health targets into PHC service packages and partner with education and youth departments\",\n      \"funding_mechanisms\": \"PHC Fund for adolescent service operational costs; SHIF to include adolescent consultations in benefit package\",\n      \"timeline_realistic\": \"6\u201318 months for setting up youth corners and training\"\n    }\n  },\n  {\n    \"gap_id\": \"COVERAGE_SERVICE_CATEGORY_10\",\n    \"gap_category\": \"service_category\",\n    \"gap_type\": \"Child health preventive services and IMCI fidelity (excluding pneumonia oxygen)\",\n    \"coverage_priority\": \"HIGH\",\n    \"description\": \"While vaccination coverage is relatively high in many counties, other child preventive services \u2014 growth monitoring, Integrated Management of Childhood Illness (IMCI) implementation, nutrition screening and community follow\u2011up \u2014 are inconsistently delivered.\",\n    \"kenya_health_system_context\": {\n      \"service_delivery_platform\": \"Level 1\u20133 (community, dispensary, health centre)\",\n      \"population_impact\": \"Children under 5 years, caregivers in rural and informal urban settings\",\n      \"geographic_scope\": \"Nationwide gaps, worse in remote counties with pastoralist populations\",\n      \"current_coverage_level\": \"Composite coverage for growth monitoring/IMCI fidelity estimated ~60%\"\n    },\n    \"who_essential_services_gap\": \"Preventive and curative child health services\",\n    \"coverage_completeness_analysis\": {\n      \"service_availability\": \"Limited to moderate\",\n      \"geographic_accessibility\": \"Variable \u2014 outreach services inconsistent\",\n      \"financial_accessibility\": \"Mostly affordable but poor service availability drives access issues\",\n      \"quality_adequacy\": \"Suboptimal (IMCI training and supervision gaps)\"\n    },\n    \"integration_with_clinical_gaps\": \"Avoids duplication with pneumonia/oxygen clinical gap by focusing on broader child preventive and follow\u2011up systems rather than oxygen therapy.\",\n    \"recommended_coverage_interventions\": {\n      \"immediate_coverage_expansion\": [\n        \"Reinstate regular growth monitoring outreach and strengthen IMCI training + mentorship at Level 2\u20133\",\n        \"Link community malnutrition screening to rapid referral and ready\u2011to\u2011use therapeutic food supply chains\"\n      ],\n      \"service_integration_opportunities\": [\n        \"Combine child health outreaches with immunisation days and maternal health visits\"\n      ],\n      \"infrastructure_requirements\": [\n        \"Growth monitoring equipment, nutrition supply chains, CHV referral tools\"\n      ]\n    },\n    \"implementation_pathway\": {\n      \"county_integration\": \"Counties schedule routine outreaches and include child health performance in PHC reporting\",\n      \"funding_mechanisms\": \"PHC Fund for outreach and commodities; SHIF to reimburse facility child health visits under defined package\",\n      \"timeline_realistic\": \"6\u201318 months\"\n    }\n  },\n  {\n    \"gap_id\": \"COVERAGE_SERVICE_CATEGORY_11\",\n    \"gap_category\": \"service_category\",\n    \"gap_type\": \"Diagnostic imaging equity for routine imaging (X\u2011ray, ultrasound) at lower levels\",\n    \"coverage_priority\": \"MEDIUM\",\n    \"description\": \"Policy indicates imaging is concentrated at Level 4\u20136; however, lack of routine x\u2011ray and ultrasound at Level 3/4 limits timely diagnosis of common conditions (fractures, obstetric scans, abdominal emergencies).\",\n    \"kenya_health_system_context\": {\n      \"service_delivery_platform\": \"Level 3\u20134 (health centres and county hospitals) primarily affected\",\n      \"population_impact\": \"Patients requiring basic imaging \u2014 trauma patients, pregnant women needing ultrasound, patients with chest symptoms requiring x\u2011ray\",\n      \"geographic_scope\": \"Most counties have limited lower\u2011level imaging; urban referral centres better equipped\",\n      \"current_coverage_level\": \"Basic imaging availability at Level 3\u20134 estimated ~40%\"\n    },\n    \"who_essential_services_gap\": \"Curative services (diagnostic imaging for essential care)\",\n    \"coverage_completeness_analysis\": {\n      \"service_availability\": \"Limited at lower levels\",\n      \"geographic_accessibility\": \"Poor outside Level 4+ equipped facilities\",\n      \"financial_accessibility\": \"Out\u2011of\u2011pocket or travel costs often required\",\n      \"quality_adequacy\": \"Variable \u2014 maintenance and radiographer availability issues\"\n    },\n    \"integration_with_clinical_gaps\": \"Relates to policy imaging concentration but differs from cancer imaging gaps by focusing on routine imaging needed for common acute care and obstetric services.\",\n    \"recommended_coverage_interventions\": {\n      \"immediate_coverage_expansion\": [\n        \"Provide portable ultrasound units and basic digital x\u2011ray systems to priority Level 4 hospitals and selected Level 3 hubs\",\n        \"Train mid\u2011level staff in focused ultrasound use (e.g., FOCUS, obstetric) and tele\u2011radiology linkages\"\n      ],\n      \"service_integration_opportunities\": [\n        \"Combine imaging with emergency, maternal and trauma services; tele\u2011interpretation links to Level 5/6 radiologists\"\n      ],\n      \"infrastructure_requirements\": [\n        \"Stable power, image PACS or cloud storage solutions, maintenance contracts\"\n      ]\n    },\n    \"implementation_pathway\": {\n      \"county_integration\": \"Counties identify Level 3/4 hubs for imaging upgrade and link with referral hospitals for reporting\",\n      \"funding_mechanisms\": \"PHC Fund for portable ultrasound; SHIF to cover imaging tariffs at accredited facilities; targeted capital grants for x\u2011ray\",\n      \"timeline_realistic\": \"6\u201324 months\"\n    }\n  },\n  {\n    \"gap_id\": \"COVERAGE_SERVICE_CATEGORY_12\",\n    \"gap_category\": \"service_category\",\n    \"gap_type\": \"Health information systems and referral data use\",\n    \"coverage_priority\": \"MEDIUM\",\n    \"description\": \"Although DHIS2 is deployed, gaps exist in real\u2011time referral tracking, data quality, interoperability with eLMIS and SHIF claims systems, limiting performance monitoring and resource targeting.\",\n    \"kenya_health_system_context\": {\n      \"service_delivery_platform\": \"All levels (data flow across Level 1\u20136)\",\n      \"population_impact\": \"Entire population \u2014 affects planning and resource allocation\",\n      \"geographic_scope\": \"National; poorer data quality in remote counties and small facilities\",\n      \"current_coverage_level\": \"Reporting coverage ~80% but data quality and interoperability usable for decision\u2011making ~60%\"\n    },\n    \"who_essential_services_gap\": \"Cross\u2011cutting systems capacity affecting all WHO essential services\",\n    \"coverage_completeness_analysis\": {\n      \"service_availability\": \"Available but not fully fit for purpose\",\n      \"geographic_accessibility\": \"Accessible but variable data quality\",\n      \"financial_accessibility\": \"N/A (system gap)\",\n      \"quality_adequacy\": \"Suboptimal (incomplete, late or inconsistent reporting; poor referral tracking)\"\n    },\n    \"integration_with_clinical_gaps\": \"Enables measurement of clinical gaps (e.g., surgical, cancer delays) but is a system gap addressing monitoring rather than direct clinical service delivery.\",\n    \"recommended_coverage_interventions\": {\n      \"immediate_coverage_expansion\": [\n        \"Integrate referral module into DHIS2 with unique identifiers and digital referral tracking from Level 2\u20136\",\n        \"Improve data quality through targeted training, audits and feedback loops\"\n      ],\n      \"service_integration_opportunities\": [\n        \"Link DHIS2 with eLMIS and SHIF claims to monitor service availability, stockouts and utilization\"\n      ],\n      \"infrastructure_requirements\": [\n        \"Connectivity, facility computers/tablets, interoperability middleware and user support\"\n      ]\n    },\n    \"implementation_pathway\": {\n      \"county_integration\": \"Counties institutionalise data quality improvement cycles and use data for resource allocation\",\n      \"funding_mechanisms\": \"PHC Fund for facility ICT needs; SHIF administrative budgets for interoperability; partners for technical assistance\",\n      \"timeline_realistic\": \"6\u201318 months for module integration and training\"\n    }\n  },\n  {\n    \"gap_id\": \"COVERAGE_GEOGRAPHIC_ACCESS_01\",\n    \"gap_category\": \"geographic_access\",\n    \"gap_type\": \"Rural and remote county service deserts (northern/ASAL counties)\",\n    \"coverage_priority\": \"HIGH\",\n    \"description\": \"Geographic inequities leave large areas with minimal facility density and long travel times to any functional health facility, worsening preventable morbidity and mortality.\",\n    \"kenya_health_system_context\": {\n      \"service_delivery_platform\": \"All levels but limited physical facilities in ASAL and border regions\",\n      \"population_impact\": \"Pastoralist populations, internally displaced and nomadic groups in Garissa, Wajir, Mandera, Turkana\",\n      \"geographic_scope\": \"Northern and ASAL counties, border regions\",\n      \"current_coverage_level\": \"Access to a basic health facility within 2 hours in worst\u2011served counties estimated <50%\"\n    },\n    \"who_essential_services_gap\": \"Equitable access to WHO essential services (preventive, curative, emergency)\",\n    \"coverage_completeness_analysis\": {\n      \"service_availability\": \"Poor (few facilities and sparse outreach)\",\n      \"geographic_accessibility\": \"Poor (long distances, seasonal barriers)\",\n      \"financial_accessibility\": \"Limited (transport and opportunity costs high)\",\n      \"quality_adequacy\": \"Suboptimal due to staff shortages and irregular supplies\"\n    },\n    \"integration_with_clinical_gaps\": \"Geographic gap exacerbates clinical priority gaps (e.g., delayed cancer diagnosis, EmONC) but focuses on spatial accessibility solutions rather than condition\u2011specific clinical care.\",\n    \"recommended_coverage_interventions\": {\n      \"immediate_coverage_expansion\": [\n        \"Deploy mobile clinics and scheduled outreach (maternal, immunization, NCD screening) with CHV identification\",\n        \"Use telemedicine hubs at county hospitals linked to remote outreach points\"\n      ],\n      \"service_integration_opportunities\": [\n        \"Coordinate outreach across programs (immunization, TB, NCDs, SRH) to maximise visits\",\n        \"Cross\u2011sector linkages with transport and security agencies for access\"\n      ],\n      \"infrastructure_requirements\": [\n        \"Mobile clinic vehicles, solar power systems, portable diagnostics, network connectivity\"\n      ]\n    },\n    \"implementation_pathway\": {\n      \"county_integration\": \"County health departments plan outreach schedules aligned with community calendars and partner with NGOs for mobile services\",\n      \"funding_mechanisms\": \"PHC Fund for recurrent outreach costs; SHIF to reimburse accredited mobile clinic service packages; donor bridge financing for initial scale\",\n      \"timeline_realistic\": \"6\u201324 months (mobile services and telemedicine pilots within 6\u201312 months; scale\u2011up 18\u201324 months)\"\n    }\n  },\n  {\n    \"gap_id\": \"COVERAGE_GEOGRAPHIC_ACCESS_02\",\n    \"gap_category\": \"geographic_access\",\n    \"gap_type\": \"Urban primary care overcrowding and referral bypassing\",\n    \"coverage_priority\": \"MEDIUM\",\n    \"description\": \"High patient volumes and perceived low quality at primary care in urban informal settlements lead to bypassing to higher\u2011level hospitals, creating congestion, longer wait times and inefficiencies.\",\n    \"kenya_health_system_context\": {\n      \"service_delivery_platform\": \"Level 2\u20134 in urban areas; tertiary hospitals receive excess primary care cases\",\n      \"population_impact\": \"Residents of informal settlements in Nairobi, Mombasa, Kisumu, Eldoret\",\n      \"geographic_scope\": \"Urban counties with large informal settlements\",\n      \"current_coverage_level\": \"Effective primary care usage in urban poor groups estimated ~40% with high bypass rates\"\n    },\n    \"who_essential_services_gap\": \"Accessible, quality primary care services\",\n    \"coverage_completeness_analysis\": {\n      \"service_availability\": \"Available but perceived as poor\",\n      \"geographic_accessibility\": \"Physically accessible but functionally poor\",\n      \"financial_accessibility\": \"Mixed; cost not the sole barrier\",\n      \"quality_adequacy\": \"Suboptimal leading to loss of trust and bypassing\"\n    },\n    \"integration_with_clinical_gaps\": \"Impacts service utilization patterns that affect specialized services but is a systems and trust issue rather than a clinical content gap.\",\n    \"recommended_coverage_interventions\": {\n      \"immediate_coverage_expansion\": [\n        \"Strengthen staffing, extend hours and provide essential diagnostics at urban PHC facilities\",\n        \"Public information campaigns and community engagement to rebuild trust in PHC\"\n      ],\n      \"service_integration_opportunities\": [\n        \"Link PHC to referral hospitals through appointment and triage systems to reduce unnecessary referrals\"\n      ],\n      \"infrastructure_requirements\": [\n        \"Clinic expansion where feasible, patient flow improvements, digital appointment systems\"\n      ]\n    },\n    \"implementation_pathway\": {\n      \"county_integration\": \"Urban counties prioritize PHC strengthening in high\u2011burden facilities and include utilization metrics in performance contracts\",\n      \"funding_mechanisms\": \"PHC Fund for staffing and extended hours; SHIF to incentivize care at accredited primary facilities through differential tariffs\",\n      \"timeline_realistic\": \"6\u201318 months\"\n    }\n  },\n  {\n    \"gap_id\": \"COVERAGE_GEOGRAPHIC_ACCESS_03\",\n    \"gap_category\": \"geographic_access\",\n    \"gap_type\": \"Cross\u2011border and refugee population health service access\",\n    \"coverage_priority\": \"MEDIUM\",\n    \"description\": \"Border counties and refugee camps face strained health services with gaps in continuity, financing and integration with county health systems, causing gaps in maternal, child and communicable disease services.\",\n    \"kenya_health_system_context\": {\n      \"service_delivery_platform\": \"County facilities in border counties, health posts in camps, NGO and UNHCR partners\",\n      \"population_impact\": \"Refugee populations (Dadaab, Kakuma), cross\u2011border mobile populations\",\n      \"geographic_scope\": \"Border counties (Turkana, Garissa, Kwale, Mandera) and refugee settlements\",\n      \"current_coverage_level\": \"Service coverage variable; integrated county access limited \u2014 effective coverage for routine services in these populations ~50%\"\n    },\n    \"who_essential_services_gap\": \"Essential preventive and curative services for vulnerable populations\",\n    \"coverage_completeness_analysis\": {\n      \"service_availability\": \"Variable (NGO support often fills gaps)\",\n      \"geographic_accessibility\": \"Restricted due to administrative and logistic challenges\",\n      \"financial_accessibility\": \"Often subsidized by humanitarian partners, but coordination with SHIF limited\",\n      \"quality_adequacy\": \"Mixed depending on partner presence\"\n    },\n    \"integration_with_clinical_gaps\": \"This gap interacts with maternal and child service gaps and TB/HIV continuity but is focused on population groups with special access needs.\",\n    \"recommended_coverage_interventions\": {\n      \"immediate_coverage_expansion\": [\n        \"Formalize agreements between counties and humanitarian partners to integrate services and data sharing\",\n        \"Extend PHC outreach and referral pathways to refugee health posts\"\n      ],\n      \"service_integration_opportunities\": [\n        \"Leverage CHV networks and NGO resources to provide continuity of care for chronic conditions and vaccinations\"\n      ],\n      \"infrastructure_requirements\": [\n        \"Supply chain linkages, interoperable HIS for refugee health data, cold chain in camps\"\n      ]\n    },\n    \"implementation_pathway\": {\n      \"county_integration\": \"Counties coordinate with national government and UNHCR to co\u2011plan and finance integrated service delivery\",\n      \"funding_mechanisms\": \"PHC Fund to support outreach to mixed populations; SHIF policy clarity for reimbursement of services in camps; donor support for transition\",\n      \"timeline_realistic\": \"6\u201324 months depending on coordination complexity\"\n    }\n  },\n  {\n    \"gap_id\": \"COVERAGE_SERVICE_CATEGORY_13\",\n    \"gap_category\": \"service_category\",\n    \"gap_type\": \"Workforce distribution and retention in remote/arid counties\",\n    \"coverage_priority\": \"HIGH\",\n    \"description\": \"Chronic shortages and high turnover of skilled health workers (nurses, midwives, clinical officers, certain specialists) in remote and arid counties undermine service continuity and quality.\",\n    \"kenya_health_system_context\": {\n      \"service_delivery_platform\": \"All care levels in underserved counties (Level 2\u20134 primarily affected)\",\n      \"population_impact\": \"Residents of northern and ASAL counties; services like maternal health, chronic care and emergency care impacted\",\n      \"geographic_scope\": \"ASAL counties, sparsely populated regions, and some islands (Lamu)\",\n      \"current_coverage_level\": \"Estimated staffing adequacy in worst counties ~40% of required complement\"\n    },\n    \"who_essential_services_gap\": \"Cross\u2011cutting HRH for WHO essential services\",\n    \"coverage_completeness_analysis\": {\n      \"service_availability\": \"Limited due to staff shortages\",\n      \"geographic_accessibility\": \"Poor in remote postings\",\n      \"financial_accessibility\": \"N/A (workforce issue)\",\n      \"quality_adequacy\": \"Suboptimal due to lack of experienced clinicians and continuous training\"\n    },\n    \"integration_with_clinical_gaps\": \"Workforce shortages underpin many clinical gaps (e.g., surgical, obstetric), but this entry targets retention policies and distribution rather than single\u2011disease clinical interventions.\",\n    \"recommended_coverage_interventions\": {\n      \"immediate_coverage_expansion\": [\n        \"Implement financial and non\u2011financial incentive packages (housing, hardship allowances, career progression) for remote postings\",\n        \"Scale telemedicine and specialist outreach to supplement local capacity\"\n      ],\n      \"service_integration_opportunities\": [\n        \"Use staff rotation and hub\u2011and\u2011spoke mentoring between referral and county hospitals\",\n        \"Integrate training with continuous professional development credits\"\n      ],\n      \"infrastructure_requirements\": [\n        \"Staff housing, reliable utilities, internet connectivity for telemedicine\"\n      ]\n    },\n    \"implementation_pathway\": {\n      \"county_integration\": \"Counties adopt retention packages and link to national bonding/placement policies; partner with training institutions for rural placements\",\n      \"funding_mechanisms\": \"County HR budgets augmented by conditional grants; SHIF to reimburse for accredited services that require rural posting incentives\",\n      \"timeline_realistic\": \"12\u201336 months (policy adoption and incentive disbursement 12 months; retention effects observable 24\u201336 months)\"\n    }\n  },\n  {\n    \"gap_id\": \"COVERAGE_SERVICE_CATEGORY_14\",\n    \"gap_category\": \"service_category\",\n    \"gap_type\": \"Cold chain and vaccine delivery resilience in arid and remote regions\",\n    \"coverage_priority\": \"MEDIUM\",\n    \"description\": \"Cold chain failures and limited outreach scheduling in hot/arid regions compromise vaccine potency and reduce immunization coverage especially during seasonal mobility of pastoralist populations.\",\n    \"kenya_health_system_context\": {\n      \"service_delivery_platform\": \"Level 1\u20133 outreach and facility immunization points\",\n      \"population_impact\": \"Children and pregnant women in ASAL and remote counties\",\n      \"geographic_scope\": \"ASAL counties and hard\u2011to\u2011reach sub\u2011counties\",\n      \"current_coverage_level\": \"Routine immunization functional coverage variable; effective cold chain reliability in these areas ~50\u201360%\"\n    },\n    \"who_essential_services_gap\": \"Preventive services (immunization supply chain resilience)\",\n    \"coverage_completeness_analysis\": {\n      \"service_availability\": \"Available but compromised by cold chain lapses\",\n      \"geographic_accessibility\": \"Limited during seasonal movements\",\n      \"financial_accessibility\": \"Mostly free but indirect costs hinder uptake\",\n      \"quality_adequacy\": \"At risk due to cold chain instability\"\n    },\n    \"integration_with_clinical_gaps\": \"Supports pneumonia prevention and other immunization\u2011preventable disease control but is a supply/logistics gap rather than a clinical treatment gap.\",\n    \"recommended_coverage_interventions\": {\n      \"immediate_coverage_expansion\": [\n        \"Deploy solar direct\u2011drive refrigerators and vaccine carriers suitable for ASAL conditions; schedule flexible outreach aligned with pastoral movement\",\n        \"Strengthen vaccine stock visibility and cold chain monitoring (remote temperature loggers)\"\n      ],\n      \"service_integration_opportunities\": [\n        \"Integrate with mobile clinics providing integrated mother\u2011child services and NCD screening where feasible\",\n        \"Coordinate vaccination with food security and livestock outreach programs\"\n      ],\n      \"infrastructure_requirements\": [\n        \"Solar cold chain equipment, reliable transport, data loggers and training for cold chain management\"\n      ]\n    },\n    \"implementation_pathway\": {\n      \"county_integration\": \"Counties prioritize cold chain upgrades in their immunization plans and coordinate outreach with community leaders\",\n      \"funding_mechanisms\": \"PHC Fund for recurrent outreach costs and cold chain maintenance; partners/donors for initial capital investments; SHIF to cover facility\u2011based immunizations within benefit package\",\n      \"timeline_realistic\": \"6\u201318 months for equipment deployment and outreach rescheduling\"\n    }\n  },\n  {\n    \"gap_id\": \"COVERAGE_GEOGRAPHIC_ACCESS_04\",\n    \"gap_category\": \"geographic_access\",\n    \"gap_type\": \"Facility distribution and catchment mismatches\",\n    \"coverage_priority\": \"MEDIUM\",\n    \"description\": \"Facility locations, catchment sizes and service mixes are not systematically aligned with population density and travel patterns leading to underserved pockets even within counties with adequate aggregate facility counts.\",\n    \"kenya_health_system_context\": {\n      \"service_delivery_platform\": \"All facility levels, planning and GIS mapping needed\",\n      \"population_impact\": \"Communities living at the margins of facility catchments \u2014 often peri\u2011urban and remote rural hamlets\",\n      \"geographic_scope\": \"Scattered nationally; pronounced in rapidly urbanising peri\u2011urban zones and remote wards\",\n      \"current_coverage_level\": \"Effective geographic coverage (population within 2 km/30 min) variable; in many wards <70%\"\n    },\n    \"who_essential_services_gap\": \"Access to essential services through appropriate facility placement\",\n    \"coverage_completeness_analysis\": {\n      \"service_availability\": \"Facilities exist but location misalignment reduces functional accessibility\",\n      \"geographic_accessibility\": \"Variable with localized poor coverage\",\n      \"financial_accessibility\": \"Indirect costs increase when travel distances rise\",\n      \"quality_adequacy\": \"Facility quality may be adequate but underutilised due to access barriers\"\n    },\n    \"integration_with_clinical_gaps\": \"Affects reach of all clinical services including maternal care and chronic disease management but is a spatial planning and equity gap rather than a clinical capability issue.\",\n    \"recommended_coverage_interventions\": {\n      \"immediate_coverage_expansion\": [\n        \"Conduct facility catchment and travel time GIS mapping at county level to identify service deserts\",\n        \"Re\u2011allocate outreach and mobile services to identified gaps and consider facility relocation/upgrades where necessary\"\n      ],\n      \"service_integration_opportunities\": [\n        \"Establish satellite clinics or periodic services in underserved wards combining multiple programmatic needs\"\n      ],\n      \"infrastructure_requirements\": [\n        \"Geospatial analysis capacity, transport for outreach, temporary clinic infrastructure\"\n      ]\n    },\n    \"implementation_pathway\": {\n      \"county_integration\": \"Counties use mapping to inform annual investment and outreach plans; revise facility placement policies\",\n      \"funding_mechanisms\": \"County capital budgets for targeted facility upgrades; PHC Fund for outreach; SHIF to recognise accredited satellite service points\",\n      \"timeline_realistic\": \"6\u201324 months for mapping and initial re\u2011allocation; infrastructure changes 12\u201336 months\"\n    }\n  },\n  {\n    \"gap_id\": \"COVERAGE_SERVICE_CATEGORY_15\",\n    \"gap_category\": \"service_category\",\n    \"gap_type\": \"PHC funding and benefit package skew towards higher\u2011level services\",\n    \"coverage_priority\": \"HIGH\",\n    \"description\": \"Policy inputs indicate a concentration of SHIF entries and access points at Level 4\u20136, with limited PHC Fund allocations and primary-care service coverage in the SHIF benefit design \u2014 risking underinvestment in first\u2011contact care essential for UHC.\",\n    \"kenya_health_system_context\": {\n      \"service_delivery_platform\": \"System\u2011wide financing misalignment affecting Level 1\u20133 primarily\",\n      \"population_impact\": \"All populations, disproportionately affecting those who need primary care the most (rural poor, informal urban)\",\n      \"geographic_scope\": \"National policy and benefit design issue with local execution effects\",\n      \"current_coverage_level\": \"Proportion of SHIF/benefit emphasis at Level 2\u20133 currently low; PHC Fund allocations cover limited entitlements \u2014 estimated primary care package coverage ~35%\"\n    },\n    \"who_essential_services_gap\": \"Health financing and service coverage for preventive and basic curative services\",\n    \"coverage_completeness_analysis\": {\n      \"service_availability\": \"Primary care services available but not adequately funded\",\n      \"geographic_accessibility\": \"Physically accessible but limited by service scope and supplies\",\n      \"financial_accessibility\": \"Coverage gaps lead to higher OOP and bypassing\",\n      \"quality_adequacy\": \"Constrained by limited recurrent funding and human resources\"\n    },\n    \"integration_with_clinical_gaps\": \"Touches all clinical gaps by influencing where resources are allocated; distinct from clinical priorities since it is about benefit design and financing skew.\",\n    \"recommended_coverage_interventions\": {\n      \"immediate_coverage_expansion\": [\n        \"Rebalance SHIF benefit package to explicitly define and fund a basic PHC package with clear entitlements at Level 2\u20133\",\n        \"Increase PHC Fund allocation to cover core recurrent PHC costs (staff, medicines, diagnostics)\"\n      ],\n      \"service_integration_opportunities\": [\n        \"Use SHIF accreditation and reimbursement incentives to encourage cases to be managed at PHC where appropriate\",\n        \"Align PHC Fund performance indicators with SHIF contracting\"\n      ],\n      \"infrastructure_requirements\": [\n        \"Updated benefits management systems, provider payment reforms and claims processing that recognise PHC services\"\n      ]\n    },\n    \"implementation_pathway\": {\n      \"county_integration\": \"Counties revise benefit delivery plans to prioritise PHC, ring\u2011fence PHC Fund disbursements for primary services\",\n      \"funding_mechanisms\": \"PHC Fund to finance recurrent PHC entitlements; SHIF to develop PHC reimbursement tariffs and capitation models; transitional donor support for reform\",\n      \"timeline_realistic\": \"6\u201324 months for benefit redesign and pilots; scale up over 12\u201336 months\"\n    }\n  }\n]",
    "clinical_gaps_referenced": [
      {
        "category": "cardiovascular_rehabilitation_services",
        "type": "missing_essential_service",
        "description": "Comprehensive cardiac rehabilitation and structured secondary prevention services are largely absent..."
      },
      {
        "category": "cancer_early_detection_and_access_to_curative_treatment",
        "type": "insufficient_service_coverage",
        "description": "Late diagnosis and limited access to diagnostic imaging, pathology and radiotherapy contribute to hi..."
      },
      {
        "category": "pneumonia_prevention_and_oxygen_therapy",
        "type": "insufficient_service_coverage",
        "description": "Pneumonia is the leading registered cause of death yet gaps exist in preventive interventions (vacci..."
      },
      {
        "category": "emergency_obstetric_and_newborn_care",
        "type": "service_capacity_gap",
        "description": "Emergency obstetric and neonatal care (EmONC) services are uneven across counties, contributing to p..."
      },
      {
        "category": "mental_health_services_integration",
        "type": "service_delivery_gap",
        "description": "Mental health services remain fragmented with inadequate integration into primary care, severe workf..."
      }
    ]
  },
  "total_policy_services": 97,
  "total_annex_procedures": 728,
  "total_ai_contradictions": 6,
  "total_ai_gaps": 5,
  "total_coverage_gaps": 24,
  "total_all_gaps": 29,
  "gap_analysis_breakdown": {
    "clinical_priority_gaps": 5,
    "systematic_coverage_gaps": 24,
    "comprehensive_total": 29
  },
  "unique_insights_summary": {
    "total_runs": 73,
    "current_run_gaps": 29,
    "current_run_contradictions": 6,
    "total_unique_gaps": 99,
    "total_unique_contradictions": 29,
    "high_priority_gaps": 0,
    "high_severity_contradictions": 0,
    "latest_discovery": "outputs_run_20250826_164516"
  },
  "analysis_metadata": {
    "analysis_time_seconds": 5.83,
    "approach": "INTEGRATED_COMPREHENSIVE",
    "timestamp": "2025-08-27 14:29:36"
  }
}